id,datetime,created_at,text
698201353848537088,2016-02-12 17:45:49,12-02-2016 17:45:49,"Fui prontamente atendido, com respostas vindas de diversos membros com ações planejadas e já em andamento no combate ao inseto."
698200714020044800,2016-02-12 17:43:16,12-02-2016 17:43:16,"Na mensagem, solicitei o empenho de todos na luta contra o Aedes aegypti e a ameaça do zika, da dengue e da chikungunya."
698200121343926272,2016-02-12 17:40:55,12-02-2016 17:40:55,"Enviei, esta semana, correspondência aos membros do Conselho de Desenvolvimento Econômico e Social (CDES)."
698128029344731136,2016-02-12 12:54:27,12-02-2016 12:54:27,Saiba mais: https://t.co/BAYMP3vxgb
698126967128911872,2016-02-12 12:50:14,12-02-2016 12:50:14,"Isso significa + empregos e - poluição, contribuindo para q nossa matriz energética continue sendo uma das + limpas e modernas do mundo."
698126373102215169,2016-02-12 12:47:52,12-02-2016 12:47:52,"Somente no ano passado, o banco destinou R$ 7,4 bi para 82 novos projetos do setor, um crescimento de quase 13% em comparação com 2014."
698125889079549952,2016-02-12 12:45:57,12-02-2016 12:45:57,O @bndes_imprensa se consolidou em 2015 como o principal financiador da energia eólica no Brasil. https://t.co/59VgjuNwEe
697831711913156608,2016-02-11 17:16:59,11-02-2016 17:16:59,Veja mais: https://t.co/daVOiTSmd7
697831193967009793,2016-02-11 17:14:56,11-02-2016 17:14:56,Em 2015 também foram produzidos mais filmes e sete deles superaram a marca de um milhão de espectadores.
697830658371096577,2016-02-11 17:12:48,11-02-2016 17:12:48,"Contrariando expectativas pessimistas, as produções brasileiras atraíram 22,5 milhões de espectadores, 18% a mais do que em 2014."
697829972023631873,2016-02-11 17:10:05,11-02-2016 17:10:05,Mas esses não foram os únicos motivos de celebração para o cinema nacional em 2015. https://t.co/oUTfyPHKgu
697829485538893824,2016-02-11 17:08:09,11-02-2016 17:08:09,"""Que Horas Ela Volta?"" ganhou vários prêmios e ""O Menino e o Mundo"" concorrerá ao #Oscar2016."
697764701757947904,2016-02-11 12:50:43,11-02-2016 12:50:43,"Vamos seguir em frente para eliminar essa ameaça, com enfoque especial nas regiões mais afetadas pela doença. https://t.co/he76VwV73x"
697762304490893313,2016-02-11 12:41:11,11-02-2016 12:41:11,"Já foram visitados mais de 20 milhões de unidades, onde são realizadas a identificação de focos e fornecidas orientações aos moradores."
697761617614921728,2016-02-11 12:38:28,11-02-2016 12:38:28,"Para combater o Aedes aegypti, agentes de saúde e das Forças Armadas seguem trabalhando na vistoria de imóveis em todo o país."
697409877266800640,2016-02-10 13:20:46,10-02-2016 13:20:46,Saiba mais:  https://t.co/rPNSPQKT3k https://t.co/jMjXQy0Wpz
697408671102464000,2016-02-10 13:15:59,10-02-2016 13:15:59,"Vencedor do Prêmio Nobel da Paz em 2014, @k_satyarthi se disse impressionado com os efeitos do Bolsa Família na redução das desigualdades."
697407380309614593,2016-02-10 13:10:51,10-02-2016 13:10:51,"Definindo-se como um ""embaixador do Bolsa Família"", o indiano @k_satyarthi esteve recentemente no Brasil para visitar o @MDSComunicacao."
697053817196646400,2016-02-09 13:45:55,09-02-2016 13:45:55,Veja mais: https://t.co/xV9h7XsQvm
697052532112232448,2016-02-09 13:40:48,09-02-2016 13:40:48,Ele acredita que essa pluralidade de ideias ajudará a enriquecer os debates e a encontrar soluções para o Brasil superar a recessão.
697051194804592641,2016-02-09 13:35:30,09-02-2016 13:35:30,"A riqueza do órgão, segundo Trabuco, está na diversidade de seus membros. https://t.co/WfNWXNwdQH"
697050274859503616,2016-02-09 13:31:50,09-02-2016 13:31:50,"Presidente do @Bradesco, uma das mais importantes instituições financeiras do país, Luiz Carlos Trabuco também aprovou a volta do Conselhão."
696878814840942592,2016-02-09 02:10:31,09-02-2016 02:10:31,Veja em https://t.co/xV9h7XsQvm o que ela e outras personalidades afirmaram sobre a reativação do @cdes_brasil. https://t.co/fjlLvkDWfo
696696456242204676,2016-02-08 14:05:53,08-02-2016 14:05:53,"Uma das maiores lideranças empresariais do país, @luizatrajano acredita que só a união poderá recolocar o Brasil no caminho do crescimento."
695597946386190336,2016-02-05 13:20:48,05-02-2016 13:20:48,Saiba em https://t.co/cUcRVfZWW2 o que Creuza Oliveira achou da reativação do Conselhão. https://t.co/ZkrOGghR8J
695596698173833216,2016-02-05 13:15:51,05-02-2016 13:15:51,Foi pensando em ampliar a diversidade do @cdes_brasil que o governo convidou pela primeira vez uma representante das empregadas domésticas.
695595426054012928,2016-02-05 13:10:47,05-02-2016 13:10:47,Um grande fórum de debates onde todos os segmentos da sociedade têm a sua voz e a sua vez.
695329048491331589,2016-02-04 19:32:18,04-02-2016 19:32:18,"Mas o mosquito vive na rua e nas casas. Assim, cada um de nós temos que dar a nossa contribuição para vencermos essa batalha."
695327328612794368,2016-02-04 19:25:28,04-02-2016 19:25:28,"O governo está se esforçando para fazer o que lhe cabe, pensando tanto no presente como no futuro. #zikazero https://t.co/cr8bLGA8rz"
695326144678223872,2016-02-04 19:20:46,04-02-2016 19:20:46,A melhor forma de lutar contra o Aedes Aegypti é contaminar a consciência de todos de que essa tarefa não passa só pelo serviço público.
695220422107856896,2016-02-04 12:20:39,04-02-2016 12:20:39,O trabalho será dividido em 4 etapas. Saiba quais são elas em: https://t.co/XQonJW82xx #zikazero
695219183315980288,2016-02-04 12:15:44,04-02-2016 12:15:44,"Serão 220 mil militares, cerca de 60% do efetivo das Forças, inteiramente dedicados a evitar a proliferação do vetor em 300 municípios."
695217908444721152,2016-02-04 12:10:40,04-02-2016 12:10:40,É por isso que as Forças Armadas já começaram a reforçar sua participação nas ações de combate aos focos do mosquito.
695216616838160384,2016-02-04 12:05:32,04-02-2016 12:05:32,"O Brasil está em guerra contra o Aedes Aegypti, o inimigo número 1 da saúde pública. #zikazero https://t.co/vFK7eAXqEF"
694961213122437120,2016-02-03 19:10:39,03-02-2016 19:10:39,Veja mais detalhes em: https://t.co/XI4VB2XHWE https://t.co/EEZQ2hEWbD
694959925450162177,2016-02-03 19:05:32,03-02-2016 19:05:32,"Essas medidas devem normalizar o fluxo de empréstimos, alavancando investimentos e impulsionando a geração de emprego e renda."
694959121171349506,2016-02-03 19:02:20,03-02-2016 19:02:20,"Foi com esse objetivo q o ministro da Fazenda, Nelson Barbosa, anunciou um conjunto de ações q irão ampliar em R$ 83 bi a oferta de crédito."
694957386445021186,2016-02-03 18:55:27,03-02-2016 18:55:27,"Além de estreitar o diálogo com a sociedade, uma das metas mais importantes para 2016 é dar início ao processo de recuperação da economia."
694859211730227200,2016-02-03 12:25:20,03-02-2016 12:25:20,"Através de um Grupo de Alto Nível, os dois países vão trabalhar juntos para evitar o avanço do zika. #zikazero"
694858006413086721,2016-02-03 12:20:33,03-02-2016 12:20:33,Esse foi o resultado da conversa entre @dilmabr e @BarackObama no último fim de semana. https://t.co/mwIX3D9OAX
694856744225390592,2016-02-03 12:15:32,03-02-2016 12:15:32,Aprofundar a cooperação bilateral na área da saúde para reforçar o combate ao Aedes aegypti e desenvolver uma vacina contra o zika vírus.
694611983384080386,2016-02-02 20:02:56,02-02-2016 20:02:56,Isso significa que a conta de luz do brasileiro virá mais barata a partir de fevereiro. Leia mais em: https://t.co/knvV2wmsA8
694611575735480324,2016-02-02 20:01:19,02-02-2016 20:01:19,"A mudança ocorreu graças ao aumento do volume de chuvas, o q elevou o nível dos reservatórios e permitiu o desligamento das termelétricas."
694611321292247040,2016-02-02 20:00:18,02-02-2016 20:00:18,"Conforme a Aneel havia informado na semana passada, agora o consumidor pagará R$ 3, em vez dos antigos R$ 4,5, para cada 100 kWh consumidos."
694610298217578496,2016-02-02 19:56:14,02-02-2016 19:56:14,Está em vigor desde ontem o novo valor da bandeira vermelha. https://t.co/TeVf9SA1Y3
694515843426828289,2016-02-02 13:40:55,02-02-2016 13:40:55,"Não podemos admitir retrocessos. Defenda o Brasil, defenda a democracia. https://t.co/3sGWfCUL4t"
694515182798802944,2016-02-02 13:38:17,02-02-2016 13:38:17,O Brasil avançou muito nos últimos anos em termos de solidez e estabilidade institucional.
694240841121054720,2016-02-01 19:28:09,01-02-2016 19:28:09,"Com o governo e a sociedade juntos, cada um fazendo a sua parte, vamos mostrar que temos toda a capacidade de vencer essa guerra. #zikazero"
694239680833921024,2016-02-01 19:23:32,01-02-2016 19:23:32,Os testes para a produção da vacina contra a dengue avançam no @Butantan e uma parceria com os EUA vai acelerar a vacina contra o zika.
694239220735545344,2016-02-01 19:21:43,01-02-2016 19:21:43,As Forças Armadas e os agentes de saúde estão mobilizados em todo o país.
694238340049211392,2016-02-01 19:18:13,01-02-2016 19:18:13,O governo não vai poupar esforços e recursos para vencer a guerra contra o Aedes Aegypti. #zikazero https://t.co/voPT89XZRu
694145693284487168,2016-02-01 13:10:04,01-02-2016 13:10:04,Saiba mais: https://t.co/snfyqoMQaR
694145411926335488,2016-02-01 13:08:57,01-02-2016 13:08:57,Outros ganhadores do Nobel e nomes de grande reputação no cenário internacional também participarão do grupo.
694145201347170304,2016-02-01 13:08:07,01-02-2016 13:08:07,"@lulapelobrasil foi convidado pelo indiano @k_satyarthi, vencedor do Prêmio Nobel da Paz em 2014. https://t.co/4jVhMPwd8m"
694143996738867200,2016-02-01 13:03:20,01-02-2016 13:03:20,"Comprovando sua condição de grande liderança, @LulapeloBrasil participará de um conselho q atuará em defesa dos direitos das crianças."
693422245335687169,2016-01-30 13:15:21,30-01-2016 13:15:21,Estou otimista e confiante. Tricolores e rubro-negros terão muitas alegrias em 2016. #ECBahia #ECVitória
693420981940002816,2016-01-30 13:10:19,30-01-2016 13:10:19,Já devidamente uniformizado e torcendo para que @ecbahia e @ECVitoria comecem a temporada com o pé direito. https://t.co/bZ2qiC29Tl
693239212200448000,2016-01-30 01:08:02,30-01-2016 01:08:02,RT @inst_lula: Nota sobre depoimento de Lula ao Ministério Público: https://t.co/DY6snXKFZ7
693171454830080001,2016-01-29 20:38:47,29-01-2016 20:38:47,Acesse https://t.co/bBW8KmFrq1 e saiba + sobre a reunião que realizamos com 30 fabricantes de repelentes. #zikazero https://t.co/FQG5OpAIkv
693170844453978112,2016-01-29 20:36:22,29-01-2016 20:36:22,"Essa é mais uma das ações adotadas pelo gov. federal com o objetivo de reduzir ao máximo os casos de dengue, chikungunya e zika neste verão."
693170442887155712,2016-01-29 20:34:46,29-01-2016 20:34:46,As mulheres grávidas do Bolsa Família receberão repelentes para evitar as picadas do mosquito Aedes Aegypti e a proliferação do #ZikaVirus.
692826295374368768,2016-01-28 21:47:15,28-01-2016 21:47:15,Veja parte do meu discurso na abertura da 44ª Reunião do @cdes_brasil. https://t.co/IJc31w7iOR
692825328058798080,2016-01-28 21:43:24,28-01-2016 21:43:24,Acredito que melhor verdade da democracia é a que brota do conflito de ideias. #CDES
692824941419466754,2016-01-28 21:41:52,28-01-2016 21:41:52,"Sou apaixonado pelo diálogo, um devoto da participação social. #CDES"
692794861490180096,2016-01-28 19:42:21,28-01-2016 19:42:21,O diálogo e a cooperação de todos são as melhores armas para a retomada do desenvolvimento. #CDES https://t.co/G9PXuO5jr7
692791807361585154,2016-01-28 19:30:12,28-01-2016 19:30:12,Mas nós temos que ter um objetivo claro e buscar construir uma convergência com todos os segmentos. Essa é a meta do @cdes_brasil.
692790494477357057,2016-01-28 19:24:59,28-01-2016 19:24:59,"Não quero lançar expectativas exageradas, até porque não acredito em saídas mágicas."
692789015418945537,2016-01-28 19:19:07,28-01-2016 19:19:07,A reativação do @cdes_brasil  representa a união da sociedade em torno de um objetivo comum: o crescimento e a prosperidade do país.
692750521954897920,2016-01-28 16:46:09,28-01-2016 16:46:09,"Mas merece tratamento mais respeitoso, em razão da liderança política que ele é. https://t.co/PNJ4a6PduN"
692750051895017472,2016-01-28 16:44:17,28-01-2016 16:44:17,@LulapeloBrasil pode e deve ser investigado como todo e qualquer brasileiro.
692749625741156352,2016-01-28 16:42:36,28-01-2016 16:42:36,"Apesar dos esclarecimentos já apresentados, alguns insistem em carimbar um veredicto prévio, ferindo o devido processo legal."
692748863027953666,2016-01-28 16:39:34,28-01-2016 16:39:34,"Ontem, em entrevista à imprensa, comentei as novas tentativas de envolver @LulapeloBrasil a todo custo na operação Lava-Jato."
692447259913515009,2016-01-27 20:41:06,27-01-2016 20:41:06,Estamos confiantes de que os debates do Conselho resultarão em ideias q ajudarão o Brasil a voltar a crescer. https://t.co/CxYGSQkeei
692446310235004929,2016-01-27 20:37:20,27-01-2016 20:37:20,"Participarão pesquisadores, personalidades e um amplo leque de sindicalistas e empresários dos mais diversos ramos da economia."
692445083271041033,2016-01-27 20:32:27,27-01-2016 20:32:27,A nova composição do Conselho privilegiou a diversidade e a qualificação de seus membros.
692444142719352832,2016-01-27 20:28:43,27-01-2016 20:28:43,O órgão será reativado a partir de amanhã em reunião em que serão discutidas propostas de crescimento sustentável com distribuição da renda.
692443378034827270,2016-01-27 20:25:40,27-01-2016 20:25:40,Um dos nossos principais objetivos em 2016 é ampliar o diálogo com a sociedade através do Conselho de Desenvolvimento Econômico e Social.
692335568567582721,2016-01-27 13:17:17,27-01-2016 13:17:17,"Por causa do esforço deles e de decisões do governo, um novo Brasil emergiu e continuará florescendo por muito tempo."
692334453981614081,2016-01-27 13:12:51,27-01-2016 13:12:51,O que aconteceu de fato foi que milhares de jovens de baixa renda aproveitaram essa oportunidade para mudar de vida. https://t.co/jlLhmlzM9S
692333918251524096,2016-01-27 13:10:43,27-01-2016 13:10:43,Outro afirmava que os cotistas não conseguiriam chegar até o fim do curso e abandonariam a universidade. Nada disso se confirmou.
692333378679500800,2016-01-27 13:08:35,27-01-2016 13:08:35,Um deles dizia que o nível das universidades iria cair porque os cotistas não teriam capacidade de acompanhar o que estava sendo ensinado.
692332985312530432,2016-01-27 13:07:01,27-01-2016 13:07:01,"Quando os primeiros alunos negros ingressaram no ensino superior pelo sistema de cotas, muitos mitos foram difundidos."
692081128082116608,2016-01-26 20:26:13,26-01-2016 20:26:13,Os médicos estão cada vez mais aprovando o #MaisMedicos . Saiba mais em: https://t.co/9oIdIVR8WS
692079848844582912,2016-01-26 20:21:08,26-01-2016 20:21:08,Isso mostra que não é só o povo que está satisfeito com o programa. https://t.co/wLTEbJsXCa
692078723185643521,2016-01-26 20:16:40,26-01-2016 20:16:40,"Mesmo assim, 56% deles decidiram continuar por até mais três anos prestando serviços de saúde básica a quem mais precisa."
692077806197587969,2016-01-26 20:13:01,26-01-2016 20:13:01,"Com isso, eles teriam o direito de sair do programa e garantir a bonificação de 10% em exames para ingresso em residência médica."
692077063851884545,2016-01-26 20:10:04,26-01-2016 20:10:04,"Em janeiro e fevereiro deste ano, mais de 2 mil profissionais brasileiros completam um ano de atuação no Mais Médicos."
692004031443632128,2016-01-26 15:19:52,26-01-2016 15:19:52,Clique em https://t.co/ryU5QQX72D e leia a opinião de @dilmabr sobre esses e outros assuntos em entrevista ao jornal @elcomerciocom.
692003078623621120,2016-01-26 15:16:05,26-01-2016 15:16:05,Esse é o nosso maior compromisso e disso não abrimos mão. https://t.co/D5KHbkmvOf
692002422210846721,2016-01-26 15:13:28,26-01-2016 15:13:28,Dificuldades econômicas passageiras não servirão como desculpa para desmontar a rede de proteção social que construímos com tanto esforço.
692001695723868161,2016-01-26 15:10:35,26-01-2016 15:10:35,"A crise chegou, mas @dilmabr mantém o Bolsa Família, o Minha Casa, Minha Vida, o Pronatec e tantas outras conquistas sociais."
692001131246063617,2016-01-26 15:08:21,26-01-2016 15:08:21,"No passado, ao primeiro sinal de crise no horizonte, cortavam-se direitos e benefícios dos mais pobres. Agora é diferente."
692000693125775361,2016-01-26 15:06:36,26-01-2016 15:06:36,Isso se torna ainda mais importante em um momento de retração econômica como o que vivemos.
692000271208153089,2016-01-26 15:04:56,26-01-2016 15:04:56,"Em um país ainda marcado por fortes desigualdades, governar para os que mais precisam deveria ser a prioridade máxima de qualquer gestão."
691712681439563776,2016-01-25 20:02:09,25-01-2016 20:02:09,Clique em https://t.co/1Uu05HyLOz e veja mais.
691711067546894336,2016-01-25 19:55:44,25-01-2016 19:55:44,"Apesar de as secas continuarem intensas, o povo nordestino vive com muito mais dignidade, com comida na mesa e água durante todo o ano."
691709978051215360,2016-01-25 19:51:24,25-01-2016 19:51:24,"Com as ações sociais de @LulapeloBrasil e @dilmabr, especialmente o Bolsa Família e o Programa Cisternas, o Nordeste agora é outro."
691709359500476418,2016-01-25 19:48:57,25-01-2016 19:48:57,"Felizmente, essa realidade trágica ficou no passado. https://t.co/iAhLTZDoXF"
691708515891683332,2016-01-25 19:45:36,25-01-2016 19:45:36,"No passado, milhares de famílias eram obrigadas a deixar suas terras para fugir da fome e da pobreza e buscar melhores condições de vida."
691708274585001984,2016-01-25 19:44:38,25-01-2016 19:44:38,"Por muito tempo, a pintura ""Os Retirantes"", de Cândido Portinari, simbolizou a imagem que o Brasil tinha do semiárido nordestino."
691642455402356737,2016-01-25 15:23:06,25-01-2016 15:23:06,Saiba mais em: https://t.co/2jcAkqce0y
691642171351498752,2016-01-25 15:21:58,25-01-2016 15:21:58,"Mas o esforço deles só terá resultados duradouros com a colaboração de toda população, que também precisa se engajar nessa luta."
691641604021551112,2016-01-25 15:19:43,25-01-2016 15:19:43,"Até o momento, esse verdadeiro exército da Saúde já vistoriou mais de 7,4 milhões de casas em 19 estados. https://t.co/v1lCvLP4TP"
691641320507641856,2016-01-25 15:18:35,25-01-2016 15:18:35,A meta é visitar todas as residências do país e reduzir o índice de infestação do mosquito de 3% para 1% em todas as cidades brasileiras.
691640817027538944,2016-01-25 15:16:35,25-01-2016 15:16:35,"Em uma mobilização sem precedentes em anos recentes, o gov. federal formou uma força-tarefa para combater a proliferação do Aedes aegypti."
690870419830771712,2016-01-23 12:15:18,23-01-2016 12:15:18,"Hoje, a saúde chega em mais lugares e para mais brasileiros e vamos seguir trabalhando para ampliar ainda mais esses resultados."
690867889222586368,2016-01-23 12:05:15,23-01-2016 12:05:15,"Recentemente, nosso governo abriu uma nova convocatória para médicos que desejam atuar no programa."
690866792282112000,2016-01-23 12:00:53,23-01-2016 12:00:53,"Um sucesso na melhoria dos indicadores de saúde nas cidades por onde passa, o Mais Médicos vai seguir em frente em 2016."
690628856823353345,2016-01-22 20:15:25,22-01-2016 20:15:25,"Ela ajuda a fortalecer a agricultura familiar, beneficiando milhares de brasileiros que sustentam suas famílias com o que produzem."
690628278751739906,2016-01-22 20:13:07,22-01-2016 20:13:07,"A decisão, instituída em decreto por @dilmabr, reforça o Programa de Aquisição de Alimentos. https://t.co/TdUyIcOQOP"
690627526780162051,2016-01-22 20:10:08,22-01-2016 20:10:08,"A partir de 2016, todos os órgãos federais terão de comprar pelo menos 30% dos alimentos de uso interno da agricultura familiar."
690526811223150592,2016-01-22 13:29:55,22-01-2016 13:29:55,Clique em https://t.co/4C9LtcprA4 para saber mais.
690526391943700480,2016-01-22 13:28:15,22-01-2016 13:28:15,"Com água de qualidade para o consumo e para a agricultura, o Nordeste ficará muito mais forte para enfrentar os efeitos da seca."
690525149267922944,2016-01-22 13:23:19,22-01-2016 13:23:19,"A verdade é uma só: as obras seguem a todo vapor, já estão 80% concluídas e vão beneficiar 12 mi de nordestinos. https://t.co/tG9692MmU4"
690524628863860736,2016-01-22 13:21:15,22-01-2016 13:21:15,Não deixe que boatos se espalhem. Busque informações verdadeiras e combata as mentiras sobre as obras de integração do Rio São Francisco.
690261718803574789,2016-01-21 19:56:32,21-01-2016 19:56:32,"Nosso governo acredita que a presença de Moura enriquecerá os debates do Conselho, prestando importante contribuição ao país."
690260866470670336,2016-01-21 19:53:09,21-01-2016 19:53:09,O Conselhão foi criado em 2003 com o objetivo de exercitar a pluralidade e o diálogo com a sociedade civil. https://t.co/Nu4EE9dF15
690259925596008448,2016-01-21 19:49:25,21-01-2016 19:49:25,"Em nome de @dilmabr, enviei ao ator Wagner Moura convite para integrar o Conselho de Desenvolvimento Econômico e Social (CDES)."
690224490979160064,2016-01-21 17:28:37,21-01-2016 17:28:37,"Com mais amor e respeito, vamos fazer do Brasil um país melhor para todos. #eurespeitosuacrença https://t.co/uXd4qILlQ1"
690222313061666816,2016-01-21 17:19:57,21-01-2016 17:19:57,"Neste Dia de Combate à Intolerância Religiosa, independentemente de sua crença, lembre-se de valorizar e celebrar as diferenças."
690221793718747137,2016-01-21 17:17:53,21-01-2016 17:17:53,A maior riqueza do Brasil é a sua diversidade. É a extraordinária pluralidade de culturas e crenças que nos faz grande.
689930580625080324,2016-01-20 22:00:43,20-01-2016 22:00:43,É para defender essas conquistas e avançar ainda mais que seguimos em frente. #LulaFala https://t.co/y7rvy5Rozt
689930208510611458,2016-01-20 21:59:14,20-01-2016 21:59:14,Seguiremos trabalhando para incluir ainda mais brasileiros e mudar para melhor a vida do nosso povo.
689929887034032128,2016-01-20 21:57:58,20-01-2016 21:57:58,"A verdade é que, nos últimos 13 anos, o povo brasileiro avançou e conquistou muito, mas o nosso projeto não para por aqui."
689929246530207746,2016-01-20 21:55:25,20-01-2016 21:55:25,"Incomoda, como disse hoje o ex-presidente Lula em entrevista a blogueiros, que o pobre aprendeu a conquistar coisas."
689797034346450944,2016-01-20 13:10:03,20-01-2016 13:10:03,O @bolsafamilia já mudou e segue mudando milhões de vidas. Conheça mais detalhes dessa história em: https://t.co/P5CQYGeSp0
689795901158756352,2016-01-20 13:05:33,20-01-2016 13:05:33,"Com um empurrão do governo e muito esforço próprio, elas venceram a extrema pobreza e agora começam a caminhar com as próprias pernas."
689795291340521472,2016-01-20 13:03:07,20-01-2016 13:03:07,"Em MG, por exemplo, mais de 40 mil famílias pediram desligamento do programa no ano passado após terem conseguido melhorar de renda."
689794454031564801,2016-01-20 12:59:48,20-01-2016 12:59:48,Mas a realidade e a força de vontade de nosso povo estão sempre desmentindo as falácias dos preconceituosos. https://t.co/WkSLCoeVZV
689793641628483584,2016-01-20 12:56:34,20-01-2016 12:56:34,"Ele já seria falso pelo fato de ser inconcebível q um adulto deixe de trabalhar p/ receber um benefício que, na média, não ultrapassa R$168."
689793225142472704,2016-01-20 12:54:55,20-01-2016 12:54:55,"Sabe aquele argumento, tantas e tantas vezes repetido, de que o @bolsafamilia estimularia a preguiça?"
689567400929402883,2016-01-19 21:57:34,19-01-2016 21:57:34,"Com uma gestão + profissional, a qualidade do jogo irá melhorar, devolvendo aos brasileiros o orgulho de pertencer ao país do futebol."
689567177712754688,2016-01-19 21:56:41,19-01-2016 21:56:41,"Associadas ao patrocínio da Caixa a 10 clubes, essas medidas marcam o início de uma profunda e necessária reforma do futebol brasileiro."
689566849751711744,2016-01-19 21:55:23,19-01-2016 21:55:23,"Aprovada no ano passado, a nova legislação impõe exigências de boa gestão e transparência p/ os clubes q quiserem refinanciar suas dívidas."
689566699595653122,2016-01-19 21:54:47,19-01-2016 21:54:47,A entidade será responsável por fiscalizar as ações dos clubes que aderiram à Lei do Futebol (Profut). https://t.co/ZfzhYmVikC
689566482259378181,2016-01-19 21:53:55,19-01-2016 21:53:55,"Em mais um passo decisivo p/ modernizar nosso futebol, @dilmabr assinou hj a regulamentação da Autoridade Pública de Governança do Futebol."
689534990791606275,2016-01-19 19:48:47,19-01-2016 19:48:47,Veja mais informações em: https://t.co/sh5h0JjPB3
689534702345195520,2016-01-19 19:47:38,19-01-2016 19:47:38,As informações contidas no documento afastam o fantasma do racionamento que tanto assombrou os brasileiros no início dos anos 2000.
689531844820336640,2016-01-19 19:36:17,19-01-2016 19:36:17,É o que avalia o Comitê de Monitoramento do Setor Elétrico (CMSE) em nota técnica divulgada recentemente.
689531232451977216,2016-01-19 19:33:51,19-01-2016 19:33:51,As chuvas acima do esperado e a incorporação no ano passado de 6.428 MW de energia nova reforçaram a segurança do abastecimento energético.
689530927056314369,2016-01-19 19:32:38,19-01-2016 19:32:38,O risco de o Brasil sofrer com um apagão ou ter que racionar energia em 2016 é zero. https://t.co/pEasiiDkxh
689445063177338880,2016-01-19 13:51:26,19-01-2016 13:51:26,É só comparar o passado com o presente p/ perceber q @LulapeloBrasil e @dilmabr fizeram mais pela educação do q todos os outros governos.
689443800951889920,2016-01-19 13:46:26,19-01-2016 13:46:26,Essas ações resultaram em um aumento de 50% no número de estudantes matriculados no ensino superior. https://t.co/jvQI30gHtl
