id,datetime,created_at,text
755855881611448320,2016-07-20 20:04:19,20-07-2016 20:04:19,Ele também destacou o fato de o Ministério Público e o Senado terem inocentado @dilmabr no caso das pedaladas fiscais.
755855563175530499,2016-07-20 20:03:04,20-07-2016 20:03:04,"Em entrevista ao jornal Diário de Notícias, de Portugal, o músico Tom Zé não demonstrou qualquer receio em afirmar que Temer é um golpista."
755855214045835264,2016-07-20 20:01:40,20-07-2016 20:01:40,Mais uma importante voz do mundo artístico manifestou-se recentemente sobre a situação política do nosso país. https://t.co/KLXGsRDc2i
755457999200718848,2016-07-19 17:43:17,19-07-2016 17:43:17,Saiba mais: https://t.co/w0Ww4sOwkh
755457735177674752,2016-07-19 17:42:14,19-07-2016 17:42:14,Essa será a primeira vez que os argumentos do impeachment serão seriamente discutidos no Brasil. https://t.co/EAtJoHCyYz
755457281911848960,2016-07-19 17:40:26,19-07-2016 17:40:26,Será provado que a inexistência de crime de responsabilidade necessariamente configura a existência de um golpe.
755457093059174400,2016-07-19 17:39:41,19-07-2016 17:39:41,O objetivo do encontro é analisar detalhadamente as frágeis alegações jurídicas que fundamentaram a saída provisória de @dilmabr.
755456866189250560,2016-07-19 17:38:47,19-07-2016 17:38:47,Grandes juristas de várias partes do mundo se reúnem hoje e amanhã no no RJ para debater o processo de impeachment contra @dilmabr.
755393711731777536,2016-07-19 13:27:50,19-07-2016 13:27:50,Leia mais sobre a entrevista que concedi ao @GrupoMetropole:https://t.co/4VYt51OBxR
755388215360626688,2016-07-19 13:05:59,19-07-2016 13:05:59,"Por isso, seguimos lutando e tentando convencer os senadores a votarem contra a farsa que originou o governo Temer. https://t.co/4YxCAiAZQG"
755387873004752896,2016-07-19 13:04:38,19-07-2016 13:04:38,"Impeachment só pode acontecer se houver crime de responsabilidade e, como o MPF já atestou, @dilmabr não cometeu nenhum crime."
755387359097712641,2016-07-19 13:02:35,19-07-2016 13:02:35,"Nosso governo cometeu erros, é verdade. Mas nenhum desses erros justifica o impeachment de @dilmabr."
755162206942048256,2016-07-18 22:07:55,18-07-2016 22:07:55,"O julgamento é do povo e tenho certeza que, na hora certa, o povo saberá fazer essa escolha. Saiba mais: https://t.co/AOjQekH35M"
755162017632284673,2016-07-18 22:07:09,18-07-2016 22:07:09,"Mulher aguerrida e identificada com as causas populares, ela é a melhor alternativa para Salvador voltar a ser uma cidade de todos."
755161726698590208,2016-07-18 22:06:00,18-07-2016 22:06:00,@alice_portugal é a minha candidata na eleição para a prefeitura de Salvador. https://t.co/P6Jb6yGEOs
754024463423959041,2016-07-15 18:46:55,15-07-2016 18:46:55,Leia mais: https://t.co/OWVjqdVRh4
754024212357062656,2016-07-15 18:45:55,15-07-2016 18:45:55,Os golpistas também são entreguistas. https://t.co/IP5RFsvQSU
754024069536808960,2016-07-15 18:45:21,15-07-2016 18:45:21,A proposta também prevê o fim da destinação prioritária para Saúde e Educação dos recursos obtidos com a exploração do petróleo.
754023431398649856,2016-07-15 18:42:49,15-07-2016 18:42:49,"Com o apoio de Temer, os deputados aprovaram a urgência do projeto de José Serra que acaba com a condição de operadora única da Petrobras."
754022818132660224,2016-07-15 18:40:23,15-07-2016 18:40:23,"Uma das mais importantes conquistas do governo de @dilmabr, o regime de partilha do pré-sal está sob ataque dos golpistas."
753941411213537280,2016-07-15 13:16:54,15-07-2016 13:16:54,Leia mais: https://t.co/tykcf5R5db
753941190131810304,2016-07-15 13:16:01,15-07-2016 13:16:01,"É a mentira do século na política brasileira, como definiu @LulapeloBrasil. https://t.co/yWSFFvlV02"
753940863168970752,2016-07-15 13:14:43,15-07-2016 13:14:43,Uma farsa inventada para levar ao poder os que fracassaram sucessivamente nas urnas.
753940692293025792,2016-07-15 13:14:03,15-07-2016 13:14:03,"Apesar de estar previsto na Constituição, o impeachment, tal como está configurado no caso de Dilma, se transformou em uma grande farsa."
753940296862408704,2016-07-15 13:12:28,15-07-2016 13:12:28,"O fato é que autoridades técnicas e jurídicas, como o MPF, já reconheceram que @dilmabr não cometeu crime de responsabilidade."
753939953155997696,2016-07-15 13:11:07,15-07-2016 13:11:07,"Em público e em privado, por um ato falho ou em razão da mais cristalina sinceridade, o fato é q os próprios golpistas confessaram o golpe."
753689404800114690,2016-07-14 20:35:31,14-07-2016 20:35:31,"Em outras palavras, o MPF está dizendo que @dilmabr é honesta e não cometeu qualquer ato ilegal. Saiba mais: https://t.co/5tsbmcXOHt"
753689117729447937,2016-07-14 20:34:23,14-07-2016 20:34:23,"Esse é mais um duro golpe nos golpistas, que a cada dia encontram mais dificuldades para justificar o impeachment."
753688820072185856,2016-07-14 20:33:12,14-07-2016 20:33:12,"No parecer enviado à Justiça, o procurador Ivan Cláudio Marx conclui que tais práticas contábeis não configuram crime."
753688438604464129,2016-07-14 20:31:41,14-07-2016 20:31:41,O MPF determinou nesta quinta-feira o arquivamento das investigações a respeito das chamadas pedaladas fiscais. https://t.co/Hud2qot5Y8
753603265049288704,2016-07-14 14:53:14,14-07-2016 14:53:14,Saiba mais: https://t.co/X3CrQCjlYL
753602970739245056,2016-07-14 14:52:04,14-07-2016 14:52:04,"Sempre ao lado do povo, companhia que os golpistas mais temem, @LulapeloBrasil seguirá batalhando para denunciar o impeachment."
753602556757155840,2016-07-14 14:50:25,14-07-2016 14:50:25,@LulapeloBrasil disse que o contato com os brasileiros mais pobres fez voltar a surgir nele a vontade de viajar pelo país.
753602009052221441,2016-07-14 14:48:14,14-07-2016 14:48:14,"Em giro pelo Nordeste finalizado ontem, @LulapeloBrasil encontrou-se com movimentos sociais e participou de atos em defesa da democracia."
753601702251692034,2016-07-14 14:47:01,14-07-2016 14:47:01,Os golpistas que se cuidem: a maior liderança do Brasil está com a energia de um garoto para lutar. https://t.co/jf5wQ3XWq0
753233404217393152,2016-07-13 14:23:32,13-07-2016 14:23:32,Ajude seus amigos a aprender ou relembrar acontecimentos importantes a respeito desse triste momento da nossa História.
753233072305401856,2016-07-13 14:22:13,13-07-2016 14:22:13,Teste seus conhecimentos e compartilhe a pergunta. https://t.co/Z7WNpVlMXm
753232785893126145,2016-07-13 14:21:05,13-07-2016 14:21:05,O golpe completou dois meses. Você sabe tudo sobre o que aconteceu depois que o ilegítimo Michel Temer usurpou a presidência de @dilmabr?
752966194353889280,2016-07-12 20:41:44,12-07-2016 20:41:44,"Amplamente aprovado, o #MaisMédicos é uma conquista da qual o povo brasileiro jamais abrirá mão. https://t.co/Kucwmhsvt5"
752965763615588354,2016-07-12 20:40:02,12-07-2016 20:40:02,"Apesar da resistência da oposição, o programa está presente em mais de 4 mil cidades e atende mais de 63 milhões de brasileiros."
752965358890414080,2016-07-12 20:38:25,12-07-2016 20:38:25,"Criado por @dilmabr para solucionar a carência de profissionais de saúde em regiões carentes, o #MaisMédicos cresceu e se consolidou."
752964831939063809,2016-07-12 20:36:20,12-07-2016 20:36:20,Uma das mais importantes e revolucionárias políticas de saúde pública do nosso país e do mundo completou 3 anos. #Maismédicos
752882831353937921,2016-07-12 15:10:29,12-07-2016 15:10:29,"Um símbolo de dignidade, coragem e perseverança que permanecerá para sempre nos guiando. https://t.co/OkX1rK35jF"
752882550931161088,2016-07-12 15:09:22,12-07-2016 15:09:22,"Secretária da Sepromi na minha gestão como governador e posteriormente convidada para ser ministra de @dilmabr, Bairros é um símbolo."
752882249738121216,2016-07-12 15:08:10,12-07-2016 15:08:10,"Ter tido a oportunidade de conviver com uma mulher de tamanha sabedoria e integridade foi uma honra, uma lembrança que levarei para sempre."
752881966480027648,2016-07-12 15:07:03,12-07-2016 15:07:03,Sua luta para combater o racismo e melhorar a vida do povo negro inspirou e continuará inspirando todos q batalham por um Brasil mais justo.
752881674980122628,2016-07-12 15:05:53,12-07-2016 15:05:53,Bairros se destacou como uma das mais ativas vozes em defesa dos direitos da população negra no Brasil.
752881286344216576,2016-07-12 15:04:21,12-07-2016 15:04:21,Recebi com muita tristeza nesta manhã a notícia do falecimento de Luiza Bairros.
752487404888428545,2016-07-11 12:59:12,11-07-2016 12:59:12,Leia mais: https://t.co/G12pc86o19
752487222255976448,2016-07-11 12:58:28,11-07-2016 12:58:28,"Eleitor de @dilmabr, @emicida avalia que o impeachment sem respaldo legal fragiliza a nossa democracia. https://t.co/VKLajCRd7l"
752486922484932610,2016-07-11 12:57:17,11-07-2016 12:57:17,"""A questão do impedimento de @dilmabr é algo que me entristece muito, porque o princípio da democracia é o voto"", afirmou."
752486520494383104,2016-07-11 12:55:41,11-07-2016 12:55:41,O rapper @emicida é contra o impeachment de @dilmabr e manifestou suas críticas ao golpe em recente entrevista à rádio francesa RFI Brasil.
751433483692769280,2016-07-08 15:11:18,08-07-2016 15:11:18,Saiba mais: https://t.co/tqH8iJiK8M
751433292537274372,2016-07-08 15:10:32,08-07-2016 15:10:32,"Com a presidência da Câmara vaga, Temer, por sua vez, poderá colocar um aliado no comando da Casa."
751432953977245696,2016-07-08 15:09:11,08-07-2016 15:09:11,"No teatro encenado ontem, todos os golpistas sairiam ganhando: Cunha obteve a garantia de q o Planalto trabalhará para evitar sua cassação."
751432659998474240,2016-07-08 15:08:01,08-07-2016 15:08:01,"É o que denunciam os jornais de hoje. Segundo @JornalOGlobo, a renúncia de Cunha foi fruto de um acordo que contou com o aval de Temer."
751432378950746112,2016-07-08 15:06:54,08-07-2016 15:06:54,"Temer consulta Cunha com frequência, aceita indicações dele e age para tentar salvar o mandato do seu principal soldado do impeachment."
751432025278668800,2016-07-08 15:05:30,08-07-2016 15:05:30,Suas ações desde o golpe contra @dilmabr deixam explícita essa amizade. https://t.co/ACbobiGz0T
751431759183671296,2016-07-08 15:04:26,08-07-2016 15:04:26,Não adianta o que Michel Temer diga para tentar disfarçar a sua proximidade com Eduardo Cunha.
751144809444892672,2016-07-07 20:04:12,07-07-2016 20:04:12,"O lugar de #Cunha é fora da Câmara, é no banco dos réus. #ForaCunha"
751144425389260800,2016-07-07 20:02:41,07-07-2016 20:02:41,"Temos que continuar vigilantes, atentos, cobrando e pressionando os golpistas. #Cunha"
751144161248702464,2016-07-07 20:01:38,07-07-2016 20:01:38,O acordo com o governo golpista tem um só objetivo: evitar a cassação. #Cunha
751143808608440324,2016-07-07 20:00:14,07-07-2016 20:00:14,"Com o apoio de Temer, do qual permanece fiel aliado, Cunha certamente atuará p/ colocar na presidência da Câmara um de seus soldados."
751143486473338880,2016-07-07 19:58:57,07-07-2016 19:58:57,"Não devemos nos enganar, no entanto. Trata-se de uma vitória parcial. #Cunha"
751143154515079168,2016-07-07 19:57:38,07-07-2016 19:57:38,A renúncia de Cunha é um dos últimos capítulos da derrocada de um político que sempre trabalhou para satisfazer seus próprios interesses.
751142641362927616,2016-07-07 19:55:35,07-07-2016 19:55:35,"Hoje chegou ao fim a era da chantagem explícita, sistemática e profissional na Câmara dos Deputados. #Cunha https://t.co/lF3Nf8ZqTY"
751038931026731008,2016-07-07 13:03:29,07-07-2016 13:03:29,Leia mais: https://t.co/MUkSDEWz0y
751038400149487617,2016-07-07 13:01:22,07-07-2016 13:01:22,Como esperar algo de diferente de quem mantém estreita amizade com Eduardo Cunha? https://t.co/hxM8IGHKjp
751038160717639680,2016-07-07 13:00:25,07-07-2016 13:00:25,"O pacote, que tipifica o crime de enriquecimento ilícito, ficará agora parado e esquecido, à espera de comissões que nunca são nomeadas."
751037784069115905,2016-07-07 12:58:55,07-07-2016 12:58:55,"Com a aprovação de Temer, será retirada a urgência da tramitação das propostas anticorrupção que haviam sido encaminhadas por @dilmabr."
751037525087621120,2016-07-07 12:57:54,07-07-2016 12:57:54,"O governo interino já começou a tomar ações concretas para ""estancar a sangria da Lava Jato"", como deseja o senador Romero Jucá."
750418278057709568,2016-07-05 19:57:14,05-07-2016 19:57:14,Saiba mais: https://t.co/7R20Zq40Pk https://t.co/z93W7Xl609
750417682084814848,2016-07-05 19:54:52,05-07-2016 19:54:52,"""Perdi três eleições e respeitei a escolha das pessoas. Mas a direita não quer esperar"", afirmou @LulapeloBrasil."
750416876182892545,2016-07-05 19:51:40,05-07-2016 19:51:40,"Em entrevista ao @guardian, o ex-presidente Lula defendeu o legado das gestões do petistas e atacou os q buscam atalhos p/ chegar ao poder."
750416423567097856,2016-07-05 19:49:52,05-07-2016 19:49:52,"Está claro: além de parar a Lava Jato, o golpe parlamentar contra @dilmabr também tem como objetivo desmontar as políticas sociais."
750346943373647872,2016-07-05 15:13:46,05-07-2016 15:13:46,É a ficha de quem conduziu a farsa do impeachment contra uma mulher honesta. Leia mais:https://t.co/C6Jk0g8L6j
750346093519568896,2016-07-05 15:10:24,05-07-2016 15:10:24,Nunca é demais lembrar: essa é a ficha do capitão do golpe. É a ficha de um dos mais fiéis aliados de Michel Temer.
750345880264409088,2016-07-05 15:09:33,05-07-2016 15:09:33,Agora ele também terá que responder pela acusação de fazer parte de uma organização criminosa que desviava recursos do FGTS.
750345580719775745,2016-07-05 15:08:21,05-07-2016 15:08:21,Cunha já era réu por recebimento de propina e por manter contas secretas no exterior.
750345156679827456,2016-07-05 15:06:40,05-07-2016 15:06:40,"Recentemente, a Procuradoria-Geral da República apresentou a terceira denúncia contra o parlamentar. https://t.co/dlGEJ0Ck7w"
750344692072579072,2016-07-05 15:04:49,05-07-2016 15:04:49,"Se Aécio Neves lidera o ranking de citações entre os políticos na Lava Jato, o deputado afastado Eduardo Cunha é o campeão de denúncias."
750064010675023874,2016-07-04 20:29:30,04-07-2016 20:29:30,Há milhões neste país dispostos a defender o seu voto e a desmascarar uma das maiores farsas da nossa história.
750062977378820096,2016-07-04 20:25:23,04-07-2016 20:25:23,"Se o presidente interino achava que, ao proibir o uso do avião oficial, @dilmabr desistiria de seguir lutando, ele estava muito enganado."
750062657617686528,2016-07-04 20:24:07,04-07-2016 20:24:07,"Recorde, o valor servirá para que @dilmabr siga viajando o país e denunciando o golpe. https://t.co/Q5pnEl5YYB"
750062350863048705,2016-07-04 20:22:54,04-07-2016 20:22:54,"Bastaram apenas dois dias para que a campanha ""Jornada Pela Democracia - Todos por Dilma"" superasse a meta e arrecadasse mais de R$ 500 mil."
750025002225901568,2016-07-04 17:54:29,04-07-2016 17:54:29,Leia mais: https://t.co/Q0FehiqUhi
750024736541962240,2016-07-04 17:53:26,04-07-2016 17:53:26,"Segundo ele, a presidenta permanece firme, confiante de que conseguirá superar essa grande injustiça. https://t.co/juLI5SvEoW"
750024423579713536,2016-07-04 17:52:12,04-07-2016 17:52:12,"O ex-ministro da Justiça, José Eduardo Cardozo, falou sobre esses e outros assuntos em entrevista publicada hj pela @folha."
750023701488340992,2016-07-04 17:49:19,04-07-2016 17:49:19,@dilmabr não cometeu qualquer crime de responsabilidade e o impeachment dela se deu por motivos puramente políticos.
750023401214009345,2016-07-04 17:48:08,04-07-2016 17:48:08,A perícia feita por técnicos do Senado confirmou aquilo que já vínhamos dizendo há muito tempo.
748604946627633154,2016-06-30 19:51:42,30-06-2016 19:51:42,Leia mais: https://t.co/uBaLUb4M1U
748604726137094148,2016-06-30 19:50:49,30-06-2016 19:50:49,"A ONU também estimulou a sua exportação, afirmando que o ""Mais Médicos é potencialmente benéfico em qualquer país que decidisse adotá-lo""."
748604350847680513,2016-06-30 19:49:20,30-06-2016 19:49:20,O Mais Médicos foi considerado uma das melhores práticas para a promoção da saúde de qualidade em nações em desenvolvimento.
748602994460065792,2016-06-30 19:43:56,30-06-2016 19:43:56,"Criado por @dilmabr, o programa que levou milhares de médicos para regiões carentes recebeu elogios da @ONUBrasil. https://t.co/lMkxnNw7XF"
748602683578322948,2016-06-30 19:42:42,30-06-2016 19:42:42,"Responsável por atender 63 mi de brasileiros q não tinham acesso à atenção básica, o Mais Médicos está se tornando um exemplo p/ o mundo."
748529830036127744,2016-06-30 14:53:13,30-06-2016 14:53:13,Acesse https://t.co/QQ9Imc5yEF e saiba como você pode colaborar.
748529592886005760,2016-06-30 14:52:16,30-06-2016 14:52:16,"Participem, divulguem, compartilhem! A luta pela democracia precisa continuar. #JornadaPelaDemocracia"
748529300538810370,2016-06-30 14:51:06,30-06-2016 14:51:06,Eu já fiz minha doação e convido todos vocês a fazerem o mesmo. #JornadaPelaDemocracia https://t.co/lr7yldL8cF
748529000235024384,2016-06-30 14:49:55,30-06-2016 14:49:55,"Foi lançada ontem a campanha ""Jornada pela Democracia"", com o objetivo de arrecadar recursos p/ ajudar a pagar os deslocamentos de @dilmabr."
748528769204391936,2016-06-30 14:49:00,30-06-2016 14:49:00,"A mesquinharia dos usurpadores, no entanto, não nos fará desistir de continuar defendendo a democracia."
748528455558504448,2016-06-30 14:47:45,30-06-2016 14:47:45,"Incomodado com a denúncia do golpe, o governo ilegítimo quer impedir @dilmabr de viajar pelo país."
748239615681761280,2016-06-29 19:40:00,29-06-2016 19:40:00,Leia mais: https://t.co/O4L4XurUov
748239157319901185,2016-06-29 19:38:11,29-06-2016 19:38:11,"Segundo Gaspari, a inocência de @dilmabr no caso das pedaladas fiscais provocou ""constrangimento"" entre os defensores do impeachment."
748238741697888256,2016-06-29 19:36:32,29-06-2016 19:36:32,"Gaspari afirma que os motivos apontados para o afastamento de @dilmabr são ""insuficientes para instruir um processo de impedimento""."
748238334598713344,2016-06-29 19:34:55,29-06-2016 19:34:55,"Elio Gaspari, colunista da @folha, publicou hj texto intitulado ""Há golpe"". O golpe, enfim, chegou à grande mídia. https://t.co/lalSFYjaej"
748156994452865025,2016-06-29 14:11:42,29-06-2016 14:11:42,Veja mais: https://t.co/DGG621jJwu
748156849267089408,2016-06-29 14:11:07,29-06-2016 14:11:07,"""Estamos do lado certo da História na Bahia e no Brasil. O povo brasileiro precisa derrotar o golpe"", declarou. https://t.co/0h8RQLYnb4"
748156662230433792,2016-06-29 14:10:23,29-06-2016 14:10:23,"Na Bahia, onde visitou movimentos sociais, @mrdannyglover disse que o povo brasileiro precisa lutar para restabelecer a democracia."
748156333250199552,2016-06-29 14:09:04,29-06-2016 14:09:04,"Em recente passagem pelo Brasil, o consagrado ator @mrdannyglover prestou solidariedade à @dilmabr e condenou o golpe do qual ela é vítima."
747871380855791616,2016-06-28 19:16:46,28-06-2016 19:16:46,Estou ao lado dos milhões que sonham com um país com mais igualdade e respeito a todxs. #OrgulhoLGBT https://t.co/U82tiLJdqf
747869793722695680,2016-06-28 19:10:28,28-06-2016 19:10:28,Manifesto meu apoio e solidariedade a essa comunidade ainda tão marginalizada e discriminada na sociedade brasileira. #OrgulhoLGBT
747869488050216961,2016-06-28 19:09:15,28-06-2016 19:09:15,"No momento em que um governo conservador ameaça conquistas e avanços, a luta em defesa da população LGBT torna-se ainda mais importante."
747869110009274368,2016-06-28 19:07:45,28-06-2016 19:07:45,"Só no ano passado, 318 lésbicas, gays, bissexuais e trans foram assassinados em decorrência de sua orientação sexual e identidade de gênero."
747867682398142464,2016-06-28 19:02:04,28-06-2016 19:02:04,Nunca é demais lembrar: preconceito e ódio matam. #OrgulhoLGBT
747809635160166400,2016-06-28 15:11:25,28-06-2016 15:11:25,@dilmabr falou sobre esse e outros assuntos em entrevista concedida hj ao @GrupoMetropole. Leia mais: https://t.co/RILHVCQsfO
747809417299656704,2016-06-28 15:10:33,28-06-2016 15:10:33,Jamais poderíamos imaginar que estaríamos nos aliando a um grupo que se revelou o que há de mais conservador na política brasileira.
747809007667154946,2016-06-28 15:08:55,28-06-2016 15:08:55,"Quando firmamos a aliança com o PMDB, jamais imaginávamos que estaríamos nos unindo a um vice traidor e usurpador."
747808681115410432,2016-06-28 15:07:37,28-06-2016 15:07:37,"Nenhum desses erros, no entanto, foi maior do q o de ter feito aliança com o grupo político q se encontra no poder. https://t.co/kPMeZL2BlJ"
747808373614186496,2016-06-28 15:06:24,28-06-2016 15:06:24,Erramos na condução da economia e na condução da política.
747808063466377217,2016-06-28 15:05:10,28-06-2016 15:05:10,É importante reconhecer que nosso governo cometeu erros.
747510057244495872,2016-06-27 19:21:00,27-06-2016 19:21:00,Leia mais: https://t.co/v6DruszkDS
747509202558541826,2016-06-27 19:17:36,27-06-2016 19:17:36,"Pela análise, não foi identificado ato comissivo que tenha contribuído para que ocorressem os atrasos nos pagamentos"", conclui a perícia."
747507216819884032,2016-06-27 19:09:43,27-06-2016 19:09:43,"Honesta, cumpridora da lei, @dilmabr não cometeu crime de responsabilidade, não pedalou e, portanto, é vítima de um golpe."
747506962791862273,2016-06-27 19:08:42,27-06-2016 19:08:42,"Com a divulgação do laudo produzido por técnicos do Senado, quem alegar que @dilmabr praticou pedaladas fiscais estará mentindo."
747506617650913281,2016-06-27 19:07:20,27-06-2016 19:07:20,"Era um argumento, mas a partir de hoje se torna apenas uma mentira. https://t.co/HpkKRVECpr"
747451843987509248,2016-06-27 15:29:41,27-06-2016 15:29:41,Clique em https://t.co/ZTm4oTDkci para ver o que Rose de Freitas disse à @radioitatiaia.
747451462905643008,2016-06-27 15:28:10,27-06-2016 15:28:10,"Confissão semelhante já havia sido feita por Romero Jucá e pelo presidente interino, em ato falho registrado no Twitter."
747450800285302784,2016-06-27 15:25:32,27-06-2016 15:25:32,Nos últimos dias foi a vez da senadora Rose de Freitas (PMDB) admitir que @dilmabr não cometeu crime de responsabilidade.
747450633159073796,2016-06-27 15:24:52,27-06-2016 15:24:52,E a verdade sobre o impeachment é tão cristalina q nem mesmo os q votaram por ele conseguem esconder q o q ocorre no Brasil é um golpe.
747450415290191873,2016-06-27 15:24:00,27-06-2016 15:24:00,"A verdade sempre aparece, nem que seja por vias tortas. https://t.co/2rxLnfamCi"
745679529318973440,2016-06-22 18:07:08,22-06-2016 18:07:08,"O que ocorreram foram encontros para tratar da relação entre Executivo e Legislativo, algo absolutamente normal em uma democracia."
745679305607360516,2016-06-22 18:06:15,22-06-2016 18:06:15,Nunca houve oferecimento de apoio do PT a Cunha nem nunca haverá pq nos recusamos a fazer acordo com chantagistas. https://t.co/chQCeYdJFy
745678971744960514,2016-06-22 18:04:55,22-06-2016 18:04:55,"Em entrevista coletiva ontem, o réu e presidente afastado da Câmara, Eduardo Cunha, mais uma vez mentiu para se fazer de vítima."
745604351465558017,2016-06-22 13:08:24,22-06-2016 13:08:24,"A decisão do STF é uma vitória das mulheres, dos direitos humanos e de todos os que lutam por um país mais civilizado."
745604119130411009,2016-06-22 13:07:29,22-06-2016 13:07:29,"Com isso, Bolsonaro finalmente será obrigado a responder na Justiça por suas opiniões machistas, preconceituosas e disseminadoras do ódio."
745603706696105984,2016-06-22 13:05:50,22-06-2016 13:05:50,Os ministros também aceitaram uma queixa-crime contra o parlamentar por injúria.
745603280680665088,2016-06-22 13:04:09,22-06-2016 13:04:09,Esse foi o entendimento adotado pelo STF ao tornar Jair Bolsonaro réu por incitação ao estupro. https://t.co/EiH4vDphlo
745602953323626496,2016-06-22 13:02:51,22-06-2016 13:02:51,A imunidade parlamentar não pode servir como escudo para proteger agressões contra a dignidade humana.
745327991287316480,2016-06-21 18:50:15,21-06-2016 18:50:15,Os golpistas são generosos com o andar de cima e avarentos com os que mais precisam. https://t.co/RTkxYa8Hn7
745327690480246785,2016-06-21 18:49:03,21-06-2016 18:49:03,"O segundo ficou mais claro nas últimas semanas, com o teto para os gastos públicos e com o não pagamento do reajuste do Bolsa Família."
745327364947718144,2016-06-21 18:47:45,21-06-2016 18:47:45,O primeiro já ficou mais do que provado com a revelação das gravações em que ex-ministros desenhavam estratégias para parar a Lava Jato.
745325890738003968,2016-06-21 18:41:54,21-06-2016 18:41:54,São dois os grandes objetivos do governo ilegítimo: impedir o avanço do combate à corrupção e retirar direitos do povo mais pobre.
745015157412204544,2016-06-20 22:07:09,20-06-2016 22:07:09,Leia mais em https://t.co/kkQlii5qio
745012919470071809,2016-06-20 21:58:16,20-06-2016 21:58:16,Quem será o próximo a cair? Essa é a pergunta que mais se ouve sobre o governo ilegítimo.
745012508268838912,2016-06-20 21:56:38,20-06-2016 21:56:38,"Mendonça Filho, ministro da Educação, foi citado em delação como beneficiário de propina."
745012102499307521,2016-06-20 21:55:01,20-06-2016 21:55:01,"Eliseu Padilha, seu braço direito, está sendo acusado de ter mantido uma funcionária fantasma no gabinete quando era deputado."
745011849981222912,2016-06-20 21:54:01,20-06-2016 21:54:01,"Depois de perder três ministros em um mês, o interino viu mais 2 auxiliares próximos serem envolvidos em irregularidades nos últimos dias."
745011606287949824,2016-06-20 21:53:03,20-06-2016 21:53:03,A fábrica de escândalos do governo golpista de Michel Temer continua operando a todo vapor. https://t.co/FuVB10ogzr
