id,datetime,created_at,text
920406899660673025,2017-10-17 21:51:19,17-10-2017 21:51:19,"Mesmo em um período de crise e tendo que enfrentar o boicote do gov. Temer e de seus aliados do DEM, a Bahia segue sendo exemplo de gestão."
920367882722332675,2017-10-17 19:16:17,17-10-2017 19:16:17,"Parabéns ao Movimento de Organização Comunitária, que luta para levar esperança e qualidade de vida ao nosso semiárido! #MOC50Anos https://t.co/eux08Cluad"
920052813132193792,2017-10-16 22:24:19,16-10-2017 22:24:19,Saiba mais: https://t.co/4d0SptiUdE
920052747638067200,2017-10-16 22:24:03,16-10-2017 22:24:03,"Roubaram o mandato de @dilmabr, uma mulher honesta, séria, íntegra. Roubaram nossa democracia. https://t.co/TQG1feetVi"
920052327775600641,2017-10-16 22:22:23,16-10-2017 22:22:23,"Quanto mais se sabe, mais se tem a certeza de que o golpe foi um dos episódios mais degradantes e lamentáveis da nossa história."
920052152688619521,2017-10-16 22:21:41,16-10-2017 22:21:41,"Em depoimento à PGR, o operador financeiro do PMDB afirmou que repassou R$ 1 mi para que Eduardo Cunha comprasse mais votos contra @dilmabr."
920051970962010114,2017-10-16 22:20:58,16-10-2017 22:20:58,A deposição de @dilmabr foi comprada com o dinheiro sujo da corrupção. Quem garante é o delator Lúcio Funaro.
920051802363650050,2017-10-16 22:20:18,16-10-2017 22:20:18,"Liderada por um chantagista profissional  e justificada por razões jurídicas fragilíssimas, a deposição de @dilmabr também foi comprada."
918231460506677249,2017-10-11 21:46:54,11-10-2017 21:46:54,@costa_rui decidiu reduzir impostos para incentivar o turismo e impulsionar ainda mais a economia do nosso estado.
918231340058890240,2017-10-11 21:46:26,11-10-2017 21:46:26,"O acordo q possibilitou essa ótima novidade foi assinado com a @LATAM_BRA, q tb irá divulgar os destinos turísticos baianos no exterior."
918231080356012033,2017-10-11 21:45:24,11-10-2017 21:45:24,"A partir do ano que vem, Salvador passará a ter voos diretos para Buenos Aires, na Argentina, e Miami, nos Estados Unidos."
918230931231727629,2017-10-11 21:44:48,11-10-2017 21:44:48,"✈️Com a #correria de @costa_rui, a Bahia voa mais longe! ✈️ https://t.co/W6IOtuU0k6"
918183226526568449,2017-10-11 18:35:14,11-10-2017 18:35:14,"@LulapeloBrasil está sendo vítima de injustiças e de uma campanha persecutória sem limites, sem tréguas."
918180525306712065,2017-10-11 18:24:30,11-10-2017 18:24:30,"E só fortalecem a percepção da sociedade, essa sim com comprovação na realidade, de que @LulapeloBrasil está sendo vítima."
918180182174859264,2017-10-11 18:23:09,11-10-2017 18:23:09,"Agressões como essa, tenho certeza, só reforçam a disposição de @LulapeloBrasil de continuar lutando por um país + justo e mais democrático."
918179976708542464,2017-10-11 18:22:20,11-10-2017 18:22:20,"Mais uma vez, aos democratas e aos q acreditam no Brasil, não cabe outra opção a não ser expressar apoio e solidariedade a @LulapeloBrasil. https://t.co/mZ14r05gNu"
918179569668186114,2017-10-11 18:20:43,11-10-2017 18:20:43,"Feita a partir de uma denúncia anônima, a ação é uma grave violência à liberdade e aos direitos de @LulapeloBrasil e de sua família."
918178982943739904,2017-10-11 18:18:23,11-10-2017 18:18:23,A operação policial na casa do filho de @LulapeloBrasil foi mais um capítulo da sistemática perseguição da qual ele tem sido vítima.
917838275930288128,2017-10-10 19:44:32,10-10-2017 19:44:32,É por isso que por onde passa @costa_rui #correria recebe o reconhecimento e o carinho dos baianos. Saiba mais: https://t.co/kSSUt8FCH4
917837923109736448,2017-10-10 19:43:08,10-10-2017 19:43:08,"Felizmente, no comando da Bahia, temos um político sério e competente. @costa_rui sempre coloca os interesses coletivos em 1º lugar. https://t.co/hIDYl9gDgh"
917837275362406400,2017-10-10 19:40:33,10-10-2017 19:40:33,As pesquisas mostram que o povo sabe diferenciar quem realmente trabalha pelo coletivo e quem só está interessado em trabalhar por si mesmo.
917837121926385665,2017-10-10 19:39:57,10-10-2017 19:39:57,"Nos dois casos, há muita propaganda e pouca administração. Mas não tem marketing que sustente um produto ruim por muito tempo."
917836691934732288,2017-10-10 19:38:14,10-10-2017 19:38:14,"Salvador e São Paulo, por exemplo, assistem seus prefeitos gastando tempo mais com as eleições 2018 do que com a gestão municipal."
917836557381402625,2017-10-10 19:37:42,10-10-2017 19:37:42,Parece que virou moda no Brasil político estar mais preocupado em aparecer e criar factóides do que em de fato governar.
917509967086792704,2017-10-09 21:59:57,09-10-2017 21:59:57,"E assim continuaremos pq quem gosta de  intriga é a Turma do Atraso, que não trabalha pelos baianos e ainda quer empatar quem trabalha."
917509829966561280,2017-10-09 21:59:24,09-10-2017 21:59:24,"Com dedicação, muito diálogo e humildade vamos conquistando a simpatia do povo e o apoio até dos que eram nossos adversários no passado."
917509516446625792,2017-10-09 21:58:09,09-10-2017 21:58:09,"Hoje o time de @costa_rui #correria ganhou mais um importante reforço! 
https://t.co/GlUvAYgOGa"
917471345885229056,2017-10-09 19:26:29,09-10-2017 19:26:29,Saiba mais: https://t.co/CkYDR0I7wM
917471207716507648,2017-10-09 19:25:56,09-10-2017 19:25:56,"Um momento histórico para o sul da Bahia, que ainda receberá uma série de outros investimentos nos próximos meses. #Itabuna #Ilhéus #BR415"
917470996927602690,2017-10-09 19:25:06,09-10-2017 19:25:06,"@costa_rui #correria assinou na manhã de hoje o contrato dessa importante obra, que vai beneficiar mais de 500 mil baianos. #BR415"
917470835207819265,2017-10-09 19:24:27,09-10-2017 19:24:27,"Tão aguardada pelos moradores da região, a duplicação da rodovia Ilhéus-Itabuna, a #BR415, começou a sair do papel. #Ilhéus #Itabuna"
917470671336361989,2017-10-09 19:23:48,09-10-2017 19:23:48,A espera acabou e o sonho vai se tornar realidade! #Itabuna #Ilhéus #BR415 @costa_rui https://t.co/vuKGRyxtNm
917390939915735040,2017-10-09 14:06:59,09-10-2017 14:06:59,As pessoas e o ambiente em que elas vivem. Artigo publicado na edição de hoje do @atarde ➡️➡️https://t.co/8hS9s7Z5Ax
917390461475713024,2017-10-09 14:05:04,09-10-2017 14:05:04,"Ao investir em energias renováveis, estamos gerando novas oportunidades de trabalho e demonstrando que nossa prioridade são as pessoas."
917390251475300352,2017-10-09 14:04:14,09-10-2017 14:04:14,"☀️Exemplo disso é o Complexo Fotovoltaico de Bom Jesus da Lapa, o maior em operação no país, inaugurado recentemente.🌞"
917390073569660930,2017-10-09 14:03:32,09-10-2017 14:03:32,"Líder em produção de energia solar e segundo em energia eólica, a #Bahia está sabendo explorar muito bem suas riquezas e recursos naturais."
916409076518735873,2017-10-06 21:05:24,06-10-2017 21:05:24,A Bahia não vai se submeter à mesquinharia da Turma do Atraso. https://t.co/aDr1isjF46
916408603552157700,2017-10-06 21:03:31,06-10-2017 21:03:31,"A Bahia é grande, é forte e graças à gestão correta e responsável do #correria tem recursos em caixa para tocar essa e outras obras."
916408303449772032,2017-10-06 21:02:20,06-10-2017 21:02:20,O gov @costa_rui garantiu: segunda-feira (09) assina a ordem de serviço para dar início a essa obra tão aguardada pela região cacaueira.
916408073983492096,2017-10-06 21:01:25,06-10-2017 21:01:25,"Com ou sem o apoio do governo ilegítimo de Michel Temer, a duplicação da rodovia Ilhéus-Itabuna, a BR-415, vai sair."
916091133079539712,2017-10-06 00:02:00,06-10-2017 00:02:00,Saiba mais: https://t.co/3d9riNRfUg
916090966506921984,2017-10-06 00:01:21,06-10-2017 00:01:21,"Neste ano, mais de 20 mil pessoas devem visitar Cachoeira por conta da festa, lotando a rede hoteleira da cidade. #FLICA https://t.co/NXgdLXktFt"
916090770553212928,2017-10-06 00:00:34,06-10-2017 00:00:34,"Criado no meu governo, o evento oferece uma extensa e diversificada programação que atrai milhares de apaixonados pela literatura. #FLICA"
916090581234933760,2017-10-05 23:59:49,05-10-2017 23:59:49,"Realizada todos os anos em Cachoeira, a #FLICA chega à sua sétima edição cada vez mais forte e consolidada no calendário cultural baiano."
916090445188526081,2017-10-05 23:59:16,05-10-2017 23:59:16,Começou nesta quinta (05) e vai até domingo (08) o maior evento literário da Bahia e um dos maiores do Brasil! #FLICA
915688562301038592,2017-10-04 21:22:20,04-10-2017 21:22:20,O brilho da estrela do @ptbrasil nada nem ninguém pode apagar. Saiba mais: https://t.co/pULBl0TnE9
915688388757516289,2017-10-04 21:21:39,04-10-2017 21:21:39,"Segundo o DataFolha, o PT é a agremiação política preferida de 19% dos brasileiros, a maior taxa desde a eleição de @dilmabr em 2014."
915688225787858946,2017-10-04 21:21:00,04-10-2017 21:21:00,"O @ptbrasil, o partido mais atacado e perseguido do país, é também o mais popular. https://t.co/8Ou3RuGVVL"
915687990860664832,2017-10-04 21:20:04,04-10-2017 21:20:04,"Além da liderança isolada de @LulapeloBrasil nas pesquisas, a força do @ptbrasil comprova essa tese."
915687706193223680,2017-10-04 21:18:56,04-10-2017 21:18:56,As conquistas e avanços dos governos @dilmabr e @LulapeloBrasil continuam vivos na memória do povo brasileiro.
915636650239315968,2017-10-04 17:56:03,04-10-2017 17:56:03,"Para a Turma do Atraso, restará carregar o pesado fardo do apoio ao governo Temer nas costas. https://t.co/mE01JZLmDq"
915636534006702088,2017-10-04 17:55:36,04-10-2017 17:55:36,"Assim como foi em 2006, 2010 e em 2014, a força do nosso trabalho e a humildade em dialogar com os aliados sairão vencedores."
915636365748002820,2017-10-04 17:54:55,04-10-2017 17:54:55,"De outro, buscam criar intrigas na base de apoio do governo de @costa_rui #correria. Fazem uma política velha, com resultado conhecido."
915636129759711234,2017-10-04 17:53:59,04-10-2017 17:53:59,"De um lado, eles atuam nos bastidores para atrasar obras e bloquear empréstimo já aprovado junto ao Banco do Brasil."
915635993696522241,2017-10-04 17:53:27,04-10-2017 17:53:27,O trabalho de @costa_rui e de todo o governo segue sendo reconhecido pelo povo baiano e isso é que assusta nossos adversários.
915635740142432256,2017-10-04 17:52:26,04-10-2017 17:52:26,"Sob o comando de @costa_rui, o @governodabahia tem enfrentado e superado a crise, levando mais desenvolvimento para todos os baianos."
915599578786910208,2017-10-04 15:28:45,04-10-2017 15:28:45,E reafirmo meus votos de que essa parceria se fortaleça cada vez mais em benefício dos interesses e do desenvolvimento do nosso estado.
915599511464103936,2017-10-04 15:28:29,04-10-2017 15:28:29,"Mas faço questão de deixar registrados publicamente meus cumprimentos tanto a Alban quanto a FIEB, dois grandes parceiros da Bahia."
915599443021434880,2017-10-04 15:28:12,04-10-2017 15:28:12,"Já o parabenizei pessoalmente na segunda-feira, quando Alban foi reeleito com a quase totalidade dos votos."
915599314935795712,2017-10-04 15:27:42,04-10-2017 15:27:42,Desejo muita sorte e sucesso ao empresário Ricardo Alban na continuidade de sua gestão à frente da @SistemaFIEB pelos próximos quatro anos.
915231188113076226,2017-10-03 15:04:54,03-10-2017 15:04:54,"RT @costa_rui: É hoje, hein? Quero bater um papo correria com vocês! Ao vivo no Face (@ruicostaoficial), a partir de meio-dia. #PapoCorreri…"
915201843839606784,2017-10-03 13:08:17,03-10-2017 13:08:17,"Mas + importante do q os números e as obras em si é o resgate, é a valorização do nosso Centro Histórico. Leia mais: https://t.co/GbssaJpLZo"
915201530218864641,2017-10-03 13:07:03,03-10-2017 13:07:03,"São mais de 200 ruas requalificadas no Centro Histórico, o que está proporcionando mais acessibilidade e conforto para moradores e turistas."
915201201779740675,2017-10-03 13:05:44,03-10-2017 13:05:44,"Com um amplo programa de recuperação de calçadas, @costa_rui #correria está requalificando vias em todos os 11 bairros que compõem a região."
915201045999095808,2017-10-03 13:05:07,03-10-2017 13:05:07,Andar pelas históricas ruas do Centro Antigo de Salvador está ficando mais agradável a cada dia. https://t.co/bnWqeOryeH
914977168492556291,2017-10-02 22:15:31,02-10-2017 22:15:31,@LulapeloBrasil é a única alternativa viável p/ interromper os retrocessos do gov. Temer e fazer o Brasil voltar a crescer e ser respeitado. https://t.co/HVS8jl5U4n
914976685723934720,2017-10-02 22:13:35,02-10-2017 22:13:35,"Com 35% das intenções de voto e rejeição em queda, @LulapeloBrasil cada vez mais se consolida como a esperança em dias melhores."
914976388544901121,2017-10-02 22:12:25,02-10-2017 22:12:25,É o que mostrou mais uma vez a pesquisa DataFolha divulgada no último fim de semana. @LulapeloBrasil
914976172362039297,2017-10-02 22:11:33,02-10-2017 22:11:33,"Os institutos mudam, mas os resultados são sempre os mesmos. @LulapeloBrasil lidera e continua crescendo na preferência popular."
913852406932402176,2017-09-29 19:46:07,29-09-2017 19:46:07,Acesse https://t.co/gXZY2tAAAc e vote agora! #MeRepresentam
913852321137926144,2017-09-29 19:45:46,29-09-2017 19:45:46,"Vote nos parlamentares do @ptbrasil que concorrem ao prêmio do @congemfoco, que irá escolher os melhores representantes do povo em 2017. https://t.co/etrbTLCbwo"
913852017147285507,2017-09-29 19:44:34,29-09-2017 19:44:34,"Então apoie e valorize o trabalho dos deputados, deputadas, senadoras e senadores que estão do mesmo lado que você. @ptbrasil"
913851851837198336,2017-09-29 19:43:54,29-09-2017 19:43:54,"Você defende a democracia, é contra os retrocessos promovidos pelo governo ilegítimo de Michel Temer e quer ver essa luta fortalecida?"
913828023509667840,2017-09-29 18:09:13,29-09-2017 18:09:13,Saiba mais: https://t.co/P0PollTPeA
913827917003722752,2017-09-29 18:08:48,29-09-2017 18:08:48,"Energia limpa, renovável e com grande potencial de geração de emprego e renda para o nosso povo. É a Bahia cada vez mais perto do futuro!"
913827769544560640,2017-09-29 18:08:13,29-09-2017 18:08:13,O parque construído por uma empresa privada a partir de incentivos concedidos pelo governo já é capaz de abastecer mais de 160 mil casas.
913827524563619841,2017-09-29 18:07:14,29-09-2017 18:07:14,O governador @costa_rui esteve em Bom Jesus da Lapa nesta semana para inaugurar o maior complexo de energia solar do Brasil. https://t.co/8W33dorJRk
913827263770226689,2017-09-29 18:06:12,29-09-2017 18:06:12,Quem acha que energia solar faz parte de uma realidade distante é porque nunca visitou ou ouviu falar de Bom Jesus da Lapa.
913513809284911105,2017-09-28 21:20:39,28-09-2017 21:20:39,A @Forbes afirma ainda que @LulapeloBrasil é o político mais amado do Brasil. Saiba mais: https://t.co/xjFCybeHaf
913513328819015680,2017-09-28 21:18:44,28-09-2017 21:18:44,O artigo da @Forbes aponta as conquistas do Brasil durante os mandatos de @LulapeloBrasil e crava que o ex-presidente será eleito de novo.
913512906456752128,2017-09-28 21:17:03,28-09-2017 21:17:03,"""No Brasil, todo mundo vai mal, menos @LulapeloBrasil"". Esse é o título de um texto publicado na @Forbes, uma das maiores revistas do mundo. https://t.co/LtjTdnfBWp"
913459764033617920,2017-09-28 17:45:53,28-09-2017 17:45:53,Esses números são o atestado incontestável do fracasso retumbante do golpe e de todos que o apoiaram. Saiba mais: https://t.co/0RvdBYxV7k
913459576376262656,2017-09-28 17:45:08,28-09-2017 17:45:08,Só 3% dos brasileiros aprovam o ilegítimo e só 8% consideram seu governo melhor do que o da presidenta @dilmabr.
913459289372717056,2017-09-28 17:44:00,28-09-2017 17:44:00,"Com 77% de reprovação, Michel Temer é o mandatário mais rejeitado desde 1986, quando o Ibope começou a fazer esse tipo de pesquisa. https://t.co/EQi8muQRQA"
913459156706832384,2017-09-28 17:43:28,28-09-2017 17:43:28,"Não satisfeito com tais façanhas, Temer acaba de acumular mais um recorde negativo."
913458987479261192,2017-09-28 17:42:48,28-09-2017 17:42:48,"Primeiro presidente a ser denunciado durante o exercício do mandato, Temer dobrou a meta na semana passada e foi novamente denunciado."
913109083934400517,2017-09-27 18:32:25,27-09-2017 18:32:25,É por essa e por outras razões que o Brasil tem cada vez menos respeito pela figura de João Doria. Saiba mais: https://t.co/F90glRXQLb https://t.co/tWMIWD7VQ8
913108862881890304,2017-09-27 18:31:32,27-09-2017 18:31:32,Sobre as fartas e comprovadas acusações contra Temer e Aécio? Nada. João Doria não diz uma palavra.
913108688981958656,2017-09-27 18:30:50,27-09-2017 18:30:50,"Aliado de Temer e de Aécio, João Doria é sempre rápido e combativo quando se trata de criticar os supostos desvios de seus adversários."
913035046835097600,2017-09-27 13:38:13,27-09-2017 13:38:13,Saiba mais: https://t.co/wxa8b9z1mK
913034801741012992,2017-09-27 13:37:14,27-09-2017 13:37:14,É a memória daqueles tempos que fortalece @LulapeloBrasil. E é esse passado de prosperidade que os brasileiros querem viver de novo. https://t.co/qFeQsJD9Fq
913034400991936513,2017-09-27 13:35:39,27-09-2017 13:35:39,"Com @LulapeloBrasil , os pobres começaram a frequentar a universidade, realizaram o sonho da casa própria e passaram a viver com dignidade."
913034240492736514,2017-09-27 13:35:00,27-09-2017 13:35:00,"O que a direita não enxerga, é que @LulapeloBrasil estabeleceu fortíssimos vínculos afetivos e de gratidão com o povo brasileiro."
913034083198013445,2017-09-27 13:34:23,27-09-2017 13:34:23,"Eles ficam sem entender como @LulapeloBrasil, mesmo sendo tão perseguido pela Justiça e pela mídia, ainda consegue ser tão popular."
913033166084087809,2017-09-27 13:30:44,27-09-2017 13:30:44,"Sempre que sai uma nova pesquisa mostrando a força de @LulapeloBrasil, a direita fica intrigada."
912780194703953920,2017-09-26 20:45:31,26-09-2017 20:45:31,"É saúde de qualidade, gratuita e chegando cada vez mais perto do povo. Saiba mais: https://t.co/kUh3KOGtFS 🏥"
912780006262272000,2017-09-26 20:44:46,26-09-2017 20:44:46,"Com capacidade p/ realizar até 650 exames por mês, as novas instalações do HGE contam com equipamentos de última geração. @costa_rui https://t.co/l5QIGwQM9q"
912779588064956418,2017-09-26 20:43:07,26-09-2017 20:43:07,🏥 Mais um grande investimento para a saúde da Bahia! @costa_rui inaugurou nesta terça-feira (26) o Centro de Bioimagem do HGE. 🏥
912659933455405057,2017-09-26 12:47:39,26-09-2017 12:47:39,@costa_rui está dando uma aula de como administrar um estado em um momento de dificuldades sem deixar que isso prejudique a população.
912659589287555073,2017-09-26 12:46:17,26-09-2017 12:46:17,"Com responsabilidade e trabalho, @costa_rui está driblando até a perseguição dos aliados de Temer na Bahia e dando uma aula de gestão."
912659391886671873,2017-09-26 12:45:30,26-09-2017 12:45:30,"Nosso estado cresce mais do que o Brasil, bate recorde nas exportações, é um dos que mais investe e ainda mantém as contas em ordem. https://t.co/mqZE3OJyQF"
912659008011595777,2017-09-26 12:43:58,26-09-2017 12:43:58,"Enquanto o governo federal e governos de vários estados atrasam salários e cortam investimentos, a Bahia segue colhendo boas notícias."
912383014218403840,2017-09-25 18:27:16,25-09-2017 18:27:16,"Com o apoio e a confiança do povo, @LulapeloBrasil está virando o jogo! Leia mais: https://t.co/HUSGFnAZpO"
912382797691711489,2017-09-25 18:26:24,25-09-2017 18:26:24,"Enquanto isso, a aprovação à atuação do juiz Sérgio Moro, que condenou @LulapeloBrasil sem provas, está em queda livre."
912382444149657601,2017-09-25 18:25:00,25-09-2017 18:25:00,"De acordo com pesquisa do Ipsus, a aprovação de @LulapeloBrasil cresceu 8 pontos em um mês, atingindo o maior patamar dos últimos 2 anos."
912382079966556160,2017-09-25 18:23:33,25-09-2017 18:23:33,"Aos poucos, mas de forma consistente, a perseguição jurídica e política da qual @LulapeloBrasil é vítima vai ficando cada vez mais clara. https://t.co/HfNbDG9KgW"
911246948685971456,2017-09-22 15:12:57,22-09-2017 15:12:57,"Com @LulapeloBrasil e @dilmabr, o Brasil gerou 22 milhões de empregos e aumentou em mais de 70% o salário mínimo. #FéNoBrasil https://t.co/zPUgBrcC3M"
911240179066769408,2017-09-22 14:46:03,22-09-2017 14:46:03,"Junte-se ao @ptbrasil, o único partido que mudou o Brasil de verdade e continuará mudando! #FénoBrasil https://t.co/BZ4y4KLCcB"
911239925084950530,2017-09-22 14:45:02,22-09-2017 14:45:02,"O @ptbrasil lança hoje sua campanha nacional de filiação.  Já somos mais de 1,7 milhão de filiados em todo o país. #FéNoBrasil"
911236850819493888,2017-09-22 14:32:49,22-09-2017 14:32:49,RT @ptbrasil: Vem pro Tuitaço #FéNoBrasil! https://t.co/IcI6sdm7wF
910882966871605249,2017-09-21 15:06:37,21-09-2017 15:06:37,Saiba mais: https://t.co/hRFgkXjo1j
910882868280397824,2017-09-21 15:06:13,21-09-2017 15:06:13,"E juiz que tem lado, juiz que confraterniza com os tucanos, deve ser impedido de julgar os casos que envolvam @LulapeloBrasil."
910882447671353344,2017-09-21 15:04:33,21-09-2017 15:04:33,"Em parecer apresentado ao STJ, a subprocuradora Áurea Maria Etelvina Nogueira Lustosa Pierre demonstra que Moro é um juiz que tem lado."
910882071136145408,2017-09-21 15:03:03,21-09-2017 15:03:03,Mas agora não é apenas a defesa de @LulapeloBrasil que está dizendo. É o MPF que está pedindo a suspeição de Moro por considerá-lo parcial. https://t.co/GL6HAOAC0B
910881432289017857,2017-09-21 15:00:31,21-09-2017 15:00:31,Que Sérgio Moro age de forma parcial nos processos contra o ex-presidente @LulapeloBrasil já tinha ficado claro há bastante tempo.
910852133175676928,2017-09-21 13:04:06,21-09-2017 13:04:06,#BrasilQueOPovoQuer A consulta pública do PT/FPA foi lançada para ouvir e dialogar com você!  Participe e interaja: https://t.co/kSfKU9GmjL https://t.co/ch6ab7wUcU
910608235685486592,2017-09-20 20:54:56,20-09-2017 20:54:56,"E se nada disso for suficiente, há o tratamento que a lei prescreve, pq além de preconceito, a homofobia também é crime. #Respeito ❤️🧡💛💚💙💜"
910607574113902593,2017-09-20 20:52:18,20-09-2017 20:52:18,"🌈Homossexualidade não é doença e por isso não tem cura. Mas a homofobia tem: educação, conscientização e respeito. https://t.co/aZa6ouBf2t"
910565295793852416,2017-09-20 18:04:18,20-09-2017 18:04:18,Saiba mais: https://t.co/tpGsB7OhG3
910565200935473152,2017-09-20 18:03:56,20-09-2017 18:03:56,Técnicos da Bahiafarma e do laboratório ucraniano Indar já se reuniram e começaram a elaborar o projeto da fábrica.
910564417867313154,2017-09-20 18:00:49,20-09-2017 18:00:49,Lembram da fábrica de insulina que prometemos instalar em Simões Filho? Pois os primeiros passos para a sua construção já foram dados! https://t.co/pKjUUUIZgH
910563852240252929,2017-09-20 17:58:34,20-09-2017 17:58:34,Não passou nem um mês da viagem que eu e @costa_rui fizemos à Ucrânia e à China e os primeiros resultados já começam a aparecer.
910247640981495809,2017-09-19 21:02:03,19-09-2017 21:02:03,Saiba mais: https://t.co/Gx2Ddp4uVD
910247477860761602,2017-09-19 21:01:24,19-09-2017 21:01:24,É o povo dizendo em alto e bom som que quer @LulapeloBrasil presidente e q eleição sem ele é + um golpe da oposição para ganhar no tapetão.
910247295609901057,2017-09-19 21:00:41,19-09-2017 21:00:41,"Segundo pesquisa da CNT divulgada hj, @LulapeloBrasil continua crescendo na preferência popular e se distanciando de seus adversários."
910246981183901697,2017-09-19 20:59:26,19-09-2017 20:59:26,"Eles acusam sem provas e fazem de tudo p/ impedi-lo de concorrer à Presidência, mas n tem jeito: quanto + batem, + @LulapeloBrasil cresce! https://t.co/o0Q8LyoW3w"
910190640276951041,2017-09-19 17:15:33,19-09-2017 17:15:33,"Se querem derrotar @LulapeloBrasil, que o façam nas urnas e não no tapetão."
910190527911522304,2017-09-19 17:15:07,19-09-2017 17:15:07,Defender o legado de @LulapeloBrasil e seu legítimo direito de se apresentar como opção para o povo brasileiro é defender a democracia.
910190277817769989,2017-09-19 17:14:07,19-09-2017 17:14:07,"@LulapeloBrasil já provou que é possível crescer com justiça social, combatendo as desigualdades e gerando empregos."
910190083436924929,2017-09-19 17:13:21,19-09-2017 17:13:21,"Não contem comigo para essa estratégia. O @ptbrasil não tem Plano A, B ou C. Tem Plano L, de @LulapeloBrasil presidente! https://t.co/G4QlHutPQK"
910189589633142785,2017-09-19 17:11:23,19-09-2017 17:11:23,Parte dessa estratégia consiste em buscar naturalizar supostas candidaturas alternativas dentro do @ptbrasil.
910189443897847808,2017-09-19 17:10:48,19-09-2017 17:10:48,"Não satisfeitos com o ocorrido em 2016, a Turma do Golpe agora ensaia um novo capítulo, ao tentar impedir a candidatura de @LulapeloBrasil."
909855657704255488,2017-09-18 19:04:27,18-09-2017 19:04:27,Saiba mais: https://t.co/RZW2oGuLQ8
909855558731206656,2017-09-18 19:04:04,18-09-2017 19:04:04,Feira de Santana merece e está tendo um aniversário tamanho G! #Feira184Anos
909855411825717249,2017-09-18 19:03:29,18-09-2017 19:03:29,"Mais uma grande realização de @costa_rui #correria, que ainda anunciou a reforma da emergência do Hospital Geral Cleriston Andrade."
909855266274971648,2017-09-18 19:02:54,18-09-2017 19:02:54,"Inaugurada no fim da minha gestão, a Av. Nóide Cerqueira foi definitivamente finalizada hj com a entrega do viaduto de ligação com a BR-324."
909855135861440512,2017-09-18 19:02:23,18-09-2017 19:02:23,A maior obra viária de Feira de Santana agora está completa! #Feira184Anos https://t.co/gbbPa6jeEw
909791897404747776,2017-09-18 14:51:06,18-09-2017 14:51:06,"RT @costa_rui: Estou focado no trabalho e, graças a Deus, os resultados têm chegado ao povo da #Bahia. #FeiraDeSantana https://t.co/EJkdfD9…"
