id,datetime,created_at,text
979466954032414720,2018-03-29 21:14:54,29-03-2018 21:14:54,"Só juntos, praticando o diálogo e deixando as diferenças de lado, conseguiremos vencer a cultura do ódio e fazer esse país voltar a sonhar com dias melhores."
979466813611347968,2018-03-29 21:14:20,29-03-2018 21:14:20,"Depois de uma série de ataques e até de um atentado a tiros, os presidenciáveis @GuilhermeBoulos e @ManuelaDavila e milhares de pessoas se uniram a @LulapeloBrasil em Curitiba para marcar posição na luta contra a escalada fascista. https://t.co/L1Gm3sHgXW"
979466517954916352,2018-03-29 21:13:10,29-03-2018 21:13:10,Um grande demonstração de solidariedade a @LulapeloBrasil e de união em defesa da democracia. Assim foi o último e histórico ato da Caravana do ex-presidente pelo Sul do Brasil.
979093353844367360,2018-03-28 20:30:20,28-03-2018 20:30:20,"Não vamos abrir mão de defender os interesses da Bahia e jamais aceitaremos que nosso povo seja perseguido por quem quer que seja, ainda mais por um governo ilegítimo. https://t.co/UJaOs9xXma"
979092037038477312,2018-03-28 20:25:06,28-03-2018 20:25:06,"A vitória é importante, mas ainda é parcial e por isso continuaremos mobilizados aqui e em Brasília para garantir que ela seja definitiva. #Fafen"
979091712076386304,2018-03-28 20:23:49,28-03-2018 20:23:49,"O Governo Temer e seus aliados da Turma do Atraso, que tanto têm se esforçado para perseguir nosso estado, recuaram e anunciaram hoje a suspensão por 120 dias do fechamento da fábrica de Fertilizantes Nitrogenados (Fafen) em Camaçari. #Fafen"
979091541946982402,2018-03-28 20:23:08,28-03-2018 20:23:08,"A luta continua, mas a Bahia venceu a primeira batalha. A pressão do governador @costa_rui, da nossa bancada no Congresso, da FIEB e dos sindicatos dos petroleiros e dos químicos deu certo. https://t.co/kNQFLhk3eK"
979056990541484032,2018-03-28 18:05:51,28-03-2018 18:05:51,"RT @costa_rui: Por um Brasil sem perseguição! Minha solidariedade a @LulapeloBrasil. E que este país conviva com o diferente, dê oportunida…"
979020732402454529,2018-03-28 15:41:46,28-03-2018 15:41:46,É chegada a hora de as forças progressistas desse país deixarem as diferenças de lado e se unirem. O que está em jogo agora é a nossa democracia. #AtentadoContraLula
979020631722389504,2018-03-28 15:41:22,28-03-2018 15:41:22,"O momento requer coragem e clareza de princípios e propósitos.  Os principais inimigos do Brasil hoje são o ódio e o fascismo e eles não podem prosperar, não podem vencer.  #AtentadoContraLula"
979020545911123974,2018-03-28 15:41:02,28-03-2018 15:41:02,"Os tiros disparados ontem contra os ônibus da caravana de @LulapeloBrasil foram tiros disparados contra a democracia. Trata-se de um acontecimento gravíssimo, inaceitável, inadmissível e não há nada que o justifique. #AtentadoContraLula https://t.co/4FwZFLW6tb"
979020344701964288,2018-03-28 15:40:14,28-03-2018 15:40:14,"Ofensas viraram ovos, ovos viraram pedras, pedras viraram tiros. Até onde vai a escalada do ódio e da violência contra o ex-presidente @LulapeloBrasil?  #AtentadoContraLula"
978721139085205504,2018-03-27 19:51:17,27-03-2018 19:51:17,É por essas e por tantas obras e realizações que cada vez mais eu ouço o povo dizendo por aí que @costa_rui é o melhor prefeito de Salvador. https://t.co/Z9jROkMTsr
978720502280749056,2018-03-27 19:48:46,27-03-2018 19:48:46,"Nos últimos dias, o melhor governador do Brasil anunciou mais dois grandes investimentos para fazer a saúde chegar mais perto de quem mais precisa: a construção da policlínica de Escada e da UBS de Itapuã."
978720055822311424,2018-03-27 19:46:59,27-03-2018 19:46:59,"Se o prefeito não cuida da saúde, deixando Salvador com uma das piores coberturas de atenção básica entre as capitais, pode chamar o #correria que ele vai trabalhar pra resolver. @costa_rui https://t.co/hyVJrxxMKf"
978390884210413568,2018-03-26 21:58:59,26-03-2018 21:58:59,Pedras e xingamentos nunca foram nem serão capazes de reprimir ideias e de conter a esperança que @LulapeloBrasil desperta no nosso povo. https://t.co/yiYTpQJbdg
978390516332154886,2018-03-26 21:57:31,26-03-2018 21:57:31,"Quem enfrentou a ditadura, quem sempre lutou por justiça e por igualdade, quem dedicou uma vida inteira a mudar e melhorar esse país jamais vai se deixar intimidar pela violência. @LulapeloBrasil"
978390381741174784,2018-03-26 21:56:59,26-03-2018 21:56:59,"Diante de atos fascistas como os que aconteceram nos últimos dias, não há mesmo outra alternativa. Seguir em frente, não recuar, manter-se forte é o único caminho possível para afirmar a força da democracia e combater os disseminadores do ódio. @LulapeloBrasil"
978390081726832642,2018-03-26 21:55:47,26-03-2018 21:55:47,"Vítima de seguidos e covardes ataques por parte de grupos de extrema direita, a Caravana de @LulapeloBrasil pelo Sul continua e, conforme planejado, seguiu nesta segunda (26) para o Paraná, onde se encerrará em Curitiba."
977341904072228865,2018-03-24 00:30:42,24-03-2018 00:30:42,Esperamos que esse seja o caminho seguido daqui pra frente e que todas as injustiças contra @LulapeloBrasil sejam devidamente corrigidas. https://t.co/Ns6qqmB5Tm
977341485556277248,2018-03-24 00:29:02,24-03-2018 00:29:02,"Mas é sempre uma boa notícia saber que a lei das leis, a Constituição, voltou a ser respeitada depois de tantas violações cometidas por setores politizados da Justiça. @LulapeloBrasil"
977341316668387328,2018-03-24 00:28:22,24-03-2018 00:28:22,Não acho que tenha sido uma vitória e nem que as forças progressistas já tenham motivos para festejar. Vamos aguardar com muita calma e cautela a decisão final. @LulapeloBrasil
977341102477881344,2018-03-24 00:27:31,24-03-2018 00:27:31,Recebi a decisão do STF de aceitar julgar o habeas corpus de @LulapeloBrasil e de expedir liminar impedindo a prisão do ex-presidente até o dia 4 de abril com serenidade. Encaro o julgamento de ontem como uma volta à normalidade democrática.
977264202921504768,2018-03-23 19:21:57,23-03-2018 19:21:57,"A concorrência do novo modal, que vai revolucionar a mobilidade do Subúrbio Ferroviário e estará integrado ao #metrô, será lançada no início de mês de abril, provavelmente no dia 4. https://t.co/0TAruG1pza"
977264056754212868,2018-03-23 19:21:22,23-03-2018 19:21:22,"Nesta sexta-feira (23), logo depois de inaugurar o Terminal de ônibus de Pituaçu, nosso governador divulgou mais uma grande novidade para Salvador: a licitação do #VLT. 🚆 https://t.co/KEjpuVS1qJ"
977263696773894144,2018-03-23 19:19:56,23-03-2018 19:19:56,Nem bem terminou de entregar uma #ObraTamanhoG e já está anunciando a próxima. Com @costa_rui #correria é assim: o trabalho para melhorar a vida dos baianos nunca para.
977193478445846528,2018-03-23 14:40:55,23-03-2018 14:40:55,"Todo mundo já sabe: quem tá mudando Salvador de verdade é @costa_rui, o governador que também é prefeito. https://t.co/JF9BVIzIuF"
977193272455106562,2018-03-23 14:40:06,23-03-2018 14:40:06,"Amplo, seguro, confortável e com capacidade para receber 280 mil passageiros por dia, o Terminal de Pituaçu é mais uma #ObraTamanhoG que vai adiantar ainda mais o lado dos soteropolitanos."
977193032889053184,2018-03-23 14:39:09,23-03-2018 14:39:09,"Sem @costa_rui não teríamos metrô, nem integração buzu-metrô, nem as novas avenidas, passarelas e viadutos. Não teríamos os novos terminais de ônibus, como o terminal de Pituaçu, inaugurado nesta sexta-feira (23)."
977192585327456256,2018-03-23 14:37:22,23-03-2018 14:37:22,"Já imaginou Salvador sem o #correria? 🤔 Já imaginou a mobilidade de Salvador sem o #correria? Impossível, né? 😉"
976884368730968064,2018-03-22 18:12:37,22-03-2018 18:12:37,"""Não podemos compactuar com essa medida arbitrária que prejudicará diretamente os estados da Bahia e de Sergipe, bem como nossos trabalhadores"", afirmou @costa_rui #correria em artigo publicado na imprensa. https://t.co/AZY8CnVwxB"
976884076153131013,2018-03-22 18:11:28,22-03-2018 18:11:28,"No que depender do governador @costa_rui, todos os esforços serão feitos, inclusive mobilizando a bancada baiana no Congresso Nacional, para que essa decisão ""inconsequente e irresponsável"" seja revertida. https://t.co/3SmEfuuCA6"
976883711072489472,2018-03-22 18:10:00,22-03-2018 18:10:00,Se o governo ilegítimo de Temer e seus aliados da Turma do Atraso achavam que a Bahia iria aceitar sem resistência o fechamento da fábrica de fertilizantes em Camaçari estavam muito enganados.
976457570159349760,2018-03-21 13:56:41,21-03-2018 13:56:41,Energia solar bombando é o futuro se fazendo realidade no presente e a Bahia mais uma vez sendo exemplo para o Brasil. #energiasolar
976457335865511936,2018-03-21 13:55:45,21-03-2018 13:55:45,"Com incentivos do Governo do Estado, esse novo setor da economia está crescendo rapidamente e gerando emprego e renda para o nosso povo. #energiasolar"
976457038946537473,2018-03-21 13:54:34,21-03-2018 13:54:34,"No ano passado, informa reportagem do @atarde, as usinas baianas sozinhas produziram 31% de toda a energia solar do país."
976456895824310272,2018-03-21 13:54:00,21-03-2018 13:54:00,"Líder de geração de empregos no Nordeste, segundo estado que mais investiu em 2017, a Bahia tem mais um título para comemorar: o primeiro lugar em geração de energia solar. https://t.co/E2GFCFD8qm"
976219921909796864,2018-03-20 22:12:21,20-03-2018 22:12:21,"São muitas as perguntas, mas o povo baiano, acostumado à luta e a não comer reggae de ninguém, certamente saberá responder à altura em outubro, nas urnas. https://t.co/QmsCVBdkKK"
976219652232830977,2018-03-20 22:11:17,20-03-2018 22:11:17,Por que tamanha mesquinharia? E por que políticos baianos continuam apoiando um governo que maltrata e prejudica tanto seus conterrâneos?
976219440361738241,2018-03-20 22:10:26,20-03-2018 22:10:26,O mais novo capítulo da perseguição foi denunciado pelo governador @costa_rui: o fechamento de uma fábrica de fertilizantes em Camaçari que empregava mais de mil pessoas e era fundamental para a cadeia produtiva da agricultura em nosso estado. https://t.co/WAQVsg6Xbh
976218971086127111,2018-03-20 22:08:34,20-03-2018 22:08:34,"Não ajuda e ainda atrapalha. Como se não bastasse ter bloqueado um empréstimo de R$ 600 milhões por meses e atrasado verbas para obras que teria obrigação de ajudar a financiar, o governo Temer continua produzindo maldades contra a Bahia."
976168938928312321,2018-03-20 18:49:46,20-03-2018 18:49:46,"E respeitar a vontade popular significa deixar @LulapeloBrasil participar. Se querem derrotá-lo, que o façam nas urnas. https://t.co/dkTsfP1Bla"
976168722682531840,2018-03-20 18:48:54,20-03-2018 18:48:54,"É @LulapeloBrasil que o povo quer e uma eleição, para ser completa e verdadeiramente democrática, precisa respeitar a vontade do povo."
976168550384766977,2018-03-20 18:48:13,20-03-2018 18:48:13,"Vamos lutar até o último minuto para que @LulapeloBrasil seja candidato. Ele é a maior liderança política do país, reconhecido no mundo inteiro por seu trabalho de combate à fome e à pobreza, além de permanecer firme e forte no coração e na mente dos brasileiros."
975853703839342594,2018-03-19 21:57:08,19-03-2018 21:57:08,"O #correria é da família. @costa_rui é um irmão e o que interessa é que o nosso projeto continue por muitos e muitos anos fazendo mais por quem mais precisa, independentemente de quem esteja à frente."
975853024026464256,2018-03-19 21:54:26,19-03-2018 21:54:26,"E, ao contrário do que muitos podem pensar, o sucesso de @costa_rui não me causa a mínima inveja."
975852799320887296,2018-03-19 21:53:32,19-03-2018 21:53:32,"Referência em gestão no Nordeste, @costa_rui agora caminha a passos largos para ser uma das principais lideranças políticas do país em um futuro próximo."
975852498908041218,2018-03-19 21:52:20,19-03-2018 21:52:20,Conheço e convivo de perto com o #correria há mais de 30 anos e sempre soube de suas virtudes. @costa_rui https://t.co/5J3nLuJrio
975852356419178497,2018-03-19 21:51:46,19-03-2018 21:51:46,"Por onde passo, recebo elogios e sinto o carinho do povo por @costa_rui. Para muitos, ele pode ter sido uma grata surpresa, não para mim."
975796136693895175,2018-03-19 18:08:23,19-03-2018 18:08:23,"Fazer política é gostar de gente, da nossa gente. #SantoEstevão #Bahia

Foto: João Ramos https://t.co/GJBUPC2RpP"
975003267594932224,2018-03-17 13:37:48,17-03-2018 13:37:48,"Conversar com quem representa a ignorância, o obscurantismo, com quem faz da disseminação do ódio e da intolerância o centro da sua atuação política é inadmissível. É inaceitável. Nada de bom pode vir daí. https://t.co/SqXYK4YQji"
975002510141386752,2018-03-17 13:34:47,17-03-2018 13:34:47,Entendo a política como a arte de negociar diferenças para construir consensos. Mas há limites. Há limites porque há valores que são inegociáveis.
975002192456437761,2018-03-17 13:33:32,17-03-2018 13:33:32,"Dialogar é próprio da política. Ninguém ganha eleição e consegue governar sozinho, sem o apoio e a sustentação de outras forças políticas."
974997985183633408,2018-03-17 13:16:48,17-03-2018 13:16:48,"#TMJ

Foto: Ricardo Stuckert https://t.co/29k7xBcf5i"
974770124044623872,2018-03-16 22:11:22,16-03-2018 22:11:22,"Minha amizade com @costa_rui é das antigas. São mais de trinta anos de companheirismo, lealdade e lutas, muitas lutas. Confiram o que @LulapeloBrasil falou sobre essa relação ao programa #LinhaDeFrente, do @aratuonline. https://t.co/LwCjJZVvXz"
974707702608924672,2018-03-16 18:03:20,16-03-2018 18:03:20,"A Bahia nunca fugiu da luta. Sempre que as forças do atraso tentaram acabar com direitos e conquistas, os baianos se mobilizaram. Agora não pode ser diferente. Acesse https://t.co/yPCJGRG0l8, faça seu cadastro e participe da resistência! #ABahiaResiste https://t.co/gNzvYCdphI"
974631600578289665,2018-03-16 13:00:56,16-03-2018 13:00:56,"RT @costa_rui: Seguimos com a idade avançando, ainda bem, mas aquele espírito que nos inquietou há anos segue vivo e firme! Saúde para segu…"
974631445259083776,2018-03-16 13:00:18,16-03-2018 13:00:18,"RT @costa_rui: Feliz por mais um ano de vida do amigo @jaqueswagner! Nas nossas caminhadas, a proteção do Senhor do Bonfim e o axé da Bahia…"
974629713997115392,2018-03-16 12:53:26,16-03-2018 12:53:26,"🎂 🎉 O galego mais retado e gente boa que a Bahia respeita! Feliz Aniversário, Wagner! #EquipeJW #Wagner67 🎂🎉 https://t.co/8c5p3M9PUP"
974390665537826822,2018-03-15 21:03:32,15-03-2018 21:03:32,"Orgulho do @ptbrasil e da Bahia! Com humildade e muita #correria, @costa_rui cada vez mais conquista a confiança dos baianos e se consolida como uma liderança regional e nacional. Um governador tamanho G. https://t.co/WxzIswDYEZ"
974349168570503168,2018-03-15 18:18:38,15-03-2018 18:18:38,"Marielle vive. Marielle, presente! https://t.co/lPSRByZoMJ"
974348926005465088,2018-03-15 18:17:41,15-03-2018 18:17:41,"Que o luto de hoje seja logo transformado em luta, força e união para tornar possível a construção do Brasil pelo qual Marielle batalhou: um país justo e igualitário, que trate todos os seus cidadãos com respeito e dignidade."
974348783394967552,2018-03-15 18:17:07,15-03-2018 18:17:07,"Mulher, negra, nascida e criada na favela, Marielle Franco foi uma guerreira dos direitos humanos, da justiça e da igualdade."
974306161687187456,2018-03-15 15:27:45,15-03-2018 15:27:45,Com @LulapeloBrasil e @costa_rui. 40 anos de amizade e companheirismo. https://t.co/5fzCXCxGGB
974268872303038464,2018-03-15 12:59:34,15-03-2018 12:59:34,"RT @LulapeloBrasil: Com @jaqueswagner na Bahia.

Foto: Ricardo Stuckert https://t.co/NgLaCITyLh"
974068283602341893,2018-03-14 23:42:30,14-03-2018 23:42:30,"Cúpula dos Povos do Fórum Social Mundial amanhã em Salvador, com @LulapeloBrasil e @dilmabr. Venha (de metrô correria)! https://t.co/7fLBRbzCj5"
974041820366860288,2018-03-14 21:57:21,14-03-2018 21:57:21,"Independente e técnico, o relatório foi produzido por pesquisadores da Escola de Administração e também constatou que as arenas construídas via PPP apresentaram custos menores, comprovando que nós acertamos ao optar por esse modelo de contratação. https://t.co/QMGV0G9H4R"
974041255536680960,2018-03-14 21:55:06,14-03-2018 21:55:06,"Totalmente ignorado pela atrapalhada ação policial de duas semanas atrás, o estudo ""UFBA na Copa"" concluiu que o preço da Fonte Nova está na média do que custaram os estádios da Copa da Alemanha, em 2006, e da Copa da África do Sul, em 2010. https://t.co/Ugp7NxCh8S"
974015166710013953,2018-03-14 20:11:26,14-03-2018 20:11:26,"Apesar disso, Aécio continua livre, leve e solto, enquanto @LulapeloBrasil foi condenado e pode ser preso com base unicamente em convicções. Como explicar tamanha parcialidade, tamanha injustiça? https://t.co/8TtpHBNQWv"
974014249457586177,2018-03-14 20:07:48,14-03-2018 20:07:48,"Em menos de um ano, apareceram contra Aécio mala, gravação e um patrimônio que experimentou o milagre da multiplicação."
974013841846800389,2018-03-14 20:06:10,14-03-2018 20:06:10,Nunca antes na história desse país se produziram tantas provas em tão pouco tempo como no caso do senador Aécio Neves.
973979927421865991,2018-03-14 17:51:25,14-03-2018 17:51:25,"Como presidente, Temer pode ter sido o melhor humorista que o Brasil conheceu. https://t.co/bJPQoxlOtA"
973682486441136129,2018-03-13 22:09:29,13-03-2018 22:09:29,RT @costa_rui: #PapoCorreria https://t.co/wXbpjofGX2
973675664275574784,2018-03-13 21:42:23,13-03-2018 21:42:23,"A sociedade baiana, a quem devo esclarecimentos como homem público, pode ficar tranquila: não houve qualquer irregularidade e eu vou  provar isso. https://t.co/IKLOuaVH1F"
973675503352795136,2018-03-13 21:41:44,13-03-2018 21:41:44,"Como mostra uma reportagem (https://t.co/4lRW6GCn6A) de maio de 2011 publicada pelo @correio24horas, ministros do Tribunal de Contas da União (TCU) visitaram Salvador à época e fizeram elogios ao modelo de contratação da Arena Fonte Nova."
973675182169698305,2018-03-13 21:40:28,13-03-2018 21:40:28,"Feita de forma completamente regular, o projeto de Parceria Público-Privada (PPP) da Fonte Nova foi aprovado por instituições de controle privadas e públicas."
973633723693436928,2018-03-13 18:55:43,13-03-2018 18:55:43,"Se tivesse que escolher outra vez, optaria de novo pela PPP com absoluta tranquilidade. https://t.co/1eadwpFLBv"
973633533297201152,2018-03-13 18:54:58,13-03-2018 18:54:58,"No caso da Arena, a obra foi entregue antes do prazo e com economia para os cofres públicos, como mostra o estudo independente ""UFBA na Copa"", feito por pesquisadores da Escola da Administração."
973633214215606273,2018-03-13 18:53:42,13-03-2018 18:53:42,"A Parceria Público-Privada (PPP) é uma das principais ferramentas da gestão pública moderna. Esse modelo de contratação se revelou um acerto inquestionável, utilizado não só na Fonte Nova, como no Hospital do Subúrbio e no Metrô."
973579615489937408,2018-03-13 15:20:43,13-03-2018 15:20:43,"Quero e vou desmontar tecnicamente, no devido tempo e na instância devida, todas as injustas e falsas acusações feitas. Confiram a entrevista que concedi ao @atarde sobre a atrapalhada operação de duas semanas atrás. https://t.co/XSyPKe1Fhj"
973579391325409280,2018-03-13 15:19:49,13-03-2018 15:19:49,"Não quero entrar na discussão ideológica, nem quero ocupar a posição de vítima, de perseguido. Isso não me interessa. O que eu quero é desmontar objetivamente, com fatos, provas e estudos. #AVerdadeSobreAFonteNova"
973292172165484544,2018-03-12 20:18:31,12-03-2018 20:18:31,"Convenientemente, entretanto, a @folha ""esqueceu"" de citar a paternidade da obra, mas o povo nordestino sabe muito bem e jamais esquecerá que a transposição tem pai e tem mãe e que esse legado ninguém pode apagar. https://t.co/ZL9NpbnCyF"
973291997665615873,2018-03-12 20:17:49,12-03-2018 20:17:49,"No fim de semana, a @folha publicou uma extensa reportagem mostrando os impactos positivos da chegada das águas do Velho Chico na vida de 1 milhão de paraibanos e pernambucanos."
973291613689663491,2018-03-12 20:16:18,12-03-2018 20:16:18,"Quem atesta o sucesso da Transposição, mais uma grande conquista dos governos petistas, é a @folha, que não pode ser acusada de petista ou de simpatizar com o partido."
973291312626663426,2018-03-12 20:15:06,12-03-2018 20:15:06,"As cotas deram certo, o Mais Médicos deu certo, o Bolsa Família deu certo, o Minha Casa, Minha Vida deu certo, o PROUNI deu certo e a Transposição do Rio São Francisco também. Tudo culpa do @ptbrasil, de @LulapeloBrasil e da presidenta @dilmabr. https://t.co/hySt2YrFmF"
973255290471804929,2018-03-12 17:51:58,12-03-2018 17:51:58,"Hoje o dia é dela, essa mulher de garra, de fibra, sempre incansável na defesa dos interesses da Bahia e das pautas progressistas. Parabéns, @lidicedamata, e que você tenha muita força, saúde e coragem para seguir nessa trajetória que tanto orgulha os baianos. https://t.co/pwheUrLa3T"
972181828009422848,2018-03-09 18:46:24,09-03-2018 18:46:24,"Um é do @ptbrasil. O outro é do PSDB. Cadê a igualdade, cadê a imparcialidade? Cadê a Justiça? https://t.co/NJVJUOZARR"
972181584379039744,2018-03-09 18:45:26,09-03-2018 18:45:26,"O processo contra Eduardo Azeredo, por outro lado,  levou 10 anos para ser julgado. Ele teve a pena reduzida nesta semana e poderá recorrer em liberdade até a última instância."
972181369991368704,2018-03-09 18:44:35,09-03-2018 18:44:35,"O processo de @LulapeloBrasil levou apenas 1 ano e 4 meses para chegar à segunda instância, onde foi condenado sem provas. Ele teve sua pena aumentada e poderá ser preso antes que se esgotem todas as possibilidades de recurso."
972090994459070469,2018-03-09 12:45:28,09-03-2018 12:45:28,É mais uma etapa da maior obra de mobilidade do país sendo concluída com sucesso! https://t.co/6oRk38elm4
972090878822109184,2018-03-09 12:45:00,09-03-2018 12:45:00,"Já começou a operação sem passageiros entre as estações Mussurunga e Aeroporto e dentro de poucas semanas, após todos os testes serem finalizados, será a sua vez de usar o metrô para chegar ou voltar do Aeroporto. #Metrô"
972090701348589570,2018-03-09 12:44:18,09-03-2018 12:44:18,"🚇 É um pássaro, é um avião? Não, é o metrô de Salvador avançando na velocidade da #correria! 😂 https://t.co/JJOAAKhcjR"
971755963991633920,2018-03-08 14:34:10,08-03-2018 14:34:10,"Ser mulher é lutar todos os dias, é lutar uma vida inteira. Meu reconhecimento e meu profundo respeito a todas as corações valentes que enfrentam, questionam, se impõem e não abaixam a cabeça diante de tantas injustiças. #DiaDaMulher https://t.co/VxmoSk4EiM"
971755629504233472,2018-03-08 14:32:51,08-03-2018 14:32:51,"Ser mulher é lutar contra a violência de gênero, lutar para não ser julgada pela roupa que veste, lutar pelo direito de ser livre, lutar para ser a primeira Presidenta da República em um país sempre governado por homens. #DiadaMulher"
971755226154913794,2018-03-08 14:31:14,08-03-2018 14:31:14,"Ser mulher é lutar contra o assédio moral, contra o assédio sexual, contra a desigualdade salarial, contra a baixa representatividade nos cargos de liderança e espaços de poder, contra as duplas e até triplas jornadas de trabalho. #DiadaMulher"
971402580550148097,2018-03-07 15:09:57,07-03-2018 15:09:57,"O povo baiano hoje anda de cabeça erguida, peito estufado e tem orgulho de dizer: nosso governador é tamanho G! @costa_rui https://t.co/q76Cg43sum"
971402244481540097,2018-03-07 15:08:37,07-03-2018 15:08:37,"É claro que ainda temos nossos problemas e sempre é possível melhorar, mas com estabilidade política e institucional, as contas em ordem, os salários em dia e muito trabalho, vencemos as dificuldades impostas pela crise. Nos tornamos referência para o Brasil."
971401884803231746,2018-03-07 15:07:11,07-03-2018 15:07:11,"Enquanto lá em Brasília é confusão atrás de confusão, retrocesso atrás de retrocesso, aqui @costa_rui #correria colocou a Bahia no caminho do progresso."
971401693979119616,2018-03-07 15:06:26,07-03-2018 15:06:26,Quem mora na Bahia e costuma acompanhar o noticiário nacional tem até a impressão de que vive em outro país.
971136928895700992,2018-03-06 21:34:21,06-03-2018 21:34:21,"Tudo isso, mais o fato de que uma equipe de TV chegou antes dos policiais em um dos locais da operação, mostram que a ação, como afirmou @LulapeloBrasil, foi deflagrada com intenções muito mais ""pirotécnicas"" do que propriamente investigativas. https://t.co/iSmezsfprD"
971136717033037824,2018-03-06 21:33:30,06-03-2018 21:33:30,"Quando convidado, fui lá e depus na condição de testemunha porque não tinha, como não tenho, nada a esconder, nada a omitir."
971136549290233856,2018-03-06 21:32:50,06-03-2018 21:32:50,"Todo o processo de licitação e construção da Fonte Nova, um dos estádios mais baratos entre todos os construídos no Brasil à época, foi acompanhado de perto pelo TCU, que, inclusive, elogiou o modelo de contratação da obra."
971102046651932674,2018-03-06 19:15:44,06-03-2018 19:15:44,"A atrapalhada operação empregou métodos que certamente arranharam a imagem da instituição Polícia Federal. ""Pura pirotecnia"" e ""absurdo dos absurdos"", condenou @LulapeloBrasil. https://t.co/ZVdimeyyYw"
971101906302103552,2018-03-06 19:15:11,06-03-2018 19:15:11,"Para @LulapeloBrasil, a ação repete, em nível estadual, o que estão fazendo contra ele no plano nacional. ""Estão fazendo com Wagner o que fizeram comigo"", avaliou."
