id,datetime,created_at,text
562823005731315713,2015-02-04 04:00:35,04-02-2015 04:00:35,"@Jbarbosa2014 é fake, nada tem a ver comigo. A minha conta de tweeter verdadeira é esta aqui: @joaquimboficial. Joaquim Barbosa."
557743954243117056,2015-01-21 03:38:15,21-01-2015 03:38:15,Notem: já viram aquele púlpito nos jardins da Casa Branca? É ali que que o Presidente dos EUA quase diariamente presta contas à Nação!
557743304218271746,2015-01-21 03:35:40,21-01-2015 03:35:40,"2.2) mesmo em situações de crise ética, moral e de gestão, nossos presidentes nao vêem necessidade de prestar contas à Nação."
557741618619760643,2015-01-21 03:28:58,21-01-2015 03:28:58,"2.1) Brasil: uma vez eleito, o Presidente raramente se julga no dever de de explicar à Nação a situação do país, salvo quando tem a ganhar."
557739715462705152,2015-01-21 03:21:25,21-01-2015 03:21:25,2) Brasil: o Presidente nao comparece ao Congresso. Envia um subordinado que lerá um papelucho qualquer aos parlamentares!
557739021926166528,2015-01-21 03:18:39,21-01-2015 03:18:39,1.3) o respeito pelas instituições: o Presidente entra no Congresso e é aplaudido de pé pelos seus correligionários e pela oposição.
557738287503527938,2015-01-21 03:15:44,21-01-2015 03:15:44,1.2) EUA: quantas mudanças em 50 anos! Vejam a importante diversidade racial e de gênero espelhada na platéia!
557737218945851392,2015-01-21 03:11:29,21-01-2015 03:11:29,"1.1) EUA: ao invés de cooptar o Congresso com o toma-lá-dá-cá, o Presidente expõe os seus planos e incita o Congresso a aprová-los."
557736439149232130,2015-01-21 03:08:23,21-01-2015 03:08:23,"1) EUA: transparência/responsabilidade p c o povo: cercado pelas mais altas autoridades do país, o Presidente se expõe perante a Nação."
557733064995254275,2015-01-21 02:54:59,21-01-2015 02:54:59,"Como o Brasil copiou o presidencialismo dos EUA em 1891, permitam-me fazer algumas comparações, à luz do discurso do Obama."
557732518712324097,2015-01-21 02:52:49,21-01-2015 02:52:49,"Querem uma dica? Vejam o discurso ""O Estado da União"" que o presidente Obama pronunciou hj perante o Congresso dos EUA."
557688273641164800,2015-01-20 23:57:00,20-01-2015 23:57:00,Gabeira: os programas sobre o homem solitário do litoral do RJ e sobre o Maranhão ilustram muito bem o que acabo de dizer.
557687490187120642,2015-01-20 23:53:53,20-01-2015 23:53:53,"O que o Gabeira faz não é jornalismo, é serviço de utilidade pública, de educacão, de conscientização social, de civismo. Magnífico!"
553027620338933760,2015-01-08 03:17:14,08-01-2015 03:17:14,Como o fanatismo pode levar seres humanos a cometer monstruosidades como a de ontem em Paris!
553026301544914944,2015-01-08 03:11:59,08-01-2015 03:11:59,"RT @gtoueg: ""Ninguém merece morrer por uma piada, mesmo racista. Basta não rir ou reagir com bom humor"" http://t.co/9rVcM5z3i0 @gugachacra"
547142103281963009,2014-12-22 21:30:17,22-12-2014 21:30:17,"Min Público é órgão de contenção do poder político. Existe para controlar-lhe os desvios, investigá-lo, não p assessorá-lo. Du jamais vu!"
547140669568196608,2014-12-22 21:24:35,22-12-2014 21:24:35,"Onde estão os áulicos tidos como candidatos a uma vaga no STF, que poderiam esclarecer: ""Ministério Público não é órgão de assessoria!!!"
547133920517836801,2014-12-22 20:57:46,22-12-2014 20:57:46,Há sinais claros de que a chefe do Estado brasileiro não dispõe de pessoas minimamente lúcidas para aconselhá-la em situações de crise
547131612157472770,2014-12-22 20:48:36,22-12-2014 20:48:36,Que degradação institucional! Nossa presidente vai consultar órgão de persecução criminal antes de nomear um membro do seu governo!!!
544559271334391808,2014-12-15 18:27:02,15-12-2014 18:27:02,"Meu respeito e minhas homenagens a um grande brasileiro: o Senador Pedro Simon, que se despediu do Senado da República."
542890916038860800,2014-12-11 03:57:35,11-12-2014 03:57:35,"RT @SergiusAugustus: Os 4 melhores beijos cinematográficos do ano.&gt;http://t.co/vxXO14q840
Ok, há controvérsias. Pela primeira vez, achei Re…"
542762995047497728,2014-12-10 19:29:16,10-12-2014 19:29:16,2) the ousting of a congressman by his peers for his involvement in this disgusting scheme. A new check for the Brazilian political system?
542761227978829824,2014-12-10 19:22:15,10-12-2014 19:22:15,2 major steps in Brazil's Petrobras corruption scandal: the Attorney General's request that the company's top management should be fired
541362791589117954,2014-12-06 22:45:22,06-12-2014 22:45:22,"@AntonioJLechuga estimado Lechuga, el libro es fantastico, muy bien escrito!"
539402531584376832,2014-12-01 12:55:59,01-12-2014 12:55:59,https://t.co/yjN3QPOPsp
538181611662368768,2014-11-28 04:04:29,28-11-2014 04:04:29,RT @JornalOGlobo: A autobiografia inédita de um escravo africano no Brasil. http://t.co/jxfh4O2o7E http://t.co/WL4D187sIO
537781519256154112,2014-11-27 01:34:40,27-11-2014 01:34:40,RT @folha: A ex-modelo viciada em crack e o nosso racismo implícito http://t.co/KcpJ4U8xHq http://t.co/eymoUSX24O
535997012131717121,2014-11-22 03:23:40,22-11-2014 03:23:40,"@Andreiarosario apoio em que sentido, Andréia? Nao entendi."
535485571322642432,2014-11-20 17:31:23,20-11-2014 17:31:23,"Amigos, alerta: a nossa maior empresa perdeu 20% do seu valor este ano; US$ 1,8 bi saiu do país na semana passada. É isso o que importa!"
535467472586280961,2014-11-20 16:19:28,20-11-2014 16:19:28,"Está no Brasil a fazer conferências o escritor Javier Moro, autor de O Império é Você/El Imperio eres tu, sobre D. Pedro I. Não percam!"
535463251619115008,2014-11-20 16:02:42,20-11-2014 16:02:42,"Meus votos de pesar à família do dr Marcio T Bastos, um exemplar ministro da Justiça do Brasil e defensor criminal de primeira linha."
534520097399123969,2014-11-18 01:34:56,18-11-2014 01:34:56,"RT @mottacl: @joaquimboficial Prezado, tomei a liberdade de anexar o link deste artigo (Forte Abraço) - http://t.co/aIzE956W4E"
534180874250883074,2014-11-17 03:06:59,17-11-2014 03:06:59,"Ezequiel Adamovsky: ""Historia de la Clase Media Argentina - Apogeo y decadencia de una ilusión, 1919-2003"". Muito esclarecedor."
534179660356399105,2014-11-17 03:02:10,17-11-2014 03:02:10,"Amigos, mais dicas de bons livros: ""Historia Comparada Argentina-Brasil"", de Fernando Devoto e Boris Fausto. Muito interessante."
534172648167968768,2014-11-17 02:34:18,17-11-2014 02:34:18,"""!Crear o Morir!"", de Andrés Oppenheimer: um livro de leitura super agradável sobre tema da mais alta relevância: inovação!"
534170697720139778,2014-11-17 02:26:33,17-11-2014 02:26:33,O artigo do professor Renato Janine Ribeiro deveria ser leitura obrigatória nas escolas e universidades brasileiras.
534170235277152256,2014-11-17 02:24:43,17-11-2014 02:24:43,"""A República como Déficit"", artigo de Renato Janine Ribeiro, publicado no Estadão de domingo: um primor de análise sobre o Brasil."
533026224504066048,2014-11-13 22:38:49,13-11-2014 22:38:49,RT @rgodoyjr: Gostei de um vídeo @YouTube http://t.co/S9MWJThPoy de INFOBAE a Gloria Álvarez sobre el populismo en América Latina
529873751148875776,2014-11-05 05:52:01,05-11-2014 05:52:01,RT @Valfonis: @joaquimboficial Pago em NYC uma tarifa unica de US$ 60.00 para ter internet/internaional/talk and text ilimitados !!
525893660341055488,2014-10-25 06:16:33,25-10-2014 06:16:33,"Em 21/10/14, em conversa c Eduardo Costantini, criador e mantenedor do museu Malba, de B Aires. http://t.co/xIbvw1POT8"
525890916578783232,2014-10-25 06:05:39,25-10-2014 06:05:39,"B Aires, 21/10/14, com R Lorenzetti, presidente Suprema Corte argentina, e L M Ocampo, ex PG Trib Pen Internacional. http://t.co/5yqI1ZV6ML"
525889952626647042,2014-10-25 06:01:49,25-10-2014 06:01:49,"Em Buenos Aires, em 21/10/2014, com Ricardo Lorenzetti, presidente da Corte Suprema da Argentina, e http://t.co/gkKMebGix2"
525886365477896192,2014-10-25 05:47:34,25-10-2014 05:47:34,"Terça, 21/10/2014, em Buenos Aires, com Adolfo Perez Esquivel, Prêmio Nobel da Paz 1980. http://t.co/x6wVlmH6YK"
525061430949969920,2014-10-22 23:09:34,22-10-2014 23:09:34,"Falei hj em B. Aires no congresso da American Bar Association. Muito bom, público de alto nível e interessado nas instituições brasileiras."
523368597306232832,2014-10-18 07:02:51,18-10-2014 07:02:51,"Caro Ed Garcia, equivoquei-me. Meu perfil atualizado no Facebook é Joaquim Barbosa Gomes. Abraço."
522511940044988416,2014-10-15 22:18:48,15-10-2014 22:18:48,Alguém precisa dizer ao senador Vital do Rego o exato sentido e a extensão do princípio de separação dos poderes!
518412247329406976,2014-10-04 14:48:06,04-10-2014 14:48:06,Rodi: nenhuma democracia sobrevive sem alternância de poder. Olhe o nosso entorno e veja a devastação feita p perpetuação de grupos
518410368885219329,2014-10-04 14:40:38,04-10-2014 14:40:38,"Sim, reitero: a reeleição é o elemento propulsor, o fator multiplicador de práticas de corrupção no nosso país."
517015502582206464,2014-09-30 18:17:56,30-09-2014 18:17:56,RT @paulocoelho: Que honra ver o Expresso 2222 aqui em casa por 5 dias! Viva @Floragil2222 e @gilbertogil http://t.co/RkBZvH916p
517001828941447168,2014-09-30 17:23:36,30-09-2014 17:23:36,"Linha do tempo: ontem, 29/9, às 15h, apus minhas impressões digitais ao pedido de reinscrição na OAB-DF. A original datava de março 1980"
515355978779602944,2014-09-26 04:23:34,26-09-2014 04:23:34,"Um livro belo, instrutivo e atualíssimo: ""Cidadania no Brasil"", de José Murilo de Carvalho. Incontornável."
515347314941382656,2014-09-26 03:49:09,26-09-2014 03:49:09,RT @tbsorrentino: @joaquimboficial http://t.co/xTcoVTELZ7
514787875968544768,2014-09-24 14:46:08,24-09-2014 14:46:08,Meu sonho: termos dirigentes que saibam o efeito profundo que a educacão disseminada e de qualidade tem sobre o desenvolvimento de um país!
514786345760600065,2014-09-24 14:40:03,24-09-2014 14:40:03,"Claro, abertura de mercado, eliminação dos oligopólios, perfeito! Mas a idéia do ""celular nacional"" é só um exemplo. Factível. Simples."
514783651054505984,2014-09-24 14:29:21,24-09-2014 14:29:21,"Nos EUA,Argentina, U Européia há uma tarifa única para celular, nacional. Nada de interurbano! Por que não aqui? Engodo!"
514782204753612800,2014-09-24 14:23:36,24-09-2014 14:23:36,"Sugestão concreta aos candidatos à presidência: prometer aos brasileiros a redução drástica das tarifas de telefone, p exemplo."
514781561892634624,2014-09-24 14:21:03,24-09-2014 14:21:03,"Atenção: meu perfil no Facebook está sob o nome Joaquim Gomes. Agora, com a mesma foto daqui. Abs a todos."
509796740682502144,2014-09-10 20:13:09,10-09-2014 20:13:09,Pego carona no artigo do Damatta e conclamo nossas autoridades a reduzir drasticamente essa excrescência chamada propaganda eleitoral.
509795965348626433,2014-09-10 20:10:04,10-09-2014 20:10:04,"Recomendo vivamente a leitura do artigo do Roberto Damatta, ""Candidatos, pedintes e profetas"", no Estadão de hj, 10/9."
496512184978276352,2014-08-05 04:25:04,05-08-2014 04:25:04,Lembram-se dos ataques sistemáticos que esse Chaer fez a mim ao longos dos anos? Achava que estava me intimidando! Ignorei-o.
496511415763869696,2014-08-05 04:22:00,05-08-2014 04:22:00,Marcio Chaer e os que o remuneram temem o que vou dizer em breve sobre o assunto.
496509855000436736,2014-08-05 04:15:48,05-08-2014 04:15:48,Qual a causa do ataque gratuito desse tal Marcio Chaer à minha pessoa? É o apoio que dei ha dias ao fim dos embargos auriculares!
496143075333664768,2014-08-04 03:58:21,04-08-2014 03:58:21,"Para conhecer melhor a Argentina, país-irmão, sem os clichês do futebol: ler ""Facundo.."", de D Sarmiento. Um clássico incontornavel!"
494203638118510592,2014-07-29 19:31:43,29-07-2014 19:31:43,"Projeto Camilo Cola: o problema é bem mais abrangente; a nocividade, maior. Discorrerei sobre o assunto no futuro, no momento oportuno."
494202508622184448,2014-07-29 19:27:14,29-07-2014 19:27:14,"Felicito deputado Camilo Cola pela iniciativa do projeto de lei 6732/13 sobre ""embargos auriculares"". É um primeiro passo, positivo."
491406094216884225,2014-07-22 02:15:17,22-07-2014 02:15:17,http://t.co/qWebAWR4Ac
490508586750316544,2014-07-19 14:48:54,19-07-2014 14:48:54,"Sim, ""A Casa dos Budas Ditosos"": livro delicioso; peça de teatro excelente, com desempenho magistral de Fernanda Torres."
490281347291045888,2014-07-18 23:45:56,18-07-2014 23:45:56,"Vizinho de J Ubaldo nos anos 90, ""espiava"" com admiração suas caminhadas diárias, com as indefectíveis bermuda e sandália de dedo."
490280468240404480,2014-07-18 23:42:27,18-07-2014 23:42:27,"Vizinho de J Ubaldo nos anos 90, na General Urquiza, admiração, ""espiava""-o nas caminhadas c"
490277842845188096,2014-07-18 23:32:01,18-07-2014 23:32:01,"O Brasil amanheceu intelectual e espiritualmente mais pobre hoje em razão da morte de João Ubaldo. ""Viva o Povo Brasileiro"", sempre!"
490276315208359937,2014-07-18 23:25:57,18-07-2014 23:25:57,"João Ubaldo deixa um vazio imenso. Com Jorge Amado, integrava o grupo de romancistas vivos de maior impacto sobre minha geração."
487004824555503616,2014-07-09 22:46:12,09-07-2014 22:46:12,Saudável sobrevida latino-americana na Copa!
486637670118862848,2014-07-08 22:27:16,08-07-2014 22:27:16,@TheEconomist f
485489251338166272,2014-07-05 18:23:52,05-07-2014 18:23:52,"Sugestão para terça do meio pra frente: LGustavo, Fernandinho, Paulinho, Ramires ou William; Hulk, Fred. Bernard como arma p segundo tempo."
485179035463712768,2014-07-04 21:51:10,04-07-2014 21:51:10,"Substituição perigosa! Se houver prorrogacao, Henrique será a opcao de ataque?  Técnicos brasileiros substituem mal e tardiamente. Sempre!"
485176272541462529,2014-07-04 21:40:12,04-07-2014 21:40:12,"Por que não fazer mudancas, colocar jogadores com frescor em campo? Com tantos jogadores bons no banco!!!"
485174838819319808,2014-07-04 21:34:30,04-07-2014 21:34:30,"Alívio, finalmente!"
