id,datetime,created_at,text
625893834787061760,2015-07-28 05:01:33,28-07-2015 05:01:33,"Se o Executivo propõe uma determinada medida (um projeto) ao Parlamento e este a rejeita, significa que o governo ""perdeu a confiança"". Cai."
625892457251782656,2015-07-28 04:56:04,28-07-2015 04:56:04,"Resp política: significa que o Executivo tem que ter aprovação, o apoio específico do Legislativo para todas as as suas decisões políticas."
625891280195842050,2015-07-28 04:51:24,28-07-2015 04:51:24,"Fragilizada ou fraturada essa maioria, automaticamente o governo cai. O nome técnico desse mecanismo: ""responsabilidade política""."
625890596121616384,2015-07-28 04:48:41,28-07-2015 04:48:41,Parlamentarismo é um sistema em que a perenidade/estabilidade do governo depende do apoio e fidelidade de uma sólida maioria no Parlamento.
625889685894733824,2015-07-28 04:45:04,28-07-2015 04:45:04,Outro exemplo? Itália: do fim da segunda guerra mundial até os anos 90. A mesma brutal instabilidade política!!! Por que? Explico.
625889113527468032,2015-07-28 04:42:47,28-07-2015 04:42:47,"Exemplos? França, de 1871 a 1958: por força da ausência de maiorias estáveis no Parlamento, os governos eram derrubados a cada 6/7 meses."
625888304349769729,2015-07-28 04:39:34,28-07-2015 04:39:34,"Parlamentarismo: é um sistema que, se for mal desenhado, mal concebido, pode provocar enorme instabilidade política."
625887592224006145,2015-07-28 04:36:45,28-07-2015 04:36:45,"Sistema de governo parlamentarista é algo que não combina com nossa índole, nos é estranho. Seria um salto no escuro, uma aventura."
621107237424099328,2015-07-15 00:01:19,15-07-2015 00:01:19,"Não dá, né?"
621106422680580096,2015-07-14 23:58:05,14-07-2015 23:58:05,"Eis a resposta: Paulinho da Força, Rui Falcão, Roberto Freire, Siqueira, Lupi e outros do mesmo naipe. Vc quer isso?"
621104897895833600,2015-07-14 23:52:01,14-07-2015 23:52:01,Agora vem a pergunta crucial: vc sabe a quem caberiam as decisões políticas supremas  no Brasil se vivêssemos sob o regime parlamentarista?
621104110423703552,2015-07-14 23:48:54,14-07-2015 23:48:54,"Membros desse  Gabinete? Líderes e representantes de partidos que formam uma ""maioria"" no Parlamento. O governo ""sai"" dessa maioria."
621102872831369217,2015-07-14 23:43:59,14-07-2015 23:43:59,Parlamentarismo é um sistema de governo em que as decisões políticas supremas são tomadas por um colegiado chamado Gabinete.
621102352574119937,2015-07-14 23:41:55,14-07-2015 23:41:55,"Em breve darei explicações técnicas e práticas sobre parlamentarismo. Por enquanto, retenham o seguinte:"
621101949090447360,2015-07-14 23:40:18,14-07-2015 23:40:18,"De propósito, amigos, eu não falei em parlamentarismo. Esqueçam isso! Se vocês souberem como funciona, vão ficar horrorizados."
621100556300500992,2015-07-14 23:34:46,14-07-2015 23:34:46,"Lincoln, F.D. Roosevelt, Getúlio apesar do caráter não democrático do regime, Kennedy, Lula, Mitterrand (semipresidencialismo),  Clinton etc"
621099081084071936,2015-07-14 23:28:55,14-07-2015 23:28:55,O sistema presidencial de governo tem virtualidades que poucos homens de Estado são capazes de captar. Querem exemplos?
621097774730321920,2015-07-14 23:23:43,14-07-2015 23:23:43,"Passados somente oito meses, o que se vê: um final de presidência fulgurante, especialmente em matéria de política externa. Como?"
621096653366427648,2015-07-14 23:19:16,14-07-2015 23:19:16,Não foram poucos os que prognosticaram um fim melancólico para a presidência Barack Obama após as eleições de novembro de 2015. Huuum!!!
621006886960254976,2015-07-14 17:22:34,14-07-2015 17:22:34,"Extirparam da Grécia o que um país tem de mais sagrado: a sua soberania, a sua dignidade. Aguardem no que isso vai dar..."
621006055150120961,2015-07-14 17:19:15,14-07-2015 17:19:15,Grécia: os europeus sabem melhor que ninguém o que ocorre em seguida à imposição de condições humiliantes a uma determinada nação!
621004734611214336,2015-07-14 17:14:01,14-07-2015 17:14:01,"Grécia: A Europa não perde mesmo o seu velho ""vezo colonial""! Só que agora ""submete"" à sua bota um país da sua própria órbita."
621003553935638528,2015-07-14 17:09:19,14-07-2015 17:09:19,"Acordo UE/Grécia: ""Um Catálogo de Crueldades"", segundo a revista alemã ""Der Spiegel""."
617578702646460416,2015-07-05 06:20:11,05-07-2015 06:20:11,"Adorei tua resposta, Maju. Nem te conto o que se passou comigo nos 11 anos em que ocupei posição de alta responsabilidade e visibilidade..."
617577744604491776,2015-07-05 06:16:23,05-07-2015 06:16:23,"Pois é, Maju. Aqui é assim. O pior é que boa parte dessa gente ainda se acha relevante, tem veleidades de ser vista como pessoas civilizadas"
616448177563140096,2015-07-02 03:27:53,02-07-2015 03:27:53,"O texto acima citado é o artigo 60, parág 5 da Constituição brasileira. Tem tudo a ver com o que se passa neste momento na C. dos Deputados"
616446585636040704,2015-07-02 03:21:33,02-07-2015 03:21:33,Matéria constante de proposta de emenda rejeitada ou havida por prejudicada NÃO pode ser objeto de nova proposta na mesma sessão legislativa
616110817126293506,2015-07-01 05:07:20,01-07-2015 05:07:20,"Ah! esqueci de dizer: considero o Celso Amorim o nosso melhor chanceler em 100 anos, apesar da sofreguidão na criação de embaixadas"
616108646762741760,2015-07-01 04:58:42,01-07-2015 04:58:42,"Bem, parlamentarismo fica para outro momento! E, parodiando os nossos brilhantes e honrados diplomatas: good night! Kkk"
616108050726957056,2015-07-01 04:56:20,01-07-2015 04:56:20,p acalmar os diplomatas: sempre fui contra os privilégios nocivos de certas carreiras de prestígio do serviço público. São péssimos p o país
616105474337976324,2015-07-01 04:46:06,01-07-2015 04:46:06,"Dica à Presidente Dilma: reduza drasticamente o número de Embaixadas e designe os diplomatas ""sobejantes"" para outros setores."
616104082516873216,2015-07-01 04:40:34,01-07-2015 04:40:34,Diplomacia: Degaut expõe o que sempre achei: o crescimento expressivo do número de embaixadas foi feito em proveito dos diplomatas. Só
616102972179746816,2015-07-01 04:36:09,01-07-2015 04:36:09,3) o que fazem os membros do TCU quando inspecionam algumas de nossas embaixadas?
616102522697216000,2015-07-01 04:34:22,01-07-2015 04:34:22,2) a base legal em que o Itamaraty se funda para pagar salários nababescos de 25.000/30.000 dólares para alguns embaixadores no exterior
616101898681196544,2015-07-01 04:31:53,01-07-2015 04:31:53,Diplomacia: seria bem interessante que o prof Degaut abordasse: 1) o caráter suntuosíssimo de algumas das nossas embaixadas. Pode?
616099201143980033,2015-07-01 04:21:10,01-07-2015 04:21:10,Diplomacia: o artigo do Degaut traz dados irrespondíveis que seguramente a diplomacia brasileira nunca quis revelar. Há mais coisas.
616097419256832000,2015-07-01 04:14:05,01-07-2015 04:14:05,"Política externa: recomendo vivamente o artigo ""Diplomacia de resultados"", de Marcos Degaut, publicado na página 3 da Folha de 30/6"
616045701093568513,2015-07-01 00:48:35,01-07-2015 00:48:35,é provável que muitos dentre os que querem nos impor o parlamentarismo pouco saibam sobre esse sistema e como ele funciona na prática!
616043349875757056,2015-07-01 00:39:14,01-07-2015 00:39:14,"Por falar em ""maioria"" parlamentar, em breve esclarecerei outra enorme insensatez que essa turma quer nos impor: o parlamentarismo!"
616042614580715520,2015-07-01 00:36:19,01-07-2015 00:36:19,Maioridade penal: desconfiemos dos propósitos e da ideologia dessa maioria parlamentar que quer impor a sua agenda ao nosso país.
616041709668052993,2015-07-01 00:32:43,01-07-2015 00:32:43,"Ao visitar um centro de confinamento de menores de um estado do Nordeste, presenciei umas das mais chocantes cenas de horror da minha vida."
616039779789086720,2015-07-01 00:25:03,01-07-2015 00:25:03,Maioridade penal: a violência já é uma das marcas do Brasil. Estão adicionando um poderoso combustível a essa violência. Aguardem.
616038626078687232,2015-07-01 00:20:28,01-07-2015 00:20:28,"Maioridade penal: quem conhece as prisões brasileiras (e os estabelecimentos de ""ressocialização"" de menores) não apoia essa insensatez"
616037595479416833,2015-07-01 00:16:22,01-07-2015 00:16:22,"Maioridade penal: eu apoio integralmente a posição do governo federal, contrária à redução da maioridade penal. Estão brincando com fogo!"
615695515376861185,2015-06-30 01:37:04,30-06-2015 01:37:04,"esqueci de dizer: ""colaboração"" ou ""delação"" premiada é um instituto penal-processual previsto em lei no Brasil! Lei!!!"
615692661438185472,2015-06-30 01:25:44,30-06-2015 01:25:44,Reflitamos coletivamente: vocês estão vendo o estrago que a promiscuidade entre dinheiro de empresas e a política provoca nas instituições?
615691872414113792,2015-06-30 01:22:36,30-06-2015 01:22:36,Caberia à assessoria informar a Presidente que: atentar contra o bom funcionamento do Poder Judiciário é crime de responsabilidade!
615690191366397953,2015-06-30 01:15:55,30-06-2015 01:15:55,"Porém, a Constituição não autoriza o Presidente a ""investir políticamente"" contra as leis vigentes, minando-lhes as bases."
615688758084681730,2015-06-30 01:10:13,30-06-2015 01:10:13,nossa Constituição outorga ao presidente a prerrogativa de vetar um projeto ou de impugnar uma lei perante o STF por inconstitucionalidade.
615687135132262400,2015-06-30 01:03:46,30-06-2015 01:03:46,Zelar pelo respeito e cumprimento das leis do país: esta é uma das mais importantes missões constitucionais de um presidente da República!
615686492531335168,2015-06-30 01:01:13,30-06-2015 01:01:13,"Assessoria  da Presidente deveria ter lhe informado o significado da expressão ""law enforcement"": cumprimento e aplicação rigorosa das leis."
615685629918216192,2015-06-30 00:57:47,30-06-2015 00:57:47,Há algo profundamente errado na nossa vida pública. Primeiro: nunca vi um Chefe de Estado tão mal assessorado como a nossa atual Presidente.
603712649654833152,2015-05-28 00:01:26,28-05-2015 00:01:26,"Quebra-cabeça: a lei doméstica seria incontrastável em razão da ""soberania do Parlamento"", e fugiria ao controle jurisdicional da Corte!"
603711660302462978,2015-05-27 23:57:30,27-05-2015 23:57:30,"Foi com espanto que vi o governo conservador, recém-reeleito, afirmar que pretende aprovar uma lei doméstica de DH, que afastaria a CEDH."
603710786536603648,2015-05-27 23:54:02,27-05-2015 23:54:02,"Aí, sob Tony Blair, o país aderiu à  Convenção Européia de Direitos Humanos, e criou uma Corte Suprema para dar-lhe efetividade."
603701451626520576,2015-05-27 23:16:56,27-05-2015 23:16:56,"Direitos Humanos:vejam só!Há até bom pouco a Grã Bretanha não tinha uma ""carta"" de Direitos Humanos, um corpo de normas visível e vinculante"
603692964435591169,2015-05-27 22:43:13,27-05-2015 22:43:13,"3) é imprescindível que os juízes se mantenham, na medida do possível, a uma ""distância regulamentar"" dos políticos. É saudável."
603692362590777345,2015-05-27 22:40:49,27-05-2015 22:40:49,"2) é preferível que nenhum  juiz tenha expectativa de promoção, obtendo algum tipo de recompensa financeira para esse ""imobilismo"" funcional"
603689425739079682,2015-05-27 22:29:09,27-05-2015 22:29:09,1) juiz deve ter remuneração muito elevada para não ter preocupações de ordem material. É fator primordial de sua independência.
603686865405870080,2015-05-27 22:18:59,27-05-2015 22:18:59,"Justiça independente, eficiente e com ""braços de largo alcance"" depende de legislação ousada, mas alguns requisitos são necessários:"
603685880310734848,2015-05-27 22:15:04,27-05-2015 22:15:04,É o combate internacional à corrupção em marcha...
603678300460945408,2015-05-27 21:44:57,27-05-2015 21:44:57,Para os brasileiros fanáticos por futebol: resta ainda  algum  futuro para a FIFA e para a CBF como instituição de comando desse esporte?
603677267596808192,2015-05-27 21:40:51,27-05-2015 21:40:51,"FIFA: em abstrato alertei em palestras ultimamente para o risco, alcance e eficiência da Justiça dos EUA em matéria de combate à corrupção."
603326865038811136,2015-05-26 22:28:28,26-05-2015 22:28:28,Não seria mais enriquecedor se a ABL tambem tivesse em sua composição escritores estrangeiros que se expressam em nossa língua?
603325191213682688,2015-05-26 22:21:49,26-05-2015 22:21:49,"Laferrière ocupará na Academia francesa a cadeira que no passado pertenceu a Montesquieu e Alexandre Dumas, filho."
603324788094935042,2015-05-26 22:20:13,26-05-2015 22:20:13,No site da Academia (http://t.co/M8uM0LQKxw) pode-se ler uma curta mas elucidativa biografia  de Laferrière. Interessante.
603322175970488321,2015-05-26 22:09:50,26-05-2015 22:09:50,Dany Laferrière. Anotem o nome desse escritor haitiano-canadense. Ele será empossado na quinta 28 na Academia Francesa.
600890857034768384,2015-05-20 05:08:38,20-05-2015 05:08:38,"Nos 4 tweets de19/5, não me referi à PEC da Bengala, mas a um embrião de PEC que daria poder às 2 Câmaras para nomear ministros para o STF."
600789204323434497,2015-05-19 22:24:43,19-05-2015 22:24:43,"Não raro, quando têm a prerrogativa de indicar ou nomear,  os parlamentares escolhem ex-colegas, amigos, estafetas, lacaios. Queremos isso?"
600787710362710017,2015-05-19 22:18:46,19-05-2015 22:18:46,"Nomeação de juízes por parlamentares: se isso vier a acontecer, será um desastre para o Brasil. Por que?"
600786582153646080,2015-05-19 22:14:17,19-05-2015 22:14:17,"Não satisfeitos com o foro privilegiado, agora os parlamentares querem ter  a prerrogativa de ""nomear"" juízes para os tribunais!!!"
600782352193822720,2015-05-19 21:57:29,19-05-2015 21:57:29,"Alguém se lembra de quando eu disse numa entrevista: ""o foro privilegiado é a racionalização da impunidade""? Pois bem."
599462227268231168,2015-05-16 06:31:47,16-05-2015 06:31:47,"efeito deletério inicial da PEC: mesmo a emenda não lhes sendo aplicáveis, já há juízes que  obtiveram liminar para permanecerem nos cargos"
599459057880170496,2015-05-16 06:19:11,16-05-2015 06:19:11,"2) do outro lado, haverá hordas de juízes de pires na mão, próximos dos 70, ansiosos para ganhar 5 anos adicionais de serviço."
599457732731756545,2015-05-16 06:13:55,16-05-2015 06:13:55,Pensem na quantidade de parlamentares que respondem a inquéritos e processos perante o STF. Ganharam um boost!
599456649896665088,2015-05-16 06:09:37,16-05-2015 06:09:37,A re-sabatina suscitará: 1) chantagem sobre aqueles que desejarem continuar no cargo após os 70. Por que?
599452026880270336,2015-05-16 05:51:15,16-05-2015 05:51:15,"Mais: para um bom número de magistrados ávidos para continuar nos cargos até os 75, essa perda de independência se iniciará bem antes dos 70"
599451064291721216,2015-05-16 05:47:25,16-05-2015 05:47:25,PEC da Bengala: a re-sabatina enfraquece a independência do magistrado. Subjuga-o. Coloca-o de pires na mão diante dos senadores
599449019878866944,2015-05-16 05:39:18,16-05-2015 05:39:18,Obrigar um magistrado estável na função à humilhação de ter de se submeter a uma nova sabatina é miná-lo no que ele tem de mais precioso.
599447557975240704,2015-05-16 05:33:29,16-05-2015 05:33:29,"P Bengala: aparentemente, se quis impor uma nova sabatina aos ministros que, ao completarem 70 anos, queiram permanecer no cargo até 75."
599445319470972930,2015-05-16 05:24:35,16-05-2015 05:24:35,"PEC Bengala: se o STF não declarar a inconstitucionalidade parcial do seu art 2, o Judiciário terá sofrido o maior golpe em décadas. Explico"
599442466530578433,2015-05-16 05:13:15,16-05-2015 05:13:15,"PEC da Bengala: em país democrático, quanto menos se mexe em em certos pilares fundamentais do regime, melhor. A magistratura é um deles."
599436479476142080,2015-05-16 04:49:28,16-05-2015 04:49:28,"PEC da bengala: deixei passar um tempinho para emitir minha opinião sobre o que me parece ser o seu aspecto mais nocivo, perigoso."
591102473785446400,2015-04-23 04:53:06,23-04-2015 04:53:06,"Não, amigo. Há TV boa nos EUA, na Europa&amp;Alhures. Exemplos: PBS nos EUA; BBC na GB; France 2; ARTE, França-Alemanha; Die Erste na Alemanha."
591099573940178944,2015-04-23 04:41:35,23-04-2015 04:41:35,"TV Globo: merece aplausos a sua política de ""não descartar"" suas repórteres mais experientes à medida que elas avançam...em idade!"
591098463460417536,2015-04-23 04:37:10,23-04-2015 04:37:10,"Globo: fez pouco, mas já fez mais do que os seus concorrentes na ainda discreta porém consistente inclusão de negros no seu jornalismo."
591096974558023680,2015-04-23 04:31:15,23-04-2015 04:31:15,"Dono do sotaque e da imagem impactante q lhe era um complemento indissociável?Caetano Veloso e sua imensa cabeleira, a voz arrastada."
591095413848969216,2015-04-23 04:25:03,23-04-2015 04:25:03,"Globo: relato pessoal. Foi com absoluto espanto que, adolescente  e p 1a vez no Rio, eu vi&amp;ouvi&amp;me deliciei com o fantástico sotaque baiano"
591092714747273216,2015-04-23 04:14:19,23-04-2015 04:14:19,"A Globo aproximou milhões de brasileiros a outros brasileiros, via língua, cultura, sotaques jamais antes imaginados."
591090976824938496,2015-04-23 04:07:25,23-04-2015 04:07:25,Parabens à cinquentona TV Globo e aos profissionais que a construíram pedra-sobre-pedra!
590731057714110466,2015-04-22 04:17:14,22-04-2015 04:17:14,R$ 900 milhões p/ partidos políticos: procure saber em detalhes como essa montanha de dinheiro é gerida pelos caciques partidários.
590730279532290048,2015-04-22 04:14:08,22-04-2015 04:14:08,Escárnio: Congresso aprova verba de quase 900 milhões anuais para partidos políticos. Para que doações de empresas privadas?
587280577184825344,2015-04-12 15:46:15,12-04-2015 15:46:15,"Ministro Paulo Brossard, uma grande inspiração profissional. Externo meus votos de condolências à sua família."
586273789815758850,2015-04-09 21:05:38,09-04-2015 21:05:38,Vaccari: calar-se quando indagado sobre fatos que podem incriminá-lo é direito assegurado pela Constituição. Nem é preciso ordem judicial.
581610109517893632,2015-03-28 00:13:50,28-03-2015 00:13:50,"Boa escolha: Renato Janine Ribeiro, ministro da Educação. Oxalá alguém de igual calibre e estatura moral seja escolhido para o STF!"
580143467675824128,2015-03-23 23:05:55,23-03-2015 23:05:55,Patrimonialismo: somas  colossais de dinheiro público repassadas a artistas consagrados com base na Lei Rouanet. Ver Globo online sobre HSBC
580139433896361984,2015-03-23 22:49:54,23-03-2015 22:49:54,Permitir doação de empresa p campanhas eleitorais em país que tem o patrimonialismo no seu DNA só podia dar nisso: colossal corrupção!
578415489564741632,2015-03-19 04:39:33,19-03-2015 04:39:33,"RT @lugaabs: @joaquimboficial, lembra do seu diagnóstico preocupante a respeito do sistema prisional do RN? Ele está sendo refletido agora.…"
578409412026568704,2015-03-19 04:15:24,19-03-2015 04:15:24,"Dica de um ""livraço"" em 3 volumes: ""Getúlio"", de Lira Neto."
578221562060513280,2015-03-18 15:48:57,18-03-2015 15:48:57,"Maria Eugênia Deda, sabe que eu penso como vc sobre a foto? Vou providenciar a troca. Obrigado."
578219816663789568,2015-03-18 15:42:01,18-03-2015 15:42:01,Tenho agora um novo meio de contato: o website da minha empresa de palestras e cursos: http://t.co/RIsMeEBuPD
577239051490746370,2015-03-15 22:44:49,15-03-2015 22:44:49,"Num dia como o de hj, achei um erro botar ministros de Estado para falar. O momento era para a Chefe de Estado se dirigir à Nação. Ponto."
577237169623957504,2015-03-15 22:37:20,15-03-2015 22:37:20,Min Cardozo insiste num erro deliberado e frequente: o de insinuar que as iniciativas do MPF e da PF são impulsionadas pelo Governo.
577235882891153408,2015-03-15 22:32:13,15-03-2015 22:32:13,Corretíssimas as observações do min Rossetto sobre o erro daqueles que pedem o retorno dos militares. Seria um imenso retrocesso p o Brasil.
577228288520790016,2015-03-15 22:02:03,15-03-2015 22:02:03,"bastante apropriada até o momento a fala do Min da Justiça, especialmente o tema relativo ao fim do dinheiro de empresas nas campanhas"
575547506735587328,2015-03-11 06:43:13,11-03-2015 06:43:13,Partidos são meros instrumentos. Nossa nação não se construiu e tampouco se define à luz de momentâneos interesses partidários.
575546305776324608,2015-03-11 06:38:27,11-03-2015 06:38:27,Muitos vêem o que se passou ontem na CD sob ótica puramente partidária. É um tremendo erro. Por que?
575545487597633536,2015-03-11 06:35:12,11-03-2015 06:35:12,"Como milhões de brasileiros, vi a programação da TV Câmara ontem. Chocante."
575538997465858049,2015-03-11 06:09:24,11-03-2015 06:09:24,"Por que fiz esses 3 últimos posts sobre História? Porque no Brasil pouca gente pensa nas ""voltas"" e nas ""peças"" que a História dá e aplica."
575537306926510080,2015-03-11 06:02:41,11-03-2015 06:02:41,3) nem o mais radical bolchevique imaginaria lá pelos idos de 1914 que a 1a guerra mundial facilitaria a queda do regime czarista da Rússia
575536028997521409,2015-03-11 05:57:36,11-03-2015 05:57:36,"2) em 15/11/1889, nem mesmo o general Deodoro da Fonseca tinha em mente derrubar o regime imperial sob o qual o Brasil vivia. Aconteceu."
575534759629160448,2015-03-11 05:52:34,11-03-2015 05:52:34,1) quem diria em maio de 1789 que aquele convescote estranho  realizado em Versalhes iria desembocar na terrível revolucão francesa?
575532423489982464,2015-03-11 05:43:17,11-03-2015 05:43:17,"Vamos mudar de assunto? Que tal falarmos um pouco de História? Acho importante no momento atual. Farei 3 singelos posts, p reflexão."
575528061963206656,2015-03-11 05:25:57,11-03-2015 05:25:57,"Dica:  ""Selma"". Ótima obra cinematográfica. Forte. Mil vezes melhor do que o filme que ganhou o ""Oscar"" de melhor filme, ""Birdman""."
570834972145258496,2015-02-26 06:37:17,26-02-2015 06:37:17,@renattaamaral é: Joaquim Barbosa Gomes
570593455870754817,2015-02-25 14:37:35,25-02-2015 14:37:35,"Dica: Modesto Carvalhosa sobre a Lei Anticorrupção. Leiam em especial o tópico ""Corrupção Pública no Brasil"". Forte, sem meias-palavras."
568471596874260480,2015-02-19 18:06:05,19-02-2015 18:06:05,"Exemplo? No meio do julgamento da ap 470, o saudoso Marcio T Bastos pediu-me para ser recebido. Recebi-o, na presença do PGR."
568470828729417728,2015-02-19 18:03:01,19-02-2015 18:03:01,"No processo judicial nao devem existir encontros ""en catimini"", às escondidas, entre o juiz e uma das partes. Igualdade de armas é o lema."
568470320807596032,2015-02-19 18:01:00,19-02-2015 18:01:00,"Explico: o processo judicial cuida de interesses ferrenhamente  contrapostos. Tem de ser transparente, dar igualdade de chances às partes"
568469434236579841,2015-02-19 17:57:29,19-02-2015 17:57:29,"Eu recebia advogados? Sim, recebi-os às centenas! Mas informava a parte contrária, para que ela pudesse estar presente, se quisesse. P que?"
568468138716741632,2015-02-19 17:52:20,19-02-2015 17:52:20,"Noblat disse que eu queria aparecer! Qual a sua isenção, se eu o processei por racismo? Falta-lhe tbm isenção p outras razões."
568466937178669058,2015-02-19 17:47:34,19-02-2015 17:47:34,Desvirtuamento: passou-se a falar sem parar sobre direito de advogado ser recebido por autoridades; que eu nao recebia advogados!
568466286197534720,2015-02-19 17:44:58,19-02-2015 17:44:58,"S o q eu falei? S matéria jornalística em que se relatava uma tentativa de interferência da Política em assunto ""jurisdicionalizado"". Só."
568465025335222272,2015-02-19 17:39:58,19-02-2015 17:39:58,Incrível como torcem e retorcem o que eu digo! O objetivo é claro: desviar a atenção da essência daquilo que foi objeto do meu comentário.
567764940636057602,2015-02-17 19:18:05,17-02-2015 19:18:05,"Iniciei ciclo de palestras dedicadas ao mundo empresarial sobre aplicação e impacto da lei anticorrupção nas empresas, sobretudo as globais."
567682122019004416,2015-02-17 13:48:59,17-02-2015 13:48:59,"Às ""Plumes-à-gage"" furiosas com meus comentários: experimentem ser livres! Sei que isso seria extremamente penoso e ""custoso"" para vcs."
567681060847509504,2015-02-17 13:44:46,17-02-2015 13:44:46,"""Cidadão livre"": livre das amarras do cargo público. Cidadão na plenitude dos seus direitos, pronto p opinar sobre as questões da ""Pólis""."
567680454221127680,2015-02-17 13:42:21,17-02-2015 13:42:21,S/ as reações aos meus posts recentes sobre confusão entre Política e Justiça: meus críticos fingem não saber que hj sou um cidadão livre.
567520011699638273,2015-02-17 03:04:49,17-02-2015 03:04:49,Os que recorrem à política para resolver problemas na esfera judicial nao buscam a Justiça. Buscam corrompê-la. É tão simples assim.
567519496970452992,2015-02-17 03:02:46,17-02-2015 03:02:46,"Se vc é advogado num processo criminal e entende que a polícia cometeu excessos/deslizes, vc recorre ao juiz. Nunca a políticos!"
566839416602501120,2015-02-15 06:00:22,15-02-2015 06:00:22,RT @gnatalini: Zé Eduardo Cardoso. Não ouse atrapalhar a investigação da Lava Jato. Você é Ministro da Justiça do Brasil. Não pode proteger…
566727145461133313,2015-02-14 22:34:15,14-02-2015 22:34:15,"Ajuda à memória coletiva: pesquisem sobre 1 controvertida decisão do TCU de jun/jul 2012, pouco antes do início do julgamento da Ap 470."
566725443814821888,2015-02-14 22:27:29,14-02-2015 22:27:29,"Reflita: vc defende alguém num processo judicial. Ao invés de usar argumentos/métodos jurídicos perante o juiz,  vc vai recorrer à Política?"
566719304092381184,2015-02-14 22:03:05,14-02-2015 22:03:05,"Nós, brasileiros honestos, temos o direito e o dever de exigir que a Presidente Dilma demita imediatamente o Ministro da Justiça."
