id,datetime,created_at,text,file,twitter_handle,name
938416049837559809,2017-12-06 14:33:15,06-12-2017 14:33:15,"Atenção, o Emprega São Paulo está com 4.206 vagas abertas em SP. Uma boa oportunidade para tantos brasileiros que estão desempregados. Você que está procurando um emprego, cadastre-se: https://t.co/OFisYVQeBA. A geração de empregos é fundamental para o Brasil vencer a crise. https://t.co/xqRF0Z57zC",../data/bases-completas/geraldoalckmin.csv,geraldoalckmin,Geraldo Alckmin
938380836105342977,2017-12-06 12:13:20,06-12-2017 12:13:20,"Não nasci rico nem venho de família de políticos, construí minha carreira pública com muito trabalho e apoio da população. Foi com a confiança do povo que pude ser vereador, prefeito, deputado estadual, deputado federal e quatro vezes governador.
#PreparadoParaoBrasil https://t.co/PNRE3XShTc",../data/bases-completas/geraldoalckmin.csv,geraldoalckmin,Geraldo Alckmin
938150703159283712,2017-12-05 20:58:52,05-12-2017 20:58:52,"Entregamos hoje 240 apartamentos em Heliópolis. Ao todo, serão 1.200 unidades. Uma das beneficiadas foi a Dona Rosa, pessoa divertidíssima. O déficit habitacional é um problema muito sério no país e precisa ser combatido. Desde 2011, entregamos mais de 140 mil casas em SP. https://t.co/wwO3K899eM",../data/bases-completas/geraldoalckmin.csv,geraldoalckmin,Geraldo Alckmin
938113248464986113,2017-12-05 18:30:02,05-12-2017 18:30:02,"O Brasil já ficou na mão de pessoas sem experiência, e os brasileiros sentem na pele até hoje os resultados de medidas irresponsáveis: a maior crise da nossa história. Para qualquer grande função, é preciso preparo. #PreparadoParaoBrasil https://t.co/UDf3DwuirW",../data/bases-completas/geraldoalckmin.csv,geraldoalckmin,Geraldo Alckmin
938054814575022081,2017-12-05 14:37:50,05-12-2017 14:37:50,"Fiz uma reunião com investidores franceses que estão interessados em oportunidades de negócios no Estado de SP. Como sempre falo, não falta dinheiro no mundo: o que o Brasil precisa é de bons projetos para atrair investimentos, gerar empregos e crescer. #PreparadoParaoBrasil https://t.co/KKWWHMNnhx",../data/bases-completas/geraldoalckmin.csv,geraldoalckmin,Geraldo Alckmin
938015893694701570,2017-12-05 12:03:11,05-12-2017 12:03:11,"Tenho total confiança na capacidade do Brasil voltar a crescer. Temos uma grande oportunidade para criar projetos de infraestrutura para reduzir o Custo Brasil, atrair investimentos e gerar empregos. #PreparadoParaoBrasil https://t.co/bpwJQWnTo0",../data/bases-completas/geraldoalckmin.csv,geraldoalckmin,Geraldo Alckmin
937794111150714882,2017-12-04 21:21:54,04-12-2017 21:21:54,Temos que lutar pelos interesses do povo. As corporações tomaram conta da política. Temos que enfrentá-las para realizar as mudanças profundas das quais o país necessita. A política tem que mudar para o Brasil mudar. #PreparadoParaoBrasil https://t.co/rNrq0SayyV,../data/bases-completas/geraldoalckmin.csv,geraldoalckmin,Geraldo Alckmin
937750182699196417,2017-12-04 18:27:20,04-12-2017 18:27:20,"A estação Suzano, da CPTM, está passando por grandes obras. Investimento de R$ 14 milhões para melhorar as instalações. É esse o caminho para o Brasil: obras de infraestrutura e logística para gerar empregos, facilitar o transporte e reduzir gastos com o deslocamento. https://t.co/FWCaKLOlIx",../data/bases-completas/geraldoalckmin.csv,geraldoalckmin,Geraldo Alckmin
937716666657538048,2017-12-04 16:14:09,04-12-2017 16:14:09,"No Mariana Godoy Entrevista, reafirmei: não há lugar no Estado de São Paulo onde a polícia não entre. Isso não existe. Defendo uma mudança na política de segurança pública do Brasil. O governo federal tem que liderar o trabalho de combate ao crime. 
#PreparadoParaoBrasil https://t.co/xB5jddcPHh",../data/bases-completas/geraldoalckmin.csv,geraldoalckmin,Geraldo Alckmin
937495208157163521,2017-12-04 01:34:10,04-12-2017 01:34:10,Tive o apoio de ajudantes muito especiais para organizar meus jornais. Nada melhor do que curtir os netos. Família acima de tudo! Vídeo feito pela @lualckmin_ https://t.co/FlePfq5gNy,../data/bases-completas/geraldoalckmin.csv,geraldoalckmin,Geraldo Alckmin
937305926331138048,2017-12-03 13:02:01,03-12-2017 13:02:01,"Hoje é o Dia Internacional das Pessoas com Deficiência, uma data para refletirmos sobre os direitos desse importante segmento da sociedade. Temos que lutar por mais oportunidades, acessibilidade e respeito. O Brasil é ainda muito atrasado nessa área, e isso tem que mudar. https://t.co/mTt5WhTwHA",../data/bases-completas/geraldoalckmin.csv,geraldoalckmin,Geraldo Alckmin
937122340802125824,2017-12-03 00:52:31,03-12-2017 00:52:31,Boa noite a todos!,../data/bases-completas/geraldoalckmin.csv,geraldoalckmin,Geraldo Alckmin
937064358110253057,2017-12-02 21:02:07,02-12-2017 21:02:07,"Turismo é um dos pontos fortes do Estado de São Paulo. São mais de 30 reservas ecológicas e 70 estâncias turísticas. E, para facilitar a viagem, temos as 18 melhores estradas do país! https://t.co/5spLT2EDBA",../data/bases-completas/geraldoalckmin.csv,geraldoalckmin,Geraldo Alckmin
936944389498208261,2017-12-02 13:05:24,02-12-2017 13:05:24,"Boa dica para quem está em São Paulo. No parque do Trote, na zona norte da capital, ocorre o festival Revelando São Paulo. Com entrada gratuita hoje e amanhã, o evento tem música, dança, gastronomia, artesanato e outras atrações que valorizam a cultura tradicional paulista. https://t.co/7x0PZmcHyl",../data/bases-completas/geraldoalckmin.csv,geraldoalckmin,Geraldo Alckmin
936759915422642176,2017-12-02 00:52:22,02-12-2017 00:52:22,"É daqui a pouco! Às 23h, estarei ao vivo no programa Mariana Godoy Entrevista na RedeTV. Participem enviando perguntas pelo Twitter com a hashtag #MarianaGodoyEntrevista. Não percam! https://t.co/ZZfyNNjcjB",../data/bases-completas/geraldoalckmin.csv,geraldoalckmin,Geraldo Alckmin
936708253668519937,2017-12-01 21:27:05,01-12-2017 21:27:05,"Hoje, às 23h, estarei ao vivo no programa Mariana Godoy Entrevista na RedeTV. Falarei sobre a presidência do PSDB, o momento da política e a possibilidade de me candidatar à Presidência do Brasil. Participem enviando perguntas pelo Twitter com a hashtag #MarianaGodoyEntrevista. https://t.co/xw45ZSz84C",../data/bases-completas/geraldoalckmin.csv,geraldoalckmin,Geraldo Alckmin
936668445361491970,2017-12-01 18:48:54,01-12-2017 18:48:54,"@dudupezzete Duh, as marcas se referem aos dados da Secretaria de Segurança Pública. Os números são os melhores desde 2001, quando começou a série histórica. Veja dos dados completos aqui: https://t.co/vQdgoF7P2I. (Equipe Geraldo Alckmin)",../data/bases-completas/geraldoalckmin.csv,geraldoalckmin,Geraldo Alckmin
936664459938025477,2017-12-01 18:33:04,01-12-2017 18:33:04,"O trabalho das polícias está dando resultado em SP: tivemos em outubro recorde de prisões e a menor taxa de homicídios já registrada. Sei que o brasileiro se sente inseguro, por isso defendo que o governo federal lidere o combate à criminalidade. Juntos, podemos vencer o crime. https://t.co/he7vyN13qP",../data/bases-completas/geraldoalckmin.csv,geraldoalckmin,Geraldo Alckmin
936603850756296706,2017-12-01 14:32:13,01-12-2017 14:32:13,"Quando governos gastam mais do que podem, a população paga a conta. Responsabilidade fiscal não é apenas um termo bonito: é respeito aos brasileiros. #PreparadoParaoBrasil https://t.co/Nb4LOhpulY",../data/bases-completas/geraldoalckmin.csv,geraldoalckmin,Geraldo Alckmin
936566342643265536,2017-12-01 12:03:11,01-12-2017 12:03:11,"Hoje é o Dia Mundial de Combate à Aids, data para promover a conscientização, diminuir o preconceito e incentivar a realização de exames de detecção da doença, que ainda é um problema sério no Brasil. Temos em SP 3.952 locais que oferecem o teste gratuitamente. Faça o exame! https://t.co/DvsmSMVpEN",../data/bases-completas/geraldoalckmin.csv,geraldoalckmin,Geraldo Alckmin
936346865062371331,2017-11-30 21:31:03,30-11-2017 21:31:03,"Liberei R$ 66,7 milhões para incentivar o turismo no Estado. Com a verba, as prefeituras poderão fazer uma série de investimentos que vão beneficiar população local e visitantes. O turismo é uma importante atividade do Brasil, temos que aproveitar esse grande potencial econômico. https://t.co/nT4rycAkph",../data/bases-completas/geraldoalckmin.csv,geraldoalckmin,Geraldo Alckmin
936306702080729089,2017-11-30 18:51:28,30-11-2017 18:51:28,"Não acredito que o caminho para o Brasil esteja no discurso radical ou na repetição de fórmulas que nos colocaram na maior crise econômica de nossa história. Precisamos fazer diferente.
#PreparadoParaoBrasil https://t.co/Z6zyTyNRZZ",../data/bases-completas/geraldoalckmin.csv,geraldoalckmin,Geraldo Alckmin
936245529633349632,2017-11-30 14:48:23,30-11-2017 14:48:23,Faço questão de ressaltar o equilíbrio das contas públicas do Estado de São Paulo. A responsabilidade fiscal é o que nos permite pagar servidores em dia e agora antecipar a 2ª parcela do 13º salário. #PreparadoParaoBrasil https://t.co/k0CxiIdPdR,../data/bases-completas/geraldoalckmin.csv,geraldoalckmin,Geraldo Alckmin
936203011134820352,2017-11-30 11:59:26,30-11-2017 11:59:26,"Foto da minha formatura em Medicina. Ainda estudava quando assumi a Prefeitura de Pinda, em 1977. Fazia plantão à noite e aos finais de semana. Uma vez, durante um parto, uma paciente me reconheceu e me pediu uma obra em seu bairro. A vida pública tem dessas coisas. #tbt https://t.co/7ooiYiAzxv",../data/bases-completas/geraldoalckmin.csv,geraldoalckmin,Geraldo Alckmin
935976571013423105,2017-11-29 20:59:38,29-11-2017 20:59:38,"Entregamos 928 apartamentos em Rio Claro, no interior de São Paulo. Um grande momento para as famílias, que já vão passar o Natal na casa nova. O Brasil tem um grande problema habitacional, mas dá pra resolver. Em São Paulo, foram mais de 135 mil casas entregues desde 2011. https://t.co/O6QZe3DTH6",../data/bases-completas/geraldoalckmin.csv,geraldoalckmin,Geraldo Alckmin
935939576039743488,2017-11-29 18:32:38,29-11-2017 18:32:38,"O HC da Unicamp, em Campinas, ganhou um angiógrafo digital biplano, o primeiro em um hospital público na América Latina. O equipamento permite diagnóstico de problemas no sistema vascular, como aneurismas. Grande conquista para a Saúde. #PreparadoParaoBrasil https://t.co/FLVi8095rJ",../data/bases-completas/geraldoalckmin.csv,geraldoalckmin,Geraldo Alckmin
935891662706003969,2017-11-29 15:22:15,29-11-2017 15:22:15,"A terceira é em Rio Claro. Entrega de 928 apartamentos do programa Casa Paulista. No sábado, serão mais 896 apartamentos em Americana e 900 em Limeira. Quase 3 mil novas unidades.",../data/bases-completas/geraldoalckmin.csv,geraldoalckmin,Geraldo Alckmin
935891363715059718,2017-11-29 15:21:03,29-11-2017 15:21:03,"Outra boa notícia é a nova etapa do anel viário Magalhães Teixeira. Tínhamos entregue Dom Pedro - Anhanguera, inauguramos há dois anos Anhanguera - Bandeirantes, agora faremos Bandeirantes - Miguel Melhado e futuramente Santos Dumont e aeroporto de Viracopos.",../data/bases-completas/geraldoalckmin.csv,geraldoalckmin,Geraldo Alckmin
935891257934667776,2017-11-29 15:20:38,29-11-2017 15:20:38,"Estive em Campinas e pude dar três boas notícias para a região. No Hospital das Clínicas da Unicamp, inauguramos o angiógrafo digital biplano, o primeiro em hospital público em toda a América Latina. O aparelho permite diagnósticos e tratamento de patologias no sistema vascular.",../data/bases-completas/geraldoalckmin.csv,geraldoalckmin,Geraldo Alckmin
935879236790910981,2017-11-29 14:32:52,29-11-2017 14:32:52,"As universidades de SP foram destaque no QS Brics 2017/2018, que avalia instituições de Brasil, Rússia, Índia, China e África do Sul. A Unicamp teve a melhor nota entre as universidades brasileiras, e a USP ficou na segunda posição. Já a Unesp ficou em 4º lugar. Parabéns a todos! https://t.co/BsrQk2G1kd",../data/bases-completas/geraldoalckmin.csv,geraldoalckmin,Geraldo Alckmin
935847231130873856,2017-11-29 12:25:41,29-11-2017 12:25:41,"Com muita satisfação sancionei a lei que declara de utilidade pública a Associação Bauruense de Desportes Aquáticos, que atende mais de 4 mil crianças, promovendo a inclusão social por meio do esporte. A entidade terá isenções fiscais e mais facilidade para obter recursos. https://t.co/O85ewbWRIb",../data/bases-completas/geraldoalckmin.csv,geraldoalckmin,Geraldo Alckmin
935617247443341312,2017-11-28 21:11:49,28-11-2017 21:11:49,"Fiquei muito feliz de inaugurar hoje o Hospital da Criança em Ribeirão Preto. Um grande ganho para toda a região. De quebra, ainda tive a honra de ser entrevistado por esse jovem talento do jornalismo, Esther Castilho.
#PreparadoParaoBrasil https://t.co/PRB5siKTF3",../data/bases-completas/geraldoalckmin.csv,geraldoalckmin,Geraldo Alckmin
935576665614364672,2017-11-28 18:30:33,28-11-2017 18:30:33,"O #DiadeDoar é uma iniciativa muito bacana. A data ocorre na terça-feira seguinte ao Dia de Ação de Graças e tem como objetivo incentivar a solidariedade, um valor muito importante na minha família, especialmente para minha esposa, @lualckmin_. Veja ações: https://t.co/P2FrmfVRMv https://t.co/DnHLvzBqD0",../data/bases-completas/geraldoalckmin.csv,geraldoalckmin,Geraldo Alckmin
935510072213540870,2017-11-28 14:05:56,28-11-2017 14:05:56,Temos que modernizar o país para que o governo ajude ao invés de atrapalhar. O Brasil precisa criar empregos. #PreparadoParaoBrasil https://t.co/KEp9dxGCEk,../data/bases-completas/geraldoalckmin.csv,geraldoalckmin,Geraldo Alckmin
935483990965878784,2017-11-28 12:22:18,28-11-2017 12:22:18,"De acordo com a CNT, SP tem as 18 melhores estradas do país. Isso não acontece por acaso, fazemos um trabalho constante de manutenção e melhorias em nossas rodovias. Essas obras reduzem acidentes, geram empregos e incentivam o desenvolvimento.
#PreparadoParaoBrasil https://t.co/Pn766rsQus",../data/bases-completas/geraldoalckmin.csv,geraldoalckmin,Geraldo Alckmin
935313046200881152,2017-11-28 01:03:02,28-11-2017 01:03:02,Boa noite a todos!,../data/bases-completas/geraldoalckmin.csv,geraldoalckmin,Geraldo Alckmin
935252981855019008,2017-11-27 21:04:21,27-11-2017 21:04:21,"Passamos pela pior crise da nossa história, e o povo não vai esquecer disso. É fácil desarrumar a casa. Para arrumar, exige perseverança, trabalho, sacrifício. Acredito que o Brasil tenha todas as condições para gerar empregos e voltar a crescer.
#PreparadoParaoBrasil https://t.co/SpIjhp7kVS",../data/bases-completas/geraldoalckmin.csv,geraldoalckmin,Geraldo Alckmin
935214214855254017,2017-11-27 18:30:18,27-11-2017 18:30:18,Mais segurança! Assinei um decreto que regulamenta convênios entre Estado e prefeituras para fortalecer as Guardas Municipais. Todos unidos contra a criminalidade. #PreparadoParaoBrasil https://t.co/IR2glGzQpO,../data/bases-completas/geraldoalckmin.csv,geraldoalckmin,Geraldo Alckmin
935211745001529345,2017-11-27 18:20:30,27-11-2017 18:20:30,"Hoje no evento Amarelas Ao Vivo, da revista Veja, fui perguntado sobre as pesquisas. Respondi que pesquisa feita um ano antes da eleição mostra o passado. Os argumentos de cada candidato começam a aparecer na eleição. Essa campanha vai ser a da verdade.",../data/bases-completas/geraldoalckmin.csv,geraldoalckmin,Geraldo Alckmin
935153890630266881,2017-11-27 14:30:36,27-11-2017 14:30:36,"Assinei a liberação de R$47 milhões para 11 municípios realizarem obras de infraestrutura e firmei acordo para que a Unicamp faça a gestão do novo Hospital Regional de Piracicaba. Investindo forte em obras e em Saúde, gerando empregos e melhorando a vida da população. https://t.co/ra5jQi3Mfo",../data/bases-completas/geraldoalckmin.csv,geraldoalckmin,Geraldo Alckmin
935117404132212736,2017-11-27 12:05:37,27-11-2017 12:05:37,"Demos início à construção de uma nova ponte sobre o Rio Tietê na SP-147, em Anhembi. Mais uma grande obra do Estado de São Paulo. https://t.co/khCoF2RRFj",../data/bases-completas/geraldoalckmin.csv,geraldoalckmin,Geraldo Alckmin
934889790461349889,2017-11-26 21:01:10,26-11-2017 21:01:10,"Com apoio da Fapesp, uma empresa-filha da Unicamp desenvolveu o Crowdpet: um app que usa visão computacional para identificar animais. https://t.co/Z2kuU4oX8V",../data/bases-completas/geraldoalckmin.csv,geraldoalckmin,Geraldo Alckmin
934753712601526274,2017-11-26 12:00:26,26-11-2017 12:00:26,"Vou à missa todos os domingos. Na semana passada, foi especial, porque tive a oportunidade de acompanhar a missa do Frei Rinaldo na Igreja Madre de Deus, no Recife. https://t.co/sg2MEF7hFB",../data/bases-completas/geraldoalckmin.csv,geraldoalckmin,Geraldo Alckmin
934527315907940352,2017-11-25 21:00:49,25-11-2017 21:00:49,Deixo aqui minha homenagem aos que doam sangue e um incentivo para que outros comecem a doar. Doar sangue é um ato de amor ao próximo. https://t.co/OWjFfcgMji,../data/bases-completas/geraldoalckmin.csv,geraldoalckmin,Geraldo Alckmin
934406680967860224,2017-11-25 13:01:27,25-11-2017 13:01:27,Tempo ruim? Ficou tarde? Deu preguiça? Sem problemas. Veja lista de museus paulistas que oferecem tour virtual. https://t.co/awynqcHbCz https://t.co/KIviH0g5YV,../data/bases-completas/geraldoalckmin.csv,geraldoalckmin,Geraldo Alckmin
934165383145279489,2017-11-24 21:02:37,24-11-2017 21:02:37,Participei do Congresso Nacional de Hospitais Particulares. São organizações que geram empregos e são muito importantes para a saúde. https://t.co/HD4JuAWAMl,../data/bases-completas/geraldoalckmin.csv,geraldoalckmin,Geraldo Alckmin
934130688152031233,2017-11-24 18:44:46,24-11-2017 18:44:46,"Há muitas mentiras nas redes sociais. Sem verificar a veracidade das informações, pessoas divulgam notícias falsas na rede. Antes de compartilhar uma acusação contra Geraldo Alckmin, visite nossa seção Anti Fake News e tire suas dúvidas. https://t.co/gYbd5u4TEW https://t.co/EmByAAdY30",../data/bases-completas/geraldoalckmin.csv,geraldoalckmin,Geraldo Alckmin
934066825775771650,2017-11-24 14:31:00,24-11-2017 14:31:00,"Costumo dizer: sobra dinheiro no mundo. O que nós precisamos fazer é propor bons projetos, para atrair investimentos e gerar empregos. Fomos premiados no PPP Awards &amp; Conference 2017 por nossas ações em parceria com a iniciativa privada. #PreparadoParaoBrasil https://t.co/KP9elyCv2T",../data/bases-completas/geraldoalckmin.csv,geraldoalckmin,Geraldo Alckmin
934029741165858816,2017-11-24 12:03:38,24-11-2017 12:03:38,O Memorial da América Latina recebe amanhã o  Encontro Paulista de Hip Hop. Vale a pena conferir! https://t.co/3tDquNbuCg https://t.co/iIdC70qpHI,../data/bases-completas/geraldoalckmin.csv,geraldoalckmin,Geraldo Alckmin
933802478772072450,2017-11-23 21:00:34,23-11-2017 21:00:34,A Sabesp alcançou grau máximo no Prêmio Nacional de Qualidade em Saneamento. Parabéns a todos os envolvidos! Acredito que a experiência na gestão hídrica do Estado de SP pode ser muito importante para outras regiões do Brasil. #PreparadoParaoBrasil https://t.co/8iMrlsQg3X,../data/bases-completas/geraldoalckmin.csv,geraldoalckmin,Geraldo Alckmin
933774392160608256,2017-11-23 19:08:58,23-11-2017 19:08:58,"Já o prêmio de Ideia mais inovadora do Ano ficou com a Artesp pelo aprimoramento dos novos editais do Programa de Concessões Rodoviárias paulistas, feito em parceria com o IFC. Quero desejar parabéns a todos os envolvidos. Trabalho sério dá resultado!",../data/bases-completas/geraldoalckmin.csv,geraldoalckmin,Geraldo Alckmin
933774349739483137,2017-11-23 19:08:48,23-11-2017 19:08:48,"A Unidade de Parcerias Público-Privadas, da Secretaria de Governo, ficou em primeiro lugar em duas categorias do PPP Awards &amp; Conference 2017. Nossa PPP de habitação, a primeira do país, conquistou o prêmio de melhor projeto Estadual.",../data/bases-completas/geraldoalckmin.csv,geraldoalckmin,Geraldo Alckmin
933774293074432000,2017-11-23 19:08:34,23-11-2017 19:08:34,A Sabesp também teve motivos para comemorar: atingiu grau máximo na premiação da Associação Brasileira de Engenharia Sanitária e Ambiental. Recebeu anteontem 5 troféus.,../data/bases-completas/geraldoalckmin.csv,geraldoalckmin,Geraldo Alckmin
933774246760865792,2017-11-23 19:08:23,23-11-2017 19:08:23,O Estado de São Paulo teve uma semana extremamente vencedora. A divulgação do Caged trouxe dados animadores: criamos 124 mil empregos de janeiro a outubro. Mais de 40% das vagas criadas em todo o país.,../data/bases-completas/geraldoalckmin.csv,geraldoalckmin,Geraldo Alckmin
933767336439484417,2017-11-23 18:40:56,23-11-2017 18:40:56,"Ontem, tive o prazer de participar do Congresso da Federação das Associações Comerciais de SP. Falei sobre um projeto de lei que reduz o custo e a burocracia do crédito. Assim que os governos têm que agir: facilitando a vida das pessoas, e não o contrário, como costumamos ver. https://t.co/ZS9xbsSZXZ",../data/bases-completas/geraldoalckmin.csv,geraldoalckmin,Geraldo Alckmin
933753632817864709,2017-11-23 17:46:29,23-11-2017 17:46:29,"Nos próximos 10 anos, serão R$ 3,3 bilhões de investimentos, mais de 2 mil empregos e 275 quilômetros de duplicação. A boa estrutura vai atrair empresas, gerar empregos e beneficiar também o agronegócio. Além disso, teremos redução de acidentes com mais segurança na via.",../data/bases-completas/geraldoalckmin.csv,geraldoalckmin,Geraldo Alckmin
933753598525222918,2017-11-23 17:46:20,23-11-2017 17:46:20,"Estive também em Barra Bonita, uma cidade maravilhosa, estância turística do Estado de São Paulo. Fui acompanhar o início da concessão da malha Rodovias dos Calçados. As obras já começaram, com 250 pessoas trabalhando. A estrada será totalmente recuperada.",../data/bases-completas/geraldoalckmin.csv,geraldoalckmin,Geraldo Alckmin
933704867155243008,2017-11-23 14:32:42,23-11-2017 14:32:42,"Falei aos jornalistas do jornal O Globo: ""não devemos subestimar o povo. Acredito que essa será a eleição da verdade."" https://t.co/QENHPvYIg5",../data/bases-completas/geraldoalckmin.csv,geraldoalckmin,Geraldo Alckmin
933703758269251584,2017-11-23 14:28:18,23-11-2017 14:28:18,"Estive em Anhembi para dar início à construção de uma nova ponte na SP-147 sobre o Rio Tietê. A construção terá 172 metros de comprimento e 30 metros de altura, com um importante detalhe: sem pilares dentro da água, permitindo a passagem de embarcações na Hidrovia Paraná-Tietê.",../data/bases-completas/geraldoalckmin.csv,geraldoalckmin,Geraldo Alckmin
933667577385181184,2017-11-23 12:04:31,23-11-2017 12:04:31,"Mais uma foto do meu casamento com a Lu, em março de 1979. A noiva mais linda que já vi. #TBT https://t.co/z1v1zEE6Tp",../data/bases-completas/geraldoalckmin.csv,geraldoalckmin,Geraldo Alckmin
933445575093219329,2017-11-22 21:22:22,22-11-2017 21:22:22,Fui perguntando por jornalistas do jornal O Globo ontem sobre divisões políticas. Respondi com tranquilidade: a divergência faz parte da democracia. #PreparadoParaoBrasil https://t.co/XruvjwH8P1,../data/bases-completas/geraldoalckmin.csv,geraldoalckmin,Geraldo Alckmin
933342235608858624,2017-11-22 14:31:44,22-11-2017 14:31:44,"Boa notícia! Nomeei 1989 novos soldados para a Polícia Militar. Eles vão reforçar o efetivo da PM no combate à criminalidade, para dar mais segurança à população. #PreparadoParaoBrasil https://t.co/gDxZSkfgh9",../data/bases-completas/geraldoalckmin.csv,geraldoalckmin,Geraldo Alckmin
933305079670681600,2017-11-22 12:04:05,22-11-2017 12:04:05,Falei ontem em evento promovido pelo jornal O Globo: o Brasil tem todas as condições para voltar a crescer. #PreparadoParaoBrasil https://t.co/46VE288Jof,../data/bases-completas/geraldoalckmin.csv,geraldoalckmin,Geraldo Alckmin
933109342588555264,2017-11-21 23:06:18,21-11-2017 23:06:18,"Tomaram posse hoje 1.240 policiais civis, que farão a Academia de Polícia Civil e em seguida vão reforçar a segurança do Estado. Desde 2011, contratamos mais de 4.800 novos profissionais para a Polícia Civil. É investimento constante para melhorar a segurança dos cidadãos. https://t.co/1MUtCJNHVw",../data/bases-completas/geraldoalckmin.csv,geraldoalckmin,Geraldo Alckmin
933077748108718080,2017-11-21 21:00:45,21-11-2017 21:00:45,"Mais um trecho da minha palestra no encontro Gestão Pública e Desafios do Brasil Contemporâneo, em Recife. Proponho uma união para que criemos um grande projeto para Pernambuco e para o Nordeste. #PreparadoParaoBrasil https://t.co/pc9WBjfT6w",../data/bases-completas/geraldoalckmin.csv,geraldoalckmin,Geraldo Alckmin
933059777269260288,2017-11-21 19:49:20,21-11-2017 19:49:20,"Dia muito importante. De manhã, estive no RJ, em um evento promovido pelo jornal O Globo. Ótima conversa. Abordamos diversos assuntos relevantes para o Brasil. Agora no fim de tarde, tivemos a posse de 1.240 policiais civis. Ótimo reforço para a segurança em São Paulo.",../data/bases-completas/geraldoalckmin.csv,geraldoalckmin,Geraldo Alckmin
933039967990894592,2017-11-21 18:30:38,21-11-2017 18:30:38,"Estive nos testes do Complexo São Lourenço, da Sabesp, que vai atender 2 milhões de pessoas. São 83 km de adutora, de Ibiúna a Carapicuíba, com mais de 4.500 empregos gerados. É esse o caminho: investimento público que melhora a infraestrutura e cria oportunidades de trabalho. https://t.co/2nm1rFQFGy",../data/bases-completas/geraldoalckmin.csv,geraldoalckmin,Geraldo Alckmin
932994443065602049,2017-11-21 15:29:44,21-11-2017 15:29:44,@arnaudmattoso @Zaga_Silos @joseserra_ Muito obrigado pela confiança. (Equipe Geraldo Alckmin),../data/bases-completas/geraldoalckmin.csv,geraldoalckmin,Geraldo Alckmin
