id,datetime,created_at,text,file,twitter_handle,name
976873759377383425,2018-03-22 17:30:28,22-03-2018 17:30:28,"Em São Paulo, investimos fortemente na ampliação da capacidade de reservação, interligando sistemas e bacias hidrográficas diferentes #DiaMundialDaÁgua",../data/bases-completas/geraldoalckmin.csv,geraldoalckmin,Geraldo Alckmin
976851096009404416,2018-03-22 16:00:24,22-03-2018 16:00:24,"Uma das conquistas que tivemos em relação à água foi a obra da Sabesp que une as bacias do Rio Paraíba do Sul e do sistema Cantareira. Investimento pesado para garantir a segurança hídrica das regiões metropolitanas de São Paulo, Campinas e até do Rio de Janeiro.#DiaMundialdaÁgua https://t.co/FoPXBO7tWk",../data/bases-completas/geraldoalckmin.csv,geraldoalckmin,Geraldo Alckmin
976828435237568513,2018-03-22 14:30:22,22-03-2018 14:30:22,Defendo que não haja tributação sobre saneamento básico. Isso ajudaria nos investimentos para garantir a segurança hídrica. #DiaMundialDaÁgua,../data/bases-completas/geraldoalckmin.csv,geraldoalckmin,Geraldo Alckmin
976805917109911553,2018-03-22 13:00:53,22-03-2018 13:00:53,"Hoje é o Dia Mundial da Água, data importante para discutirmos políticas de saneamento e preservação. Em SP, vencemos a maior seca dos últimos 100 anos e não paramos de trabalhar. Plantamos mais de 12,7 milhões de mudas na recuperação de mata ciliar, preservando nossas nascentes. https://t.co/lRdEE0BcF8",../data/bases-completas/geraldoalckmin.csv,geraldoalckmin,Geraldo Alckmin
976775650743934976,2018-03-22 11:00:37,22-03-2018 11:00:37,"As transposições são importantes. Nós já ajudamos, através das bombas da Sabesp, a chegar água mais rápido em Pernambuco, Paraíba e também no eixo leste. #DiaMundialDaÁgua",../data/bases-completas/geraldoalckmin.csv,geraldoalckmin,Geraldo Alckmin
976615523281711105,2018-03-22 00:24:20,22-03-2018 00:24:20,"Reforço na saúde! Autorizamos a contratação de 210 enfermeiros e técnicos de enfermagem para o Hospital do Servidor Público de São Paulo, um ótimo equipamento de saúde pública que fica agora ainda melhor. Saúde é prioridade, é direito do cidadão! #PreparadoParaoBrasil https://t.co/hEabYxJDA7",../data/bases-completas/geraldoalckmin.csv,geraldoalckmin,Geraldo Alckmin
976579201955434497,2018-03-21 22:00:00,21-03-2018 22:00:00,"Criamos o sistema de coleta e identificação biométrica eletrônica em SP. Assim, vamos estender o uso da tecnologia a outros serviços públicos além de emissão de documentos e ainda possibilitar a verificação de identidade em compras no comércio, prevenindo fraudes e prejuízos. https://t.co/4hYCzrYxpb",../data/bases-completas/geraldoalckmin.csv,geraldoalckmin,Geraldo Alckmin
976566869086916613,2018-03-21 21:10:59,21-03-2018 21:10:59,"""Tolerância zero com a corrupção. Quem enriquece na política é ladrão. Acredito que vamos ter um Brasil melhor depois de todo esse sofrimento que passamos"", ao vivo na RCC FM. Programa acaba de terminar.",../data/bases-completas/geraldoalckmin.csv,geraldoalckmin,Geraldo Alckmin
976565665934073857,2018-03-21 21:06:13,21-03-2018 21:06:13,"""Temos que saber jogar o jogo do século XXI: inserção internacional. Por que o agronegócio vai bem? Porque é competitivo e exporta para o mundo inteiro"". Ao vivo agora, siga: https://t.co/Zf3n0kWDp9",../data/bases-completas/geraldoalckmin.csv,geraldoalckmin,Geraldo Alckmin
976562587767902209,2018-03-21 20:53:59,21-03-2018 20:53:59,"""De um lado, temos que equipar a saúde para ajudar o jovem a sair da dependência química. Do outro, temos que combater o tráfico de drogas, o narcotraficante, o tráfico de armas. Vamos priorizar a questão da segurança pública"". Ao vivo agora, siga: https://t.co/Zf3n0kWDp9",../data/bases-completas/geraldoalckmin.csv,geraldoalckmin,Geraldo Alckmin
976559826862997505,2018-03-21 20:43:00,21-03-2018 20:43:00,"""Ninguém está acima da lei. Não é por que é petista ou de qualquer partido que vai estar acima da lei. O Brasil tinha impunidade para o crime do colarinho do branco. Estamos vivendo um outro momento na história da política brasileira"". Ao vivo agora, siga: https://t.co/Zf3n0kWDp9",../data/bases-completas/geraldoalckmin.csv,geraldoalckmin,Geraldo Alckmin
976557943280881664,2018-03-21 20:35:31,21-03-2018 20:35:31,"Agora ao vivo no programa Conversa de Fim de Tarde da rádio RCC FM, de Sant'Ana do Livramento-RS. Acompanhem! https://t.co/Zf3n0kWDp9 https://t.co/HCuNyADZEI",../data/bases-completas/geraldoalckmin.csv,geraldoalckmin,Geraldo Alckmin
976550211542757378,2018-03-21 20:04:48,21-03-2018 20:04:48,"Estarei ao vivo às 17h30 no programa Conversa de Fim de Tarde da rádio RCC FM, de Sant'Ana do Livramento-RS. Acompanhem! https://t.co/Zf3n0kWDp9 https://t.co/vf2E5gHq0x",../data/bases-completas/geraldoalckmin.csv,geraldoalckmin,Geraldo Alckmin
976534129939566592,2018-03-21 19:00:54,21-03-2018 19:00:54,"Inauguramos hoje as novas instalações do Bloco III do Incor, com uma bela apresentação preparada pelo Dr. Roberto Kalil Filho e sua equipe. Fizemos um investimento de R$ 58 milhões no prédio. É o melhor serviço de cardiologia e pneumologia da América Latina. #PreparadoParaoBrasil https://t.co/PEvtE3wgbq",../data/bases-completas/geraldoalckmin.csv,geraldoalckmin,Geraldo Alckmin
976519122224807937,2018-03-21 18:01:16,21-03-2018 18:01:16,"Na última eleição, 20 milhões de eleitores não votaram, mesmo o voto sendo obrigatório. Há realmente uma crise na política. Precisamos dar esperança à população, para que as pessoas acreditem no poder do voto.",../data/bases-completas/geraldoalckmin.csv,geraldoalckmin,Geraldo Alckmin
976488944341745664,2018-03-21 16:01:21,21-03-2018 16:01:21,Boa notícia para educação. Vamos abrir concurso público para seleção de supervisores de ensino para a rede pública do Estado. São 372 vagas! Investimento forte para melhorar a educação. #PreparadoParaoBrasil https://t.co/wvlsYXwrHO,../data/bases-completas/geraldoalckmin.csv,geraldoalckmin,Geraldo Alckmin
976443431705894917,2018-03-21 13:00:30,21-03-2018 13:00:30,"Lançamos uma série de medidas para fortalecer a agricultura, tanto para grandes produtores quanto para a agricultura familiar. São 15 ações que vão beneficiar o setor e, consequentemente, a economia brasileira. #PreparadoParaoBrasil https://t.co/saRRX5qG0c",../data/bases-completas/geraldoalckmin.csv,geraldoalckmin,Geraldo Alckmin
976232018039230465,2018-03-20 23:00:25,20-03-2018 23:00:25,"Hoje, em Brasília, aceitei um convite de um grupo teatral para dançar e fui flagrado pelo Poder360. Divertidíssimo! https://t.co/60CmyjS1Px",../data/bases-completas/geraldoalckmin.csv,geraldoalckmin,Geraldo Alckmin
976201949388427264,2018-03-20 21:00:56,20-03-2018 21:00:56,"Sou oficialmente pré-candidato à presidência do país. Temos muitos desafios pela frente, mas sou muito otimista em relação ao futuro do Brasil. Com muito trabalho, vamos colocar o país no caminho do crescimento, da inclusão e da geração de empregos. #PreparadoParaoBrasil https://t.co/5PqHM2qCQL",../data/bases-completas/geraldoalckmin.csv,geraldoalckmin,Geraldo Alckmin
976189560702099457,2018-03-20 20:11:42,20-03-2018 20:11:42,"Não somos candidatos para competir contra PT ou Lula, mas para ser instrumento de mudança do povo brasileiro.",../data/bases-completas/geraldoalckmin.csv,geraldoalckmin,Geraldo Alckmin
976186066385473550,2018-03-20 19:57:49,20-03-2018 19:57:49,Estamos ao vivo agora no Facebook falando sobre minha pré-candidatura à Presidência! https://t.co/3mgPBaPWFq,../data/bases-completas/geraldoalckmin.csv,geraldoalckmin,Geraldo Alckmin
976148979577704448,2018-03-20 17:30:27,20-03-2018 17:30:27,"A reforma política é essencial. Com ela, a gente não age apenas nos efeitos, mas nas causas e isso melhora o funcionamento do governo. Com o governo mais eficiente, as coisas chegam mais rápido até a população.",../data/bases-completas/geraldoalckmin.csv,geraldoalckmin,Geraldo Alckmin
976126322849320961,2018-03-20 16:00:25,20-03-2018 16:00:25,"Registramos em fevereiro o menor número de mortes no trânsito desde o início do Infosiga SP, em 2015. O total de vítimas (347) representou uma redução de 10% em relação ao mesmo período em 2017. Seguimos trabalhando firme para diminuir ainda mais esses números e poupar vidas! https://t.co/CzfBbcRhoA",../data/bases-completas/geraldoalckmin.csv,geraldoalckmin,Geraldo Alckmin
976104861271019520,2018-03-20 14:35:08,20-03-2018 14:35:08,Acabo de chegar ao Fórum Mundial da Água! Boa oportunidade para debatermos nossa experiência vencedora enfrentando e superando a crise hídrica no Estado de São Paulo. https://t.co/65AzoociO4,../data/bases-completas/geraldoalckmin.csv,geraldoalckmin,Geraldo Alckmin
976083811741196288,2018-03-20 13:11:30,20-03-2018 13:11:30,"Assinamos ontem uma série de convênios para beneficiar os municípios paulistas, incluindo parceria para o desenvolvimento de 139 Escolas de Moda do Fundo Social de Solidariedade em 112 cidades. Uma grande medida para dar mais oportunidades para as pessoas. #PreparadoParaoBrasil https://t.co/PeXKS4Pmra",../data/bases-completas/geraldoalckmin.csv,geraldoalckmin,Geraldo Alckmin
975883759043084289,2018-03-19 23:56:33,19-03-2018 23:56:33,"Quero dar meus parabéns às nossas polícias pela prisão do criminoso Capuava, considerado o maior traficante de todo o Estado de SP. Ele ocupava o 2º lugar na lista de criminosos mais procurados pela Secretaria de Segurança Pública. Parabéns à Polícia Militar e à Polícia Civil! https://t.co/Y9Bh4nkEmr",../data/bases-completas/geraldoalckmin.csv,geraldoalckmin,Geraldo Alckmin
975854480578277376,2018-03-19 22:00:13,19-03-2018 22:00:13,"Em entrevista à Folha de S. Paulo, falei sobre as dificuldades que governos tiveram em razão da recessão econômica.Em São Paulo, fizemos a lição de casa: cortamos gastos,tocamos obras e estamos com as contas em dia. Link para o texto: https://t.co/17NMIylnwG #PreparadoParaoBrasil https://t.co/zSqMsh79hJ",../data/bases-completas/geraldoalckmin.csv,geraldoalckmin,Geraldo Alckmin
975808905518477314,2018-03-19 18:59:07,19-03-2018 18:59:07,"Reforço no policiamento! As inscrições para a seleção de 2.700 novos soldados da Polícia Militar começam na próxima quinta-feira, 22 de março. Investimento forte para melhorar a segurança no Estado de São Paulo. Mais informações: https://t.co/w5IWhm32Tz https://t.co/TPk4FxsVuO",../data/bases-completas/geraldoalckmin.csv,geraldoalckmin,Geraldo Alckmin
975794288314474499,2018-03-19 18:01:02,19-03-2018 18:01:02,"Não tem economia que cresça só com consumo, é preciso ter investimento. Assim como não há paz verdadeira se não tem emprego e oportunidades para as pessoas. Precisamos de crescimento com geração de empregos e inclusão.",../data/bases-completas/geraldoalckmin.csv,geraldoalckmin,Geraldo Alckmin
975764146838007810,2018-03-19 16:01:16,19-03-2018 16:01:16,"Tivemos hoje a apresentação do 1º protótipo de carro híbrido com motor flex. Uma tecnologia desenvolvida por equipes brasileiras e japonesas que reduz a poluição e o consumo de combustível, possibilitando o uso de energia elétrica e, além da gasolina, o etanol. Grande avanço! https://t.co/46fINEYmX7",../data/bases-completas/geraldoalckmin.csv,geraldoalckmin,Geraldo Alckmin
975741284928417792,2018-03-19 14:30:25,19-03-2018 14:30:25,"O Estado de São Paulo enviou a alguns Estados do Nordeste equipamentos e bombas utilizadas durante a crise hídrica de 2014, com intuito de auxiliar na amenização do problema da falta de água.",../data/bases-completas/geraldoalckmin.csv,geraldoalckmin,Geraldo Alckmin
975730349308366848,2018-03-19 13:46:58,19-03-2018 13:46:58,"Promessa feita, promessa cumprida! Entregamos ontem 400 apartamentos em Jaraguá, moradias que fazem parte do programa Morar Bem, Viver Melhor e tiveram investimento de R$ 46,4 milhões. É casa de qualidade para quem mais precisa e ainda geração de empregos nas obras de construção. https://t.co/LKOT7vbuux",../data/bases-completas/geraldoalckmin.csv,geraldoalckmin,Geraldo Alckmin
975718750476472320,2018-03-19 13:00:52,19-03-2018 13:00:52,"O Brasil tem muitos desafios pela frente. É preciso unir forças para que possamos botar em prática grandes projetos para resolver nossos problemas, estimulando o crescimento sustentável e a geração de empregos que tanto precisamos. #PreparadoParaoBrasil https://t.co/aplTjJc6Ez",../data/bases-completas/geraldoalckmin.csv,geraldoalckmin,Geraldo Alckmin
975431749323894785,2018-03-18 18:00:26,18-03-2018 18:00:26,"Segundo pesquisa, SP tem 18 das 20 melhores estradas do país. Isso acontece graças ao investimento constante que fazemos em obras que melhoram o transporte e aumentam a segurança, preservando vidas. O Brasil perde muitas pessoas em acidentes de trânsito. Isso tem que mudar. https://t.co/jjh8ThHxLj",../data/bases-completas/geraldoalckmin.csv,geraldoalckmin,Geraldo Alckmin
975371392727310338,2018-03-18 14:00:36,18-03-2018 14:00:36,"A belíssima estação Eucaliptos, da Linha 5-Lilás, passa a operar com novo horário a partir de amanhã. O trecho até a estação Brooklin vai passar a funcionar gratuitamente das 9h às 16h. Em breve, vamos operar normalmente no horário padrão do metrô. https://t.co/gjbwYruk9A",../data/bases-completas/geraldoalckmin.csv,geraldoalckmin,Geraldo Alckmin
975133861385523200,2018-03-17 22:16:44,17-03-2018 22:16:44,"Iniciamos hoje obras de modernização na Raposo Tavares, fazendo duplicação e outras melhorias que vão reduzir o trânsito e evitar acidentes. São mais de 1,2 mil empregos gerados. É mais segurança, maior fluidez no tráfego e estímulo ao desenvolvimento! #PreparadoParaoBrasil https://t.co/jeFFC0GQlC",../data/bases-completas/geraldoalckmin.csv,geraldoalckmin,Geraldo Alckmin
975099603405234178,2018-03-17 20:00:36,17-03-2018 20:00:36,O setor que mais vai segurar o emprego é o de serviços. Ele é muito importante do ponto de vista social e econômico.,../data/bases-completas/geraldoalckmin.csv,geraldoalckmin,Geraldo Alckmin
975069401119625218,2018-03-17 18:00:35,17-03-2018 18:00:35,"Nesta semana, tive um encontro com investidores britânicos para discutir o cenário econômico paulista e brasileiro. É muito importante a aproximação com o mercado estrangeiro. Temos que estimular as exportações e atrair investimentos que geram empregos e oportunidades. https://t.co/bU1OUFLkik",../data/bases-completas/geraldoalckmin.csv,geraldoalckmin,Geraldo Alckmin
975008959064092672,2018-03-17 14:00:25,17-03-2018 14:00:25,"A Biblioteca de São Paulo (BSP) é finalista do The London Book Fair International Excellence Awards 2018, na categoria Melhor Biblioteca do Ano. O prêmio é um reconhecimento às boas da biblioteca. Orgulho para São Paulo! https://t.co/Z09JBA2g3U",../data/bases-completas/geraldoalckmin.csv,geraldoalckmin,Geraldo Alckmin
974766863778541568,2018-03-16 21:58:25,16-03-2018 21:58:25,"Entregamos o último trecho de duplicação da SP-304, estrada que liga 19 cidades, beneficiando mais de 435 mil habitantes. A obra faz parte de um grande investimento do governo em nossas estradas. Assim, reduzimos acidentes, geramos empregos e estimulamos o desenvolvimento. https://t.co/VQUhkaWq7x",../data/bases-completas/geraldoalckmin.csv,geraldoalckmin,Geraldo Alckmin
974723402253651970,2018-03-16 19:05:43,16-03-2018 19:05:43,"Foi uma grande satisfação realizar hoje a entrega do novo Hospital Regional de Piracicaba, importantíssimo para as 26 cidades da região. Desde 2011, fizemos 12 hospitais no Estado. É trabalho duro para garantir o direito do cidadão de ter acesso a bons equipamentos de saúde. https://t.co/PIc0hVldUO",../data/bases-completas/geraldoalckmin.csv,geraldoalckmin,Geraldo Alckmin
974707145789894657,2018-03-16 18:01:07,16-03-2018 18:01:07,O Estado de São Paulo a cada ano vem melhorando a sua situação fiscal sem aumentar impostos.,../data/bases-completas/geraldoalckmin.csv,geraldoalckmin,Geraldo Alckmin
974676927826026497,2018-03-16 16:01:02,16-03-2018 16:01:02,"Tivemos um importante encontro ontem com lideranças do PTB. Foi uma ótima oportunidade para debater o futuro do Brasil, em especial a geração de empregos que precisamos e a descentralização do poder, essencial para o bom funcionamento da máquina pública. #PreparadoParaoBrasil https://t.co/ze4eebZCwm",../data/bases-completas/geraldoalckmin.csv,geraldoalckmin,Geraldo Alckmin
974654101584842752,2018-03-16 14:30:20,16-03-2018 14:30:20,"O presidencialismo tem mais embates, tem uma campanha mais dura. É quase um embate de personalidades.",../data/bases-completas/geraldoalckmin.csv,geraldoalckmin,Geraldo Alckmin
974631535885381633,2018-03-16 13:00:40,16-03-2018 13:00:40,Hoje faz 39 anos que eu e a @lualckmin_ nos casamos. São quase 40 anos de amor e companheirismo. Passamos juntos os melhores momentos de nossas vidas e encaramos lado a lado grandes dificuldades. Que venham mais outros 39 anos juntos! https://t.co/8W8g3XDy7u,../data/bases-completas/geraldoalckmin.csv,geraldoalckmin,Geraldo Alckmin
974435179249983489,2018-03-16 00:00:25,16-03-2018 00:00:25,Mais mobilidade para a zona leste de São Paulo. Assinamos o edital da concessão do monotrilho da Linha 15-Prata. A linha vai ganhar ainda mais 8 novas estações. É isso que defendo para o Brasil: grandes projetos de transporte para melhorar a qualidade de vida de todos! https://t.co/4v62KSt2Bc,../data/bases-completas/geraldoalckmin.csv,geraldoalckmin,Geraldo Alckmin
974405066613493762,2018-03-15 22:00:46,15-03-2018 22:00:46,"Acabei de assinar o decreto do Fundo Especial para os Bombeiros. A proposta vai trazer mais investimentos para a corporação, com compras de equipamentos de última geração e ainda 40 ambulâncias para servir nos resgates. É mais qualidade no atendimento à população! https://t.co/H1mYHcYFZB",../data/bases-completas/geraldoalckmin.csv,geraldoalckmin,Geraldo Alckmin
974359662131908609,2018-03-15 19:00:20,15-03-2018 19:00:20,"Hoje é o dia do Consumidor, data importante para valorizarmos nossos direitos. Como deputado federal, tive a honra de redigir o projeto que deu origem ao Código de Defesa do Consumidor, importante ferramenta para coibir abusos e garantir relações justas entre pessoas e empresas. https://t.co/NGrt9hsBH5",../data/bases-completas/geraldoalckmin.csv,geraldoalckmin,Geraldo Alckmin
974302218953330691,2018-03-15 15:12:05,15-03-2018 15:12:05,"O assassinato da vereadora Marielle Franco revolta o Brasil inteiro. Um crime bárbaro que precisa ser rapidamente esclarecido, com os responsáveis punidos severamente. Esse homicídio revela a ousadia dos criminosos no país. Intolerável.",../data/bases-completas/geraldoalckmin.csv,geraldoalckmin,Geraldo Alckmin
974269186192101376,2018-03-15 13:00:49,15-03-2018 13:00:49,"Falei ontem no Fórum Econômico Mundial sobre o momento de grande questionamento que a política vive não apenas no Brasil, mas no mundo todo. Precisamos canalizar esse sentimento para promover mudanças positivas para o país. #PreparadoParaoBrasil https://t.co/din7tSk9HO",../data/bases-completas/geraldoalckmin.csv,geraldoalckmin,Geraldo Alckmin
974042861414043649,2018-03-14 22:01:29,14-03-2018 22:01:29,"Tivemos hoje no Fórum Econômico Mundial mesas de debate de alta qualidade, com temas de grande importância para o futuro do Brasil. Falei novamente do que defendo para o Brasil: crescimento, inclusão e sustentabilidade. Com muito trabalho, podemos levar o país ao rumo certo! https://t.co/ZC6XODP4YD",../data/bases-completas/geraldoalckmin.csv,geraldoalckmin,Geraldo Alckmin
973997282411638784,2018-03-14 19:00:22,14-03-2018 19:00:22,"Hoje, no Fórum Econômico Mundial para a América Latina, defendi responsabilidade fiscal e política de juros baixos. É assim que vamos atrair investimentos e fazer o país crescer de maneira sustentável, gerando empregos e promovendo a inclusão social. #PreparadoParaoBrasil https://t.co/o20ijpUVmw",../data/bases-completas/geraldoalckmin.csv,geraldoalckmin,Geraldo Alckmin
973980347863052290,2018-03-14 17:53:05,14-03-2018 17:53:05,Transmissão ao vivo do Fórum Econômico Mundial. Acompanhem! https://t.co/JwxmEewj4v,../data/bases-completas/geraldoalckmin.csv,geraldoalckmin,Geraldo Alckmin
973951984339488770,2018-03-14 16:00:22,14-03-2018 16:00:22,"Mais uma vez a qualidade do Poupatempo foi reconhecida pela população. Das 72 unidades do serviço, 24 tiveram 100% de aprovação. Desde 2011, construímos 47 novos postos, além de unidades móveis e totens de autoatendimento. É um exemplo de eficiência no serviço público. https://t.co/tdOOZhHg4u",../data/bases-completas/geraldoalckmin.csv,geraldoalckmin,Geraldo Alckmin
973937153263722496,2018-03-14 15:01:26,14-03-2018 15:01:26,"Às vezes, a gente perde muito tempo em briga política.  Quanto mais união entre Estado e o Município, mais a população ganha.",../data/bases-completas/geraldoalckmin.csv,geraldoalckmin,Geraldo Alckmin
973906763681542145,2018-03-14 13:00:41,14-03-2018 13:00:41,"Entregamos nesta semana novos prédios do Detran em 4 cidades, continuando o trabalho que está sendo feito no departamento. Desde que iniciamos a informatização, a aprovação do Detran subiu para 96%. O Brasil precisa de menos burocracia e mais agilidade nos serviços públicos. https://t.co/XOHrEFIvWe",../data/bases-completas/geraldoalckmin.csv,geraldoalckmin,Geraldo Alckmin
973706904911441921,2018-03-13 23:46:31,13-03-2018 23:46:31,"Participei da abertura do Fórum Econômico Mundial, em São Paulo, que vai contar com a presença de mais 700 líderes de 40 países até quinta-feira (15/03). Vamos debater os novos cenários para o Brasil e a integração regional. O evento está acontecendo em um momento oportuno. https://t.co/M1u8yMIRhn",../data/bases-completas/geraldoalckmin.csv,geraldoalckmin,Geraldo Alckmin
973695247459999744,2018-03-13 23:00:12,13-03-2018 23:00:12,No Fórum Econômico Mundial da América Latina também foi colocada a questão da igualdade e da participação das mulheres. É fundamental pensar em uma sociedade plural para avançarmos.,../data/bases-completas/geraldoalckmin.csv,geraldoalckmin,Geraldo Alckmin
973685184200572928,2018-03-13 22:20:12,13-03-2018 22:20:12,Acabei de participar da abertura do Fórum Econômico Mundial. Este encontro veio em um momento muito especial. O Brasil está saindo de uma recessão e iniciando um processo de recuperação econômica que deve ser mais vigoroso este ano.,../data/bases-completas/geraldoalckmin.csv,geraldoalckmin,Geraldo Alckmin
973680208980201477,2018-03-13 22:00:26,13-03-2018 22:00:26,"Participei ontem da cerimônia do Internet para Todos, iniciativa do Gov. Federal para levar a internet a lugares com problemas de conexão. Dos 2.836 municípios aptos a participar do programa, 550 são de SP. Demos um grande passo para ampliar o acesso à rede! #PreparadoParaoBrasil https://t.co/EY40ymECRL",../data/bases-completas/geraldoalckmin.csv,geraldoalckmin,Geraldo Alckmin
973634876120367105,2018-03-13 19:00:18,13-03-2018 19:00:18,Pesquisa do Ibope revela que a maior parte dos brasileiros acredita que a experiência em grandes cargos é fundamental para ser presidente. O Brasil viveu nos últimos anos uma grave crise causada por governos despreparados. Não devemos repetir o erro. #PreparadoParaoBrasil https://t.co/pFJX6nmiyJ,../data/bases-completas/geraldoalckmin.csv,geraldoalckmin,Geraldo Alckmin
973629795127955456,2018-03-13 18:40:06,13-03-2018 18:40:06,"O crescimento da produção de petróleo na Bacia de Santos está acima de 40% ao ano no Estado de São Paulo. Já somos o segundo maior produtor de petróleo e gás, atrás apenas do Rio de Janeiro.",../data/bases-completas/geraldoalckmin.csv,geraldoalckmin,Geraldo Alckmin
973589589246984192,2018-03-13 16:00:21,13-03-2018 16:00:21,Foi muito bacana a recepção que tivemos ontem em evento em Brasília. Temos uma longa caminhada pela frente e todo apoio é bem vindo. Precisamos de união para resolver os problemas do Brasil. #PreparadoParaoBrasil https://t.co/Nycm444gVw,../data/bases-completas/geraldoalckmin.csv,geraldoalckmin,Geraldo Alckmin
973576942426390529,2018-03-13 15:10:05,13-03-2018 15:10:05,Defendo maior abertura comercial porque a sociedade ganha com isso. O Brasil precisa de uma agenda de competitividade e inovação. #PreparadoParaoBrasil,../data/bases-completas/geraldoalckmin.csv,geraldoalckmin,Geraldo Alckmin
973544419717722112,2018-03-13 13:00:51,13-03-2018 13:00:51,"Estudantes interessados em participar do Escola da Família podem fazer inscrições até dia 15/3. No programa, alunos trabalham em atividades aos finais de semana em escolas públicas e, em troca, recebem bolsas de até 50% na faculdade. Saiba mais: https://t.co/1IlZh56oFj https://t.co/Ora3WEj4Nw",../data/bases-completas/geraldoalckmin.csv,geraldoalckmin,Geraldo Alckmin
973317802139488257,2018-03-12 22:00:22,12-03-2018 22:00:22,"Entregamos hoje o novo prédio do Fórum de Limeira, uma bela instalação com total acessibilidade para atender a região. Investimento forte do governo do Estado em benefício da população. #PreparadoParaoBrasil https://t.co/97HR88k0Pe",../data/bases-completas/geraldoalckmin.csv,geraldoalckmin,Geraldo Alckmin
973273308044066817,2018-03-12 19:03:33,12-03-2018 19:03:33,"Anunciamos hoje obras de mobilidade na região metropolitana de Campinas, uma série de intervenções que vão melhorar muito o transporte entre as cidades. O Brasil tem muitas carências nessa área. Precisamos de grandes obras para reduzir o custo Brasil e gerar empregos. https://t.co/HTQPmkfen3",../data/bases-completas/geraldoalckmin.csv,geraldoalckmin,Geraldo Alckmin
