id,datetime,created_at,text,file,twitter_handle,name
923588861435043841,2017-10-26 16:35:18,26-10-2017 16:35:18,"Os médicos me recomendaram desacelerar, mas temos muito o que fazer. Já estou no @planalto, cumprindo agenda. Vamos em frente.",../data/bases-completas/MichelTemer.csv,MichelTemer,Michel Temer
923588821970714624,2017-10-26 16:35:09,26-10-2017 16:35:09,"Agradeço aos militares da equipe médica e integrantes do HMAB, pela dedicação e atenção que tiveram enquanto estive no hospital. https://t.co/aJIFA6enIV",../data/bases-completas/MichelTemer.csv,MichelTemer,Michel Temer
923571344721285120,2017-10-26 15:25:42,26-10-2017 15:25:42,O trabalho venceu a recessão. Meu compromisso é fazer nosso País cada vez maior e melhor. Os resultados já são visíveis. Assista! https://t.co/dVxhPGpMre,../data/bases-completas/MichelTemer.csv,MichelTemer,Michel Temer
923501509186408450,2017-10-26 10:48:12,26-10-2017 10:48:12,Os leilões desta sexta serão uma oportunidade para gerar bilhões em investimentos e criar cada vez mais empregos: https://t.co/EyklOOE9ZP https://t.co/Q5ELkIH5ux,../data/bases-completas/MichelTemer.csv,MichelTemer,Michel Temer
923501432111845376,2017-10-26 10:47:53,26-10-2017 10:47:53,"Bom dia! Após um longo período sem leilões do pré-sal, adotamos regras mais claras para fazer das novas rodadas um momento histórico.",../data/bases-completas/MichelTemer.csv,MichelTemer,Michel Temer
923337485022846976,2017-10-25 23:56:25,25-10-2017 23:56:25,A orientação médica foi p/ que eu fique em repouso pelos próximos dias. Agradeço a todos que enviaram mensagens preocupados com minha saúde.,../data/bases-completas/MichelTemer.csv,MichelTemer,Michel Temer
923337374192586752,2017-10-25 23:55:59,25-10-2017 23:55:59,Boa noite! Hoje tive um desconforto e fui submetido a uma série de exames. Estou bem. https://t.co/AdaK4wBlsM,../data/bases-completas/MichelTemer.csv,MichelTemer,Michel Temer
923199029760184320,2017-10-25 14:46:15,25-10-2017 14:46:15,Boa notícia! Recuperação da economia e do emprego deu mais otimismo aos brasileiros e ao setor produtivo https://t.co/bVtvzBRZVh,../data/bases-completas/MichelTemer.csv,MichelTemer,Michel Temer
922818959807836160,2017-10-24 13:35:59,24-10-2017 13:35:59,"(AI) Conversão de multas em serviços ambientais é “urgente e necessária”, afirmam entidades da sociedade civil: https://t.co/UETarEZmNG",../data/bases-completas/MichelTemer.csv,MichelTemer,Michel Temer
922533937913712641,2017-10-23 18:43:25,23-10-2017 18:43:25,(AI) Presidente Michel Temer recebe cartas credenciais de 12 embaixadores estrangeiros. https://t.co/1frwkp25nk,../data/bases-completas/MichelTemer.csv,MichelTemer,Michel Temer
922487925962674177,2017-10-23 15:40:35,23-10-2017 15:40:35,Boa tarde! Riqueza ambiental. Leia meu artigo publicado na @folha: https://t.co/A5x1N0WY2x,../data/bases-completas/MichelTemer.csv,MichelTemer,Michel Temer
922470846916104192,2017-10-23 14:32:43,23-10-2017 14:32:43,"@mmeioambiente @ICMBio Agradeço imensamente o engajamento da sociedade civil, que está apoiando as ações com um grande número de voluntários.",../data/bases-completas/MichelTemer.csv,MichelTemer,Michel Temer
922470785192808448,2017-10-23 14:32:28,23-10-2017 14:32:28,"@mmeioambiente @ICMBio São 110 brigadistas, 45 bombeiros, 4 aviões e 2 helicópteros trabalhando sem descanso para combater o fogo.",../data/bases-completas/MichelTemer.csv,MichelTemer,Michel Temer
922470760224055297,2017-10-23 14:32:22,23-10-2017 14:32:22,O Governo do Brasil está trabalhando com força total para acabar com os incêndios florestais no Parque Nacional da Chapada dos Veadeiros. https://t.co/UquhxhD0BC,../data/bases-completas/MichelTemer.csv,MichelTemer,Michel Temer
922455319602753537,2017-10-23 13:31:01,23-10-2017 13:31:01,"@portalfab E mesmo além de nossas fronteiras, a FAB marca presença, em nome dos brasileiros, cooperando com países amigos, levando ajuda humanitária.",../data/bases-completas/MichelTemer.csv,MichelTemer,Michel Temer
922455208256573441,2017-10-23 13:30:34,23-10-2017 13:30:34,"@portalfab Por suas asas, populações inteiras em recônditos do Brasil recebem o apoio de que precisam, como remédios e assistência médica.",../data/bases-completas/MichelTemer.csv,MichelTemer,Michel Temer
922455149116887041,2017-10-23 13:30:20,23-10-2017 13:30:20,"@portalfab Nossos aviadores defendem um espaço aéreo de 22 milhões de Km², incluindo as águas do Atlântico Sul: https://t.co/C13L8jLtUA #Dimensão22 https://t.co/TKy9awfN0I",../data/bases-completas/MichelTemer.csv,MichelTemer,Michel Temer
922437339036741632,2017-10-23 12:19:34,23-10-2017 12:19:34,Bom dia! Participo da cerimônia de Imposição da Medalha da Ordem do Mérito Aeronáutico em comemoração ao Dia do Aviador e da @portalfab. https://t.co/6LqZPuRmKS,../data/bases-completas/MichelTemer.csv,MichelTemer,Michel Temer
922136326262190080,2017-10-22 16:23:27,22-10-2017 16:23:27,Final de semana gratificante. É isso que me motiva a continuar as transformações que estão colocando o País no rumo certo. https://t.co/ChpUqyMlWk,../data/bases-completas/MichelTemer.csv,MichelTemer,Michel Temer
921804581797023745,2017-10-21 18:25:13,21-10-2017 18:25:13,"Fui recebido com muito carinho pelos filhos de trabalhadores rurais, que participam de projeto de educação socioambiental em Miranda (MS). https://t.co/X7smveu2lZ",../data/bases-completas/MichelTemer.csv,MichelTemer,Michel Temer
921784668344717312,2017-10-21 17:06:05,21-10-2017 17:06:05,"@mmeioambiente Do mesmo modo, fizemos questão de que fosse o Brasil um dos primeiros países a ratificarem o #AcordoDeParis sobre mudança climática.",../data/bases-completas/MichelTemer.csv,MichelTemer,Michel Temer
921784554603638784,2017-10-21 17:05:38,21-10-2017 17:05:38,"@mmeioambiente Na semana passada, sancionamos a lei que estabelece o cálculo do PIB Verde, que contabilizará todo o patrimônio ecológico brasileiro.",../data/bases-completas/MichelTemer.csv,MichelTemer,Michel Temer
921784459464269824,2017-10-21 17:05:15,21-10-2017 17:05:15,@mmeioambiente Destaco também que temos conseguido voltar a boa trajetória de queda do desmatamento na Amazônia.,../data/bases-completas/MichelTemer.csv,MichelTemer,Michel Temer
921784331663790080,2017-10-21 17:04:45,21-10-2017 17:04:45,"@mmeioambiente Iniciativa que se soma a outras ações que temos promovido para a conservação ambiental, como a ampliação da Chapada dos Veadeiros.",../data/bases-completas/MichelTemer.csv,MichelTemer,Michel Temer
921784215456436224,2017-10-21 17:04:17,21-10-2017 17:04:17,"@mmeioambiente Assinamos o decreto para converter parte do valor das multas ambientais em ações concretas, como reflorestamentos de áreas. https://t.co/cDyXSAcaaV",../data/bases-completas/MichelTemer.csv,MichelTemer,Michel Temer
921784002918436864,2017-10-21 17:03:26,21-10-2017 17:03:26,"Nesta cerimônia, damos passos relevantes para assegurar o futuro do #Pantanal, reforçando nosso compromisso com meio ambiente. https://t.co/WCU5tg2qEG",../data/bases-completas/MichelTemer.csv,MichelTemer,Michel Temer
921773763666104320,2017-10-21 16:22:45,21-10-2017 16:22:45,"(AI) #AoVivo Presidente Michel Temer participa da cerimônia de encerramento do II Encontro da #CartaCaiman, em MS: https://t.co/26Q4xheCBP",../data/bases-completas/MichelTemer.csv,MichelTemer,Michel Temer
921759505347686400,2017-10-21 15:26:06,21-10-2017 15:26:06,"Cheguei em Miranda, no Mato Grosso do Sul, para participar do II Encontro da Carta Caiman. #MeioAmbiente #Pantanal https://t.co/GxGSiMOrkr",../data/bases-completas/MichelTemer.csv,MichelTemer,Michel Temer
921440958432120834,2017-10-20 18:20:18,20-10-2017 18:20:18,"Como todo brasileiro, estou consternado com a tragédia na escola de Goiânia. Minha solidariedade às famílias. Força!",../data/bases-completas/MichelTemer.csv,MichelTemer,Michel Temer
921439388286013442,2017-10-20 18:14:04,20-10-2017 18:14:04,"@Min_Agricultura Quando visitamos um empreendimento como este, estamos prestigiando o Brasil que produz, que prospera e que gera oportunidades.",../data/bases-completas/MichelTemer.csv,MichelTemer,Michel Temer
921439331763539973,2017-10-20 18:13:50,20-10-2017 18:13:50,"@Min_Agricultura O Brasil está de volta aos trilhos, resgatamos a credibilidade da nossa economia. As famílias estão tendo o seu poder de compra protegido.",../data/bases-completas/MichelTemer.csv,MichelTemer,Michel Temer
921439258476470272,2017-10-20 18:13:33,20-10-2017 18:13:33,"@Min_Agricultura São avanços que se traduzem em emprego, renda e desenvolvimento. Devemos à agroindústria boa parte do crescimento econômico deste ano.",../data/bases-completas/MichelTemer.csv,MichelTemer,Michel Temer
921439227677638657,2017-10-20 18:13:26,20-10-2017 18:13:26,"É sempre gratificante constatar as transformações q estão ocorrendo no Brasil. Aqui, vemos o progresso tecnológico gerado pela agroindústria https://t.co/9D2SBBkpyI",../data/bases-completas/MichelTemer.csv,MichelTemer,Michel Temer
921432102784131073,2017-10-20 17:45:07,20-10-2017 17:45:07,(AI) #AoVivo Temer visita complexo agroindustrial e participa da inauguração do maior abatedouro de peixes do País: https://t.co/2GpyH48u6g,../data/bases-completas/MichelTemer.csv,MichelTemer,Michel Temer
921073733447626752,2017-10-19 18:01:05,19-10-2017 18:01:05,"@obrasirmadulce @minsaude O hospital, que funciona com recursos do #SUS, tem 954 leitos e atende mais de 2.000 pessoas por dia.",../data/bases-completas/MichelTemer.csv,MichelTemer,Michel Temer
921073666393288704,2017-10-19 18:00:49,19-10-2017 18:00:49,"@obrasirmadulce @minsaude Este ano, o Governo reajustou os repasses para manter em funcionamento o bom atendimento à população.",../data/bases-completas/MichelTemer.csv,MichelTemer,Michel Temer
921073579298607105,2017-10-19 18:00:28,19-10-2017 18:00:28,"Recebi hoje a senhora Maria Rita Pontes, superintendente das @obrasirmadulce (BA), hospital referência no ensino médico do Brasil. https://t.co/4lBjI7rjxQ",../data/bases-completas/MichelTemer.csv,MichelTemer,Michel Temer
920764824417599488,2017-10-18 21:33:35,18-10-2017 21:33:35,"@minsaude Essa é uma preocupação constante do governo. Desde 2016, determinei que um avião da @portalfab fique disponível para o transporte de órgãos.",../data/bases-completas/MichelTemer.csv,MichelTemer,Michel Temer
920764658373537793,2017-10-18 21:32:56,18-10-2017 21:32:56,@minsaude Queremos aumentar o número de doadores e transplantes para ajudar quem precisa. Cada minuto conta para salvar vidas.,../data/bases-completas/MichelTemer.csv,MichelTemer,Michel Temer
920764585593966593,2017-10-18 21:32:38,18-10-2017 21:32:38,Acabei de assinar um decreto que moderniza a legislação sobre a doação de órgãos no País: https://t.co/xekgijOrUc https://t.co/K5lxPXN7i2,../data/bases-completas/MichelTemer.csv,MichelTemer,Michel Temer
920595663557156864,2017-10-18 10:21:24,18-10-2017 10:21:24,"São brasileiros, como o médico Raul Cutait, que dedicam os seus estudos e energia para ajudar o próximo. Parabéns a todos! #DiaDoMédico https://t.co/p3Opd6mKE1",../data/bases-completas/MichelTemer.csv,MichelTemer,Michel Temer
920595595437445120,2017-10-18 10:21:08,18-10-2017 10:21:08,"Cuidar das pessoas e salvar vidas não é só trabalho, é o compromisso de milhares de médicos que fazem do ofício uma missão. #DiaDoMédico",../data/bases-completas/MichelTemer.csv,MichelTemer,Michel Temer
920362911205347328,2017-10-17 18:56:32,17-10-2017 18:56:32,"Quando atender o telefone, não diga alô. Diga Alô, Temer. #FaleComOPresidente https://t.co/pkOhmsIBki",../data/bases-completas/MichelTemer.csv,MichelTemer,Michel Temer
920292788364824577,2017-10-17 14:17:53,17-10-2017 14:17:53,"O médico presta um serviço social relevantíssimo, pois ele leva para as famílias a esperança da recuperação. https://t.co/LhF3gUqyyU",../data/bases-completas/MichelTemer.csv,MichelTemer,Michel Temer
920276933862154241,2017-10-17 13:14:53,17-10-2017 13:14:53,(AI) #AoVivo Presidente Michel Temer participa da cerimônia de entrega da medalha de Ordem do Mérito Médico: https://t.co/U7Gto599MT https://t.co/NrSHAyFXrK,../data/bases-completas/MichelTemer.csv,MichelTemer,Michel Temer
920028304207482880,2017-10-16 20:46:55,16-10-2017 20:46:55,"Estamos consternados com o ataque na Somália, que fez centenas de vítimas. Repudiamos toda forma de terrorismo.",../data/bases-completas/MichelTemer.csv,MichelTemer,Michel Temer
919667926143324160,2017-10-15 20:54:54,15-10-2017 20:54:54,"DOMINGO DE CARINHO
A jornada é difícil, mas sempre há tempo para o Thor. https://t.co/1KhQzRxQfr",../data/bases-completas/MichelTemer.csv,MichelTemer,Michel Temer
919510681396715520,2017-10-15 10:30:04,15-10-2017 10:30:04,"Aos que como eu escolheram ser professor, presto minha homenagem e reafirmo meu compromisso com a Educação. Parabéns! #DiaDoProfessor https://t.co/fUPhu77JyI",../data/bases-completas/MichelTemer.csv,MichelTemer,Michel Temer
918793558538293248,2017-10-13 11:00:29,13-10-2017 11:00:29,"Serão R$ 15 bilhões a mais na economia, beneficiando milhões de brasileiros. Leia: https://t.co/IHeLclEdg5",../data/bases-completas/MichelTemer.csv,MichelTemer,Michel Temer
918793502154219522,2017-10-13 11:00:15,13-10-2017 11:00:15,"Agora, a idade para o saque reduziu de 70 anos para 62, para as mulheres, e 65, para homens.",../data/bases-completas/MichelTemer.csv,MichelTemer,Michel Temer
918793464594046977,2017-10-13 11:00:06,13-10-2017 11:00:06,"Com pequenas ações, o Governo beneficia ainda mais o trabalhador. Saques do PIS/Pasep para aposentados começam na próxima quinta-feira (19) https://t.co/agMRP10sSv",../data/bases-completas/MichelTemer.csv,MichelTemer,Michel Temer
918461255521779712,2017-10-12 13:00:02,12-10-2017 13:00:02,"Hoje, eu e minha família nos unimos aos devotos de Nossa Senhora Aparecida e compartilhamos o carinho e o amor à padroeira do Brasil. https://t.co/ZhhM1umem6",../data/bases-completas/MichelTemer.csv,MichelTemer,Michel Temer
917877405368377346,2017-10-10 22:20:01,10-10-2017 22:20:01,"(AI) Por determinação do presidente Temer, governo destina R$ 8,7 milhões para creches e hospitais em MG: https://t.co/yHClQvSiOT #Janaúba https://t.co/AD6ZwsLpcE",../data/bases-completas/MichelTemer.csv,MichelTemer,Michel Temer
916700263586717696,2017-10-07 16:22:28,07-10-2017 16:22:28,Sua coragem impediu que a tragédia fosse ainda maior. Um ato que não será esquecido pelos brasileiros. Meus pêsames à família de Heley.,../data/bases-completas/MichelTemer.csv,MichelTemer,Michel Temer
916700188277968897,2017-10-07 16:22:11,07-10-2017 16:22:11,"Meus sentimentos pelo falecimento da professora Heley de Abreu, que pôs sua própria vida em risco para ajudar as crianças em Janaúba (MG).",../data/bases-completas/MichelTemer.csv,MichelTemer,Michel Temer
916400194496880641,2017-10-06 20:30:06,06-10-2017 20:30:06,"Expresso meu contentamento com a Campanha Internacional para Abolição de Armas Nucleares, que recebeu o Prêmio Nobel da Paz. https://t.co/ZXasekp0ZM",../data/bases-completas/MichelTemer.csv,MichelTemer,Michel Temer
916326444380418048,2017-10-06 15:37:03,06-10-2017 15:37:03,"@portalfab @planejamentobr @DefesaGovBr Parabenizo o trabalho da FAB no controle, defesa e integração feito nos 22 milhões de Km². São as asas que protegem o Brasil.",../data/bases-completas/MichelTemer.csv,MichelTemer,Michel Temer
916326405507567616,2017-10-06 15:36:54,06-10-2017 15:36:54,Assistimos o vídeo institucional #Dimensao22 da Força Aérea Brasileira no voo entre o Pará e o Maranhão. https://t.co/HzFQVrBK9J,../data/bases-completas/MichelTemer.csv,MichelTemer,Michel Temer
916301300995903489,2017-10-06 13:57:08,06-10-2017 13:57:08,Inflação acumulada no ano é a mais baixa em 19 anos. Reflexo da política econômica adotada quando assumi o governo.,../data/bases-completas/MichelTemer.csv,MichelTemer,Michel Temer
916267156219879425,2017-10-06 11:41:28,06-10-2017 11:41:28,"Bom dia! 6 de outubro, dia do Dr. Ulysses. 101 anos de democracia. 🙏",../data/bases-completas/MichelTemer.csv,MichelTemer,Michel Temer
916045267429818369,2017-10-05 20:59:45,05-10-2017 20:59:45,"(AI) Acompanhado de ministros, presidente Michel Temer visita Centro de Lançamento de Alcântara, no Maranhão: https://t.co/ewwHt5pExG https://t.co/7MsgV70woI",../data/bases-completas/MichelTemer.csv,MichelTemer,Michel Temer
916008436218908673,2017-10-05 18:33:24,05-10-2017 18:33:24,(AI) Presidente Temer doa terreno para construção de centro de eventos da Basílica de N.Sra. de Nazaré em Belém: https://t.co/tlhLssQCTC https://t.co/sManE8O3ZS,../data/bases-completas/MichelTemer.csv,MichelTemer,Michel Temer
915968405026611202,2017-10-05 15:54:20,05-10-2017 15:54:20,Eu que sou pai imagino que esta deve ser uma perda muitíssimo dolorosa. Esperamos que essas coisas não se repitam no Brasil.,../data/bases-completas/MichelTemer.csv,MichelTemer,Michel Temer
915968386798104577,2017-10-05 15:54:15,05-10-2017 15:54:15,Lamento imensamente essa tragédia com as crianças em Janaúba (MG). Quero expressar a minha solidariedade às famílias.,../data/bases-completas/MichelTemer.csv,MichelTemer,Michel Temer
915967722604957696,2017-10-05 15:51:37,05-10-2017 15:51:37,"Recebi das mãos do arcebispo Dom Alberto Corrêa a imagem de Nossa Senhora de Nazaré, padroeira da cidade de Belém. Agradeço o carinho. https://t.co/koGq1aRuFL",../data/bases-completas/MichelTemer.csv,MichelTemer,Michel Temer
915960539687407616,2017-10-05 15:23:05,05-10-2017 15:23:05,"É com muita alegria cívica que tenho a honra de receber o título de cidadão paraense. Obrigado, Pará! https://t.co/UYNoAfoYkH",../data/bases-completas/MichelTemer.csv,MichelTemer,Michel Temer
915946831925923840,2017-10-05 14:28:36,05-10-2017 14:28:36,"(AI) #AoVivo Presidente Temer participa da cerimônia de cessão de lote p/ a Basílica Nossa Senhora de Nazaré, no PA: https://t.co/09AtTMkYrl https://t.co/kPktckxpRc",../data/bases-completas/MichelTemer.csv,MichelTemer,Michel Temer
915894067216740352,2017-10-05 10:58:56,05-10-2017 10:58:56,Que a Nossa Senhora de Nazaré proteja o Brasil!,../data/bases-completas/MichelTemer.csv,MichelTemer,Michel Temer
915893999763955712,2017-10-05 10:58:40,05-10-2017 10:58:40,É uma honra pra mim poder acrescentar mais um capítulo à linda história do Círio de Nazaré.,../data/bases-completas/MichelTemer.csv,MichelTemer,Michel Temer
915893896147881984,2017-10-05 10:58:15,05-10-2017 10:58:15,"Agora, a corda que sustenta a fé na padroeira terá mais espaço para receber e proteger os mais de 2 milhões de fiéis.",../data/bases-completas/MichelTemer.csv,MichelTemer,Michel Temer
915893814929297409,2017-10-05 10:57:56,05-10-2017 10:57:56,"Com o novo espaço, a Arquidiocese terá mais espaço p/ acolher os romeiros e realizar as atividades da igreja ao longo do ano.",../data/bases-completas/MichelTemer.csv,MichelTemer,Michel Temer
915893775519617024,2017-10-05 10:57:47,05-10-2017 10:57:47,Bom dia! Às vésperas do Círio de Nazaré vou a Belém. Farei a doação de imóvel da União para a Basílica de Nossa Senhora ampliar sua área.,../data/bases-completas/MichelTemer.csv,MichelTemer,Michel Temer
915716094337404928,2017-10-04 23:11:44,04-10-2017 23:11:44,"(AI) Para Michel Temer, entrega de ambulâncias reforça responsabilidade social do governo: https://t.co/vkT6kdSL9S  #SAMU192 https://t.co/iV9mzzUE0x",../data/bases-completas/MichelTemer.csv,MichelTemer,Michel Temer
915685539919089664,2017-10-04 21:10:19,04-10-2017 21:10:19,"@minsaude @RicardoBarrosPP Atualmente, o #SAMU192 atende 81,8% da população brasileira em 3.514 municípios. Um exemplo do Brasil que sabe atender.",../data/bases-completas/MichelTemer.csv,MichelTemer,Michel Temer
915685436479164418,2017-10-04 21:09:55,04-10-2017 21:09:55,"@minsaude @RicardoBarrosPP O Serviço Móvel de Urgência funciona 24h por dia, de graça, com profissionais capacitados. Um exemplo do Brasil que dá certo. #SAMU192",../data/bases-completas/MichelTemer.csv,MichelTemer,Michel Temer
915685373468127234,2017-10-04 21:09:40,04-10-2017 21:09:40,#SAMU192: o número que salva vidas. Chegar com antecedência a uma ocorrência faz toda a diferença. Investir no atendimento pode salvar vidas https://t.co/mdxymnutCU,../data/bases-completas/MichelTemer.csv,MichelTemer,Michel Temer
915679212626989056,2017-10-04 20:45:11,04-10-2017 20:45:11,"(AI) #AoVivo Presidente Temer participa da entrega de novas ambulâncias para renovação da frota do SAMU 192, em SP: https://t.co/wgASXCPuwt",../data/bases-completas/MichelTemer.csv,MichelTemer,Michel Temer
915642202767941636,2017-10-04 18:18:07,04-10-2017 18:18:07,(AI) Michel Temer: micro e pequenos empresários são campeões nacionais do emprego: https://t.co/l3Bb5L2TRH  #DiaDaMPE https://t.co/syj1rMpsGP,../data/bases-completas/MichelTemer.csv,MichelTemer,Michel Temer
915602038226063365,2017-10-04 15:38:31,04-10-2017 15:38:31,"@MdicGov @MEC_Comunicacao @sebrae Com o talento de nossos trabalhadores e empresários; com o caminho que traçamos e o apoio do Congresso Nacional, viramos o jogo da economia.",../data/bases-completas/MichelTemer.csv,MichelTemer,Michel Temer
915601969322037248,2017-10-04 15:38:15,04-10-2017 15:38:15,"@MdicGov @MEC_Comunicacao @sebrae Agora, é manter o rumo, é dar continuidade a nossa agenda de reformas.",../data/bases-completas/MichelTemer.csv,MichelTemer,Michel Temer
915601909435813888,2017-10-04 15:38:00,04-10-2017 15:38:00,"@MdicGov @MEC_Comunicacao @sebrae Com clareza de ideias, com determinação, com coragem para fazer o que tem que ser feito, recolocamos o Brasil nos trilhos do desenvolvimento",../data/bases-completas/MichelTemer.csv,MichelTemer,Michel Temer
915601875998838784,2017-10-04 15:37:52,04-10-2017 15:37:52,Estejam certos: tudo o que fazemos é para facilitar a vida de quem produz e de quem gera empregos criando oportunidades para todos. https://t.co/Yeai0mMBUF,../data/bases-completas/MichelTemer.csv,MichelTemer,Michel Temer
915597357160521728,2017-10-04 15:19:55,04-10-2017 15:19:55,(AI) #AoVivo Presidente Michel Temer participa de cerimônia alusiva ao Dia Nacional da Micro e Pequena Empresa: https://t.co/A3W3APFBMe,../data/bases-completas/MichelTemer.csv,MichelTemer,Michel Temer
915538306540154881,2017-10-04 11:25:16,04-10-2017 11:25:16,"Mais importações, mais exportações, mais postos de trabalho conquistados. Isso é o que interessa: vamos juntos transformar o Brasil.",../data/bases-completas/MichelTemer.csv,MichelTemer,Michel Temer
915538192685785088,2017-10-04 11:24:49,04-10-2017 11:24:49,"Só ontem, tivemos a notícia de que a Bolsa de Valores bateu um novo recorde e que as vendas dos eletrodomésticos subiram 8.8%.",../data/bases-completas/MichelTemer.csv,MichelTemer,Michel Temer
915538100197187585,2017-10-04 11:24:27,04-10-2017 11:24:27,"E dignidade é o que se tem de maior valor na vida. O meu trabalho é esse, devolver os empregos e a dignidade aos brasileiros. É só o começo.",../data/bases-completas/MichelTemer.csv,MichelTemer,Michel Temer
915537985776619520,2017-10-04 11:24:00,04-10-2017 11:24:00,"Qd alguém conquista o emprego, não é só o dinheiro q entra, vem junto a auto estima e um sentimento de dignidade q muda o astral da família.",../data/bases-completas/MichelTemer.csv,MichelTemer,Michel Temer
915537903236902913,2017-10-04 11:23:40,04-10-2017 11:23:40,"Vamos comemorar o que todo brasileiro quer e merece: o Brasil, definitivamente, voltou a empregar.",../data/bases-completas/MichelTemer.csv,MichelTemer,Michel Temer
915537836748746753,2017-10-04 11:23:24,04-10-2017 11:23:24,"São pessoas q não saem na TV, não dão entrevistas, mas trabalham, cada um, 24h por dia p/ uma vida melhor. E coletivamente por Brasil melhor",../data/bases-completas/MichelTemer.csv,MichelTemer,Michel Temer
915537776489193474,2017-10-04 11:23:10,04-10-2017 11:23:10,"Eles representam mais de 98% das empresas brasileiras, 27% do PIB e são responsáveis por quase 60% do emprego.",../data/bases-completas/MichelTemer.csv,MichelTemer,Michel Temer
915537739134767104,2017-10-04 11:23:01,04-10-2017 11:23:01,Bom dia! Hoje vou comemorar com os Micro e Pequenos empresários o seu dia.,../data/bases-completas/MichelTemer.csv,MichelTemer,Michel Temer
915343736393134080,2017-10-03 22:32:07,03-10-2017 22:32:07,"Morreram em 1645 como mártires pela fé no Brasil. Beatificados por João Paulo II, serão canonizados em 15/10.",../data/bases-completas/MichelTemer.csv,MichelTemer,Michel Temer
915343659838709760,2017-10-03 22:31:49,03-10-2017 22:31:49,"Hoje os católicos do RN celebram seus padroeiros. São os padres André de Soveral e Ambrósio Francisco Ferro, e seus 28 companheiros leigos.",../data/bases-completas/MichelTemer.csv,MichelTemer,Michel Temer
915213499055427585,2017-10-03 13:54:36,03-10-2017 13:54:36,"Durante 5 meses, os pesquisadores do IBGE percorrerão as propriedades rurais de todo o País para traçar uma radiografia do campo. #CensoAgro https://t.co/U7pEVCH7x4",../data/bases-completas/MichelTemer.csv,MichelTemer,Michel Temer
915186897609162752,2017-10-03 12:08:54,03-10-2017 12:08:54,O Brasil não será pautado pela irresponsabilidade e falta de compromisso de alguém que se perdeu pelas próprias ambições.,../data/bases-completas/MichelTemer.csv,MichelTemer,Michel Temer
915186800385253377,2017-10-03 12:08:31,03-10-2017 12:08:31,"Precisamos lidar com mais uma denúncia inepta e sem sentido, proposta por uma associação criminosa que quis parar o País.",../data/bases-completas/MichelTemer.csv,MichelTemer,Michel Temer
915186715781926913,2017-10-03 12:08:11,03-10-2017 12:08:11,"Vou conversar com representantes de todos os partidos da base, de todas as regiões do Brasil. É uma rotina que sempre mantive.",../data/bases-completas/MichelTemer.csv,MichelTemer,Michel Temer
