id,datetime,created_at,text,file,twitter_handle,name
967038781558837249,2018-02-23 14:09:46,23-02-2018 14:09:46,"Neste momento, a segurança pública é a nossa pauta prioritária, mas o sucesso depende do apoio de todos: sociedade civil, Justiça e Ministério Público. Tenho a absoluta convicção de que a intervenção na segurança dará certo e o Rio de Janeiro servirá de modelo para o País. https://t.co/zJdnOGd0Ki",../data/bases-completas/MichelTemer.csv,MichelTemer,Michel Temer
967038768824844289,2018-02-23 14:09:43,23-02-2018 14:09:43,"Em conversa com @DatenaOficial, agora há pouco, falei sobre a intervenção federal na segurança do #RioDeJaneiro. Não vamos mais aceitar jovens sendo assassinados, escolas fechadas e a cidade separada por trincheiras. #BrasilPeloRio https://t.co/gPWE06dvNL",../data/bases-completas/MichelTemer.csv,MichelTemer,Michel Temer
967021638461132800,2018-02-23 13:01:39,23-02-2018 13:01:39,#AoVivo agora conversando com @DatenaOficial na @RBandeirantes. Acompanhe: https://t.co/86VYBNg8DJ,../data/bases-completas/MichelTemer.csv,MichelTemer,Michel Temer
966794192700739584,2018-02-22 21:57:52,22-02-2018 21:57:52,"Tive honra de ser o primeiro Presidente da República a assinar o livro de visitantes do Ministério da @DefesaGovBr. Participei, hoje, de reunião do Conselho de Defesa, com o ministro Jungmam e os comandantes das Forças Armadas. Momento rico de me aprofundar sobre o setor. https://t.co/keCvkCzpf5",../data/bases-completas/MichelTemer.csv,MichelTemer,Michel Temer
965960012966383617,2018-02-20 14:43:08,20-02-2018 14:43:08,"Ao fabricarmos submarinos com tecnologia de ponta, estamos construindo saber, conquistando autonomia. Estamos abrindo novas fronteiras para avanços na medicina, na matriz energética e na ciência, além de criar empregos de qualidade. #AgoraÉAvançar https://t.co/N6xTLUlwgM",../data/bases-completas/MichelTemer.csv,MichelTemer,Michel Temer
965960009988354048,2018-02-20 14:43:07,20-02-2018 14:43:07,Hoje é um dia muito especial para a nossa @marmilbr e para o Brasil. A entrega do primeiro submarino Riachuelo S40 é um marco para a defesa e soberania nacional. O Programa de Desenvolvimento de Submarinos (Prosub) é ambicioso e reforça a capacidade da indústria naval do Brasil. https://t.co/PXXPUumquo,../data/bases-completas/MichelTemer.csv,MichelTemer,Michel Temer
965944961819607040,2018-02-20 13:43:19,20-02-2018 13:43:19,"(AI) #AoVivo Presidente Michel Temer participa da cerimônia de início da  integração dos submarinos Classe Riachuelo, em Itaguaí (RJ). Assista:  https://t.co/SKlPIAHudV https://t.co/VuMLTU0orj",../data/bases-completas/MichelTemer.csv,MichelTemer,Michel Temer
965903689079803904,2018-02-20 10:59:19,20-02-2018 10:59:19,"Bom dia! Embarcando, agora para Itaguaí (RJ), onde vou participar da cerimônia de início da integração dos submarinos Classe Riachuelo, construídos no Brasil. Este é um momento histórico para indústria naval e a defesa nacional. @marmilbr @DefesaGovBr",../data/bases-completas/MichelTemer.csv,MichelTemer,Michel Temer
965633431156740096,2018-02-19 17:05:25,19-02-2018 17:05:25,"Em menos de dois anos o meu governo conseguiu colocar o país nos trilhos. E o mais importante, o brasileiro já está tendo seu emprego de volta. https://t.co/V0tUxmoNYm",../data/bases-completas/MichelTemer.csv,MichelTemer,Michel Temer
965633429529354240,2018-02-19 17:05:24,19-02-2018 17:05:24,"Estamos cumprindo o que foi estabelecido. Eu disse que íamos recuperar a economia do país, que o Brasil ia voltar a crescer. Pois aí está. https://t.co/V0tUxmoNYm",../data/bases-completas/MichelTemer.csv,MichelTemer,Michel Temer
965322017020039169,2018-02-18 20:27:58,18-02-2018 20:27:58,"Convidei algumas autoridades para discutir, amanhã, a intervenção na segurança pública do Rio de Janeiro e decidir os próximos passos da medida. O encontro será no Palácio da Alvorada. #BrasilPeloRio https://t.co/Q83UUMvRtI",../data/bases-completas/MichelTemer.csv,MichelTemer,Michel Temer
964969894008717312,2018-02-17 21:08:45,17-02-2018 21:08:45,"Seria intolerável continuar com a situação que está no Rio de Janeiro. Queremos que o estado, com medidas firmes e seguras, proteja os mais vulneráveis. #BrasilPeloRio https://t.co/pXuEp2YX6G",../data/bases-completas/MichelTemer.csv,MichelTemer,Michel Temer
964901762779009030,2018-02-17 16:38:01,17-02-2018 16:38:01,"Há pouco falei com a imprensa e anunciei que, em breve, criarei o Ministério Extraordinário da Segurança Pública que vai coordenar o trabalho da segurança em todo o país. #BrasilPeloRio https://t.co/lhI7e6PHAo",../data/bases-completas/MichelTemer.csv,MichelTemer,Michel Temer
964892287342989312,2018-02-17 16:00:22,17-02-2018 16:00:22,"Estamos aqui para dar início a intervenção na segurança pública do Rio de Janeiro. Combater o crime organizado é o nosso desafio. É a nossa missão. Unidos, enfrentaremos e venceremos a marginalidade que sequestra a paz do povo em nossas cidades. #BrasilPeloRio https://t.co/5Xx3wUlEvQ",../data/bases-completas/MichelTemer.csv,MichelTemer,Michel Temer
964872024769421314,2018-02-17 14:39:51,17-02-2018 14:39:51,"Agora no Rio de Janeiro conversando com representantes dos Poderes federais, estaduais e lideranças fluminenses sobre o processo de intervenção na segurança pública do estado. #BrasilPeloRio https://t.co/8EOvhz3F5y",../data/bases-completas/MichelTemer.csv,MichelTemer,Michel Temer
964602428485242881,2018-02-16 20:48:35,16-02-2018 20:48:35,"A @reinaldoazevedo, falei sobre a intervenção federal na segurança do RJ. Sabemos como o crime organizado se desenvolve e tira o sossego da população. Mas isso não será feito de um dia para o outro, o general Braga Neto fará um diagnóstico da situação para tomar medidas firmes.",../data/bases-completas/MichelTemer.csv,MichelTemer,Michel Temer
964592600098500610,2018-02-16 20:09:31,16-02-2018 20:09:31,"Boa noite! #AoVivo Participo, agora, do programa O É da Coisa, com o jornalista @reinaldoazevedo na Band FM: https://t.co/Pg7BdtVLWh",../data/bases-completas/MichelTemer.csv,MichelTemer,Michel Temer
964573756000743425,2018-02-16 18:54:39,16-02-2018 18:54:39,"Tomamos esta medida extrema porque as circunstâncias assim exigem. O governo dará respostas duras, firmes e adotará todas as providências necessárias para enfrentar e derrotar o crime organizado e as quadrilhas do RJ: https://t.co/qNNSCArUkh https://t.co/jI2kDLYpvY",../data/bases-completas/MichelTemer.csv,MichelTemer,Michel Temer
964529899087286272,2018-02-16 16:00:22,16-02-2018 16:00:22,"Estamos tomando todas as medidas necessárias para enfrentar os criminosos e suas quadrilhas. As Forças Armadas estarão unidas. Nossos presídios não serão mais escritórios de bandidos, nem nossas praças serão salão de festa para o crime organizado.",../data/bases-completas/MichelTemer.csv,MichelTemer,Michel Temer
964529896222609408,2018-02-16 16:00:22,16-02-2018 16:00:22,Acabei de decretar intervenção federal na área da segurança pública do Estado do #RiodeJaneiro. O crime organizado não pode continuar e nem pode se transformar em uma ameaça a todo o País. Temos que garantir a tranquilidade do nosso povo. E vamos fazer isso. https://t.co/hIi2FolOn8,../data/bases-completas/MichelTemer.csv,MichelTemer,Michel Temer
964522521277149184,2018-02-16 15:31:03,16-02-2018 15:31:03,(AI) #AoVivo Presidente Michel Temer assina Decreto de Intervenção na Segurança Pública do Estado do Rio de Janeiro. Assista: https://t.co/4SF8WOINbB,../data/bases-completas/MichelTemer.csv,MichelTemer,Michel Temer
964151602511843328,2018-02-15 14:57:09,15-02-2018 14:57:09,"Esse Projeto Sirius, contribuirá para que tenhamos novos medicamentos, melhores materiais para a construção civil, técnicas mais avançadas de exploração de petróleo e gás. #AgoraÉAvançar https://t.co/EsXR5MjNfA",../data/bases-completas/MichelTemer.csv,MichelTemer,Michel Temer
964151596077780999,2018-02-15 14:57:08,15-02-2018 14:57:08,"Sabemos que toda pesquisa de ponta gera efeitos que vão muito além da teoria: reverte-se em inovações para a indústria, em dinamismo para a economia, em bem-estar para a população. https://t.co/bHrKqRVGBQ",../data/bases-completas/MichelTemer.csv,MichelTemer,Michel Temer
964151593569607680,2018-02-15 14:57:07,15-02-2018 14:57:07,"O Projeto Sirius é motivo de orgulho para todos nós, brasileiros. Ele é vital não só para a ciência, mas também para o desenvolvimento do País. https://t.co/7zn9nqJlqP",../data/bases-completas/MichelTemer.csv,MichelTemer,Michel Temer
964130350078230529,2018-02-15 13:32:42,15-02-2018 13:32:42,Estou em Campinas (SP) para visitar obras do Projeto Sirius. Farei uma visita ao laboratório de luz síncroton de 4ª geração em construção dentro do Centro Nacional de Pesquisas em Energia e Materiais. https://t.co/h7NdtPLBHC,../data/bases-completas/MichelTemer.csv,MichelTemer,Michel Temer
963107401770717185,2018-02-12 17:47:52,12-02-2018 17:47:52,Não descansarei enquanto não resolver os problemas em Roraima. Não faltarão recursos e esforços necessários para solucionarmos essa questão migratória. https://t.co/5SPDBZmz2A,../data/bases-completas/MichelTemer.csv,MichelTemer,Michel Temer
963099729990123520,2018-02-12 17:17:23,12-02-2018 17:17:23,"(AI) #AoVivo Presidente da República, Michel Temer, participa de reunião com líderes políticos de Roraima. Assista: https://t.co/pYBkFpdVAi https://t.co/oAlzv6NHiS",../data/bases-completas/MichelTemer.csv,MichelTemer,Michel Temer
963075876622565382,2018-02-12 15:42:36,12-02-2018 15:42:36,"Neste momento, participo de reunião com líderes políticos de Roraima. https://t.co/jDoQaRSVxO",../data/bases-completas/MichelTemer.csv,MichelTemer,Michel Temer
961949503518658560,2018-02-09 13:06:48,09-02-2018 13:06:48,"Eu fiz do Legislativo um parceiro do governo. Por isso que nós conseguimos isso tudo que nós conseguimos até agora. E se Deus quiser, vamos conseguir também na #Previdência. Ouça a entrevista que concedi à @RdGuaibaOficial: https://t.co/YZMuqCMMl5",../data/bases-completas/MichelTemer.csv,MichelTemer,Michel Temer
961936477675511808,2018-02-09 12:15:02,09-02-2018 12:15:02,Tenho o maior orgulho da minha filha ❤️ https://t.co/s0sIzv5Kg7,../data/bases-completas/MichelTemer.csv,MichelTemer,Michel Temer
961911159518564352,2018-02-09 10:34:26,09-02-2018 10:34:26,"O Brasil está crescendo. Produção industrial crescendo, inflação e juros mais baixos. Estamos caminhando bem. Pela primeira vez no Brasil aplicamos um programa de governo, estamos aplicando tudo que apresentamos no documento ""Uma Ponte para o Futuro"". Somos um governo reformista.",../data/bases-completas/MichelTemer.csv,MichelTemer,Michel Temer
961911158201516032,2018-02-09 10:34:26,09-02-2018 10:34:26,"A reforma corta privilégios. Uma das âncoras da nossa Constituição é o princípio da igualdade e estamos promovendo isso. Quando a gente busca a igualdade, estamos não só acertando as contas públicas, mas concordando com a Constituição. #TodosPelaReforma",../data/bases-completas/MichelTemer.csv,MichelTemer,Michel Temer
961911156754583553,2018-02-09 10:34:25,09-02-2018 10:34:25,"Em entrevista à @RdGuaibaOficial, falei sobre #Previdência. A reforma é importante para o País, para os servidores públicos, aposentados e para a população. O povo já está percebendo essa importância e, se o povo quer, o Congresso ecoa a vontade da população. #TodosPelaReforma",../data/bases-completas/MichelTemer.csv,MichelTemer,Michel Temer
961903561025183744,2018-02-09 10:04:14,09-02-2018 10:04:14,Bom dia! #AoVivo agora na @RdGuaibaOficial. Acompanhe: https://t.co/Pq7FvhlKua #TodosPelaReforma,../data/bases-completas/MichelTemer.csv,MichelTemer,Michel Temer
961582768470839297,2018-02-08 12:49:32,08-02-2018 12:49:32,"Mais uma excelente notícia na economia. A inflação atingiu 0,29% em janeiro, menor valor para o mês desde a criação do Plano Real. O resultado ressalta que saímos da maior recessão da história e seguimos avançando na direção certa.",../data/bases-completas/MichelTemer.csv,MichelTemer,Michel Temer
961413131481337857,2018-02-08 01:35:27,08-02-2018 01:35:27,Me solidarizo com os gaúchos pela perda irreparável de Eva Sopher que dedicou sua vida pela cultura gaúcha e brasileira. Foi uma lutadora incansável pela preservação do Theatro São Pedro.,../data/bases-completas/MichelTemer.csv,MichelTemer,Michel Temer
961361505605378048,2018-02-07 22:10:18,07-02-2018 22:10:18,"Os bancos devem acompanhar essa redução muito significativa nos juros que tem sido feita responsavelmente pelo @BancoCentralBR. Não é um gesto de natureza populista, mas aquilo que é compatível e de acordo com as necessidades do País. https://t.co/3Pa5iuA1gC",../data/bases-completas/MichelTemer.csv,MichelTemer,Michel Temer
961341107727753222,2018-02-07 20:49:15,07-02-2018 20:49:15,"O governo fez o dever de casa e criou as condições para o @BancoCentralBR cortar os juros. Para o País, isso é um incentivo para mais investimentos, um incentivo à geração de empregos.",../data/bases-completas/MichelTemer.csv,MichelTemer,Michel Temer
961341106297372673,2018-02-07 20:49:15,07-02-2018 20:49:15,"O Brasil acaba de receber uma ótima notícia. A taxa básica de juros caiu para o menor nível da história, para 6,75% ao ano. Isso é motivo para comemorar.",../data/bases-completas/MichelTemer.csv,MichelTemer,Michel Temer
961065378280550402,2018-02-07 02:33:36,07-02-2018 02:33:36,"Acredito que o governo terá o número necessário de votos para a aprovação da reforma da #Previdência até o dia 21 de fevereiro. Independentemente da votação, o tema não sairá da pauta deste ano. Confira a íntegra da entrevista que concedi à @BandTV: https://t.co/lQTzZPIyZY https://t.co/dUg3M9kF20",../data/bases-completas/MichelTemer.csv,MichelTemer,Michel Temer
961042994081206272,2018-02-07 01:04:39,07-02-2018 01:04:39,"A compreensão de que a reforma é importante ecoou para todos os cantos e muita gente se comprometeu com ela, pois sabem que, do jeito que está, não pode mais continuar. Essa pauta é inescapável e contamos com esta aprovação para preparar o País para o futuro. #TodosPelaReforma",../data/bases-completas/MichelTemer.csv,MichelTemer,Michel Temer
961042990511853569,2018-02-07 01:04:38,07-02-2018 01:04:38,"Em entrevista à @TvBandnews destaquei que o governo pretende pautar a reforma da #Previdência, mas com a certeza de que será votada e aprovada. #TodosPelaReforma https://t.co/UOkA7p8ZOZ",../data/bases-completas/MichelTemer.csv,MichelTemer,Michel Temer
961037039092281349,2018-02-07 00:40:59,07-02-2018 00:40:59,(AI) #AoVivo Confira entrevista do presidente Michel Temer à @TvBandnews: https://t.co/l7NYMLPuRk https://t.co/P7HgUr5lFP,../data/bases-completas/MichelTemer.csv,MichelTemer,Michel Temer
961002643274465282,2018-02-06 22:24:19,06-02-2018 22:24:19,"Na entrevista ao @jornaldaband, ressaltei a importância da aprovação da reforma da #Previdência. Falei que o governo está aberto ao diálogo. Reformar é preciso. #TodosPelaReforma https://t.co/eHjRMqOlud",../data/bases-completas/MichelTemer.csv,MichelTemer,Michel Temer
960998181944295425,2018-02-06 22:06:35,06-02-2018 22:06:35,Começou a entrevista que concedi ao jornalista Caiã Messina para o @jornaldaband. Assista: https://t.co/tYPhoWx8qR https://t.co/ERmv5qBEym,../data/bases-completas/MichelTemer.csv,MichelTemer,Michel Temer
960700316093239296,2018-02-06 02:22:58,06-02-2018 02:22:58,"No programa #MarianaGodoyEntrevista, falei sobre a reforma da #Previdência e sobre os projetos previstos para 2018 no meu governo. Veja como foi: https://t.co/EsfMc5DnKQ https://t.co/vyM7L6mMve",../data/bases-completas/MichelTemer.csv,MichelTemer,Michel Temer
960690185104224256,2018-02-06 01:42:43,06-02-2018 01:42:43,Assista minha participação no programa #MarianaGodoyEntrevista: https://t.co/EsfMc5DnKQ @RedeTV https://t.co/kbTIraGI1P,../data/bases-completas/MichelTemer.csv,MichelTemer,Michel Temer
960658120681902081,2018-02-05 23:35:18,05-02-2018 23:35:18,"Editamos um decreto que dá identidade provisória para refugiados, com apoio da procuradora-geral da República, Raquel Dodge (@MPF_PGR) https://t.co/E86C04mTFG",../data/bases-completas/MichelTemer.csv,MichelTemer,Michel Temer
960636227904032769,2018-02-05 22:08:19,05-02-2018 22:08:19,"O texto que apresentamos ao Congresso foi amplamente discutido ao longo do ano de 2017. O diálogo tem sido nosso método. Fizemos ajustes para atender a preocupações
legítimas, para criar regras de transição mais suaves. Chegou a hora de tomar uma decisão. #TodosPelaReforma",../data/bases-completas/MichelTemer.csv,MichelTemer,Michel Temer
960636221868466177,2018-02-05 22:08:17,05-02-2018 22:08:17,"A reforma da #Previdência é questão-chave para o futuro do Brasil. Em mensagem ao Congresso Nacional, pela abertura do ano legislativo, ressaltei que as mudanças combatem desigualdades e protegem os mais pobres. #TodosPelaReforma",../data/bases-completas/MichelTemer.csv,MichelTemer,Michel Temer
960580690495631360,2018-02-05 18:27:37,05-02-2018 18:27:37,É dever do governo colocar a evolução tecnológica a serviço do cidadão. É o que fizemos hoje com o lançamento do piloto do Documento Nacional de Identificação (#DNI): https://t.co/1ypST1yf0T https://t.co/qcatMycFUJ,../data/bases-completas/MichelTemer.csv,MichelTemer,Michel Temer
960505011267653632,2018-02-05 13:26:54,05-02-2018 13:26:54,Vamos poder acessar o #DNI pelo celular e a biometria nos dará toda a segurança. Quero cumprimentar todos os órgãos que se empenham para tornar o DNI realidade. Com ele o Brasil entra na vanguarda da identificação digital.,../data/bases-completas/MichelTemer.csv,MichelTemer,Michel Temer
960504911325810688,2018-02-05 13:26:30,05-02-2018 13:26:30,O Brasil se moderniza com o lançamento do Documento Nacional de Identidade. O #DNI vai concentrar vários documentos num só. Com menos papel a nossa vida ficará mais fácil. https://t.co/AExhzWRrTk,../data/bases-completas/MichelTemer.csv,MichelTemer,Michel Temer
960498997717856256,2018-02-05 13:03:00,05-02-2018 13:03:00,(AI) #AoVivo Presidente Michel Temer participa do lançamento do Documento Nacional de Identificação (Digital e Biométrico). Assista: https://t.co/Rbb6VgfUh0,../data/bases-completas/MichelTemer.csv,MichelTemer,Michel Temer
959555820865445888,2018-02-02 22:35:10,02-02-2018 22:35:10,"Durante minha participação no programa #RedeTVNews, expliquei que as medidas como o teto de gastos, a modernização trabalhista e a reforma do ensino médio trouxeram transformações para o País. E para continuar este trabalho, estamos nos dedicando em consertar a #Previdência. https://t.co/1UpWmwjHDU",../data/bases-completas/MichelTemer.csv,MichelTemer,Michel Temer
959540889331945472,2018-02-02 21:35:50,02-02-2018 21:35:50,(AI) Presidente Michel Temer concede entrevista ao #RedeTVNews (@RedeTV). Acompanhe: https://t.co/fuFtC0RvFh https://t.co/A8Yr77mBcZ,../data/bases-completas/MichelTemer.csv,MichelTemer,Michel Temer
959526426570575872,2018-02-02 20:38:21,02-02-2018 20:38:21,O que nós estamos fazendo hoje é uma reforma até razoavelmente suave em favor dos aposentados e daqueles que irão se aposentar. #Previdência https://t.co/tr7ZsSrBtx,../data/bases-completas/MichelTemer.csv,MichelTemer,Michel Temer
959443399253413888,2018-02-02 15:08:26,02-02-2018 15:08:26,"Este é nosso compromisso: fazer o Brasil avançar em todas as frentes, com atos que sejam úteis para o povo brasileiro. E é com esse objetivo que agora estamos empenhados em salvar a Previdência Social. Conto com o apoio de todos. https://t.co/hUlWrmw5tT",../data/bases-completas/MichelTemer.csv,MichelTemer,Michel Temer
959443384174809093,2018-02-02 15:08:23,02-02-2018 15:08:23,"A transposição do São Francisco é um sonho antigo e estamos transformando esse sonho em realidade. Agora, damos mais um passo decisivo para a conclusão do Eixo Norte, que beneficiará não só Pernambuco e a Paraíba, mas também o Ceará e o Rio Grande do Norte. https://t.co/VrRnsGudmV",../data/bases-completas/MichelTemer.csv,MichelTemer,Michel Temer
959435603606687749,2018-02-02 14:37:28,02-02-2018 14:37:28,(AI) #AoVivo Presidente Michel Temer entrega a 2ª Estação de Bombeamento  do Eixo Norte do Projeto de Integração do Rio São Francisco. Acompanhe:  https://t.co/n3NY1t2P0E #AgoraÉAvançar,../data/bases-completas/MichelTemer.csv,MichelTemer,Michel Temer
959425138734313473,2018-02-02 13:55:52,02-02-2018 13:55:52,"No mirante da Estação, acionei o funcionamento do mecanismo de bombeamento de água. Essa obra vai facilitar a chegada das águas do Rio São Francisco até o interior do Ceará. #AgoraéAvançar https://t.co/PgZQR4SDTo",../data/bases-completas/MichelTemer.csv,MichelTemer,Michel Temer
959423098259935232,2018-02-02 13:47:46,02-02-2018 13:47:46,Estou em Cabrobó (PE) para inaugurar a segunda Estação de Bombeamento do  Eixo Norte do Projeto de Integração do São Francisco. #AgoraÉAvançar https://t.co/a3KjKThQf0,../data/bases-completas/MichelTemer.csv,MichelTemer,Michel Temer
959385405744451585,2018-02-02 11:17:59,02-02-2018 11:17:59,"Em entrevista à @RadioJornalAMFM, falei sobre a reforma da #Previdência, a inauguração da segunda Estação de Bombeamento do Projeto de Integração do São Francisco, que acontece hoje em Cabrobó (PE) e também sobre o @bolsafamilia. https://t.co/dnAfG5HNYA",../data/bases-completas/MichelTemer.csv,MichelTemer,Michel Temer
959370627047182336,2018-02-02 10:19:16,02-02-2018 10:19:16,Acompanhe #aovivo minha participação no programa de @geraldofreirePE https://t.co/uL1UW1sFCE,../data/bases-completas/MichelTemer.csv,MichelTemer,Michel Temer
959078978807091201,2018-02-01 15:00:22,01-02-2018 15:00:22,"Estou certo de que neste ano o @governodobrasil e a @Caixa estarão ainda mais juntos, inspirados por uma visão que articula crescimento econômico e responsabilidade social.",../data/bases-completas/MichelTemer.csv,MichelTemer,Michel Temer
959078972821852161,2018-02-01 15:00:20,01-02-2018 15:00:20,"A @Caixa é fundamental para levar adiante operações de enorme complexidade, como a liberação do saque de contas inativas do #FGTS e o “Avançar, Parcerias”, uma das principais iniciativas do nosso governo para modernizar a infraestrutura do País. https://t.co/grpfwTxeZu",../data/bases-completas/MichelTemer.csv,MichelTemer,Michel Temer
959078953255428097,2018-02-01 15:00:15,01-02-2018 15:00:15,"Sobre o ângulo social, o #MinhaCasaMinhaVida tem uma importância extraordinária, além de prestigiar a construção civil, setor que mais emprega.",../data/bases-completas/MichelTemer.csv,MichelTemer,Michel Temer
959078948251602949,2018-02-01 15:00:14,01-02-2018 15:00:14,Nosso governo conta com a parceria da @Caixa para recolocar o País no rumo do desenvolvimento. São vários programas governamentais implementados que trazem crescimento para o País e mudam a vida do cidadão. https://t.co/bdOmivfqoF,../data/bases-completas/MichelTemer.csv,MichelTemer,Michel Temer
958844744741916672,2018-01-31 23:29:36,31-01-2018 23:29:36,"As riquezas do subsolo estão sendo efetivamente colocadas a serviço do desenvolvimento do País e do bem-estar dos brasileiros, o que vai melhorar a prestação de serviços públicos e alavancar a economia. https://t.co/I2vAKYzEU9",../data/bases-completas/MichelTemer.csv,MichelTemer,Michel Temer
958771825391042560,2018-01-31 18:39:50,31-01-2018 18:39:50,A @Petrobras reconquistou a liberdade de escolher onde operar. Nossa maior empresa estatal voltou a nos orgulhar.,../data/bases-completas/MichelTemer.csv,MichelTemer,Michel Temer
958771587372716032,2018-01-31 18:38:54,31-01-2018 18:38:54,O sucesso dos últimos leilões de petróleo foi resultado do trabalho do @governodobrasil e do Congresso para consertar o marco regulatório. Nossa agenda de reformas trouxe de volta a confiança na economia e o Brasil voltou a despertar o interesse de grandes empresas do setor.,../data/bases-completas/MichelTemer.csv,MichelTemer,Michel Temer
958771154076004352,2018-01-31 18:37:10,31-01-2018 18:37:10,A assinatura dos contratos de concessões de áreas do pré-sal faz com que nossas riquezas sejam efetivamente colocadas a serviço do desenvolvimento do País e do bem-estar dos brasileiros. https://t.co/oag9OLP7Oo,../data/bases-completas/MichelTemer.csv,MichelTemer,Michel Temer
958758346315763712,2018-01-31 17:46:17,31-01-2018 17:46:17,(AI) #AoVivo Presidente Michel Temer discursa na solenidade de assinatura dos contratos de concessões de áreas do pré-sal: https://t.co/AaicHMzxw8 #AgoraéAvançarParcerias https://t.co/okgKodmhC8,../data/bases-completas/MichelTemer.csv,MichelTemer,Michel Temer
958751862404145152,2018-01-31 17:20:31,31-01-2018 17:20:31,(AI) Acompanhe #AoVivo a solenidade de assinatura dos contratos de concessões de áreas do pré-sal:  https://t.co/AaicHMzxw8 #AgoraéAvançarParcerias,../data/bases-completas/MichelTemer.csv,MichelTemer,Michel Temer
958458465705488392,2018-01-30 21:54:40,30-01-2018 21:54:40,"A reforma da #Previdência acaba com privilégios. Quem ganha um, dois ou três salários mínimos não terá nenhuma alteração na aposentadoria, assim como trabalhadores rurais e pessoas com deficiência. #ProgramadoRatinho @ratinhodosbt https://t.co/P9qrYDlxFv",../data/bases-completas/MichelTemer.csv,MichelTemer,Michel Temer
958354521276796928,2018-01-30 15:01:37,30-01-2018 15:01:37,O Brasil tem muito a comemorar pelo desempenho da nossa agricultura no ano passado: safra recorde de mais de 240 milhões de toneladas em grãos; crescimento de 17% nas exportações agrícolas; e saldo histórico em nossa balança comercial de 67 bilhões de dólares.,../data/bases-completas/MichelTemer.csv,MichelTemer,Michel Temer
