id,datetime,created_at,text,file,twitter_handle,name
943570047158702080,2017-12-20 19:53:24,20-12-2017 19:53:24,"Celebramos hoje mais um marco para a #educação em nosso País. Após um ano e meio de esforço concentrado, de diálogo intenso com a sociedade, estamos oferecendo a nossos estudantes, professores, pais e gestores públicos uma Base Curricular Comum para todo o Brasil. #EducaçãoéBase https://t.co/mZ6q4pNdPV",../data/bases-completas/MichelTemer.csv,MichelTemer,Michel Temer
943550507410444288,2017-12-20 18:35:45,20-12-2017 18:35:45,(AI) #AoVivo Presidente Michel Temer participa de cerimônia de homologação da Base Nacional Comum Curricular. Assista: https://t.co/wJZcX5O9hV,../data/bases-completas/MichelTemer.csv,MichelTemer,Michel Temer
943466832656261121,2017-12-20 13:03:16,20-12-2017 13:03:16,Hoje é com certeza um grande dia. Mais de 20 mil famílias estão realizando o sonho de conquistar a casa própria. #MCMV #AgoraÉAvançar @planalto @governodobrasil https://t.co/jCioOAalhZ,../data/bases-completas/MichelTemer.csv,MichelTemer,Michel Temer
943462111304396801,2017-12-20 12:44:30,20-12-2017 12:44:30,"Fizemos muito e faremos ainda mais. Temos pela frente a tarefa incontornável de consertar a Previdência. Nossa proposta é clara: queremos acabar com os privilégios que fazem da #Previdência, hoje, um mecanismo de concentração de renda. #JuntosFazemos #JuntosFaremos",../data/bases-completas/MichelTemer.csv,MichelTemer,Michel Temer
943462109911896064,2017-12-20 12:44:30,20-12-2017 12:44:30,"Encontrei muitas obras enterradas no meu governo e desenterrei todas. E isso dá muitos efeitos positivos, como emprego e melhora econômica. Em 2018 vamos nos dedicar ao saneamento. Quando investimos no saneamento, estamos investindo na saúde. #AgoraÉAvançar",../data/bases-completas/MichelTemer.csv,MichelTemer,Michel Temer
943462108452311042,2017-12-20 12:44:29,20-12-2017 12:44:29,"Os contratos celebrados hoje simbolizam a sólida parceria que o governo federal tem construído com Estados e Municípios. Parceria que se traduz em benefícios concretos para a população. Neste caso, para a população do Paraná. #AgoraÉAvançar",../data/bases-completas/MichelTemer.csv,MichelTemer,Michel Temer
943451658834661377,2017-12-20 12:02:58,20-12-2017 12:02:58,(AI) #AoVivo Presidente Michel Temer participa neste momento da solenidade de Assinatura de Contratos – Programa Saneamento para Todos (Sanepar): https://t.co/bt0W7mPCzi #AgoraÉAvançar @Caixa https://t.co/RPUFvkiII1,../data/bases-completas/MichelTemer.csv,MichelTemer,Michel Temer
943238902244171777,2017-12-19 21:57:33,19-12-2017 21:57:33,"Ano passado eu prometi fazer a revisão do Recine, o audiovisual, e nós realizamos. E agora, eu quero prometer ao Sérgio na presença de vocês, que vou reverificar o orçamento para a #Cultura, para aumentar o valor. https://t.co/LEgACCAMcB",../data/bases-completas/MichelTemer.csv,MichelTemer,Michel Temer
943238806999846912,2017-12-19 21:57:10,19-12-2017 21:57:10,"@planalto A valorização da economia criativa é parte de nosso esforço maior de modernização do Brasil. Estamos trazendo o País para o século 21. Ao longo de 19 meses, já avançamos muito. Os resultados já se fazem sentir. https://t.co/YeM1Mit7s8",../data/bases-completas/MichelTemer.csv,MichelTemer,Michel Temer
943238595460116480,2017-12-19 21:56:20,19-12-2017 21:56:20,A cerimônia da Ordem do Mérito Cultural sempre traz alegria ao @planalto. Estamos todos energizados pela belíssima apresentação do Galo da Madrugada. E é isso que nos motiva a trabalhar cada vez mais pelo nosso País. https://t.co/o8sEg9d0Mv,../data/bases-completas/MichelTemer.csv,MichelTemer,Michel Temer
943206760277577728,2017-12-19 19:49:50,19-12-2017 19:49:50,(AI) #AoVivo Presidente Michel Temer participa da cerimônia de entrega da Ordem do Mérito Cultural 2017. Assista: https://t.co/6jQiMUC1VO @CulturaGovBr,../data/bases-completas/MichelTemer.csv,MichelTemer,Michel Temer
943118447646531585,2017-12-19 13:58:54,19-12-2017 13:58:54,"@PMDB_Nacional Assumi a presidência não pela minha vontade, mas pela força e presença do #MDB na política nacional. Nós estamos tendo a coragem de ser um governo reformista. A esperança voltou e com a aprovação da reforma da #Previdência, os empregos voltarão com mais força. #JuntosFaremos https://t.co/zvWsfast2V",../data/bases-completas/MichelTemer.csv,MichelTemer,Michel Temer
943110850755399680,2017-12-19 13:28:43,19-12-2017 13:28:43,"@PMDB_Nacional (AI) Presidente Michel Temer fala sobre importância das reformas, o controle de gastos, a geração de empregos com a modernização trabalhista e a reforma do ensino médio. Acompanhe #AoVivo: https://t.co/xalyxiP5fn",../data/bases-completas/MichelTemer.csv,MichelTemer,Michel Temer
943110031532331008,2017-12-19 13:25:28,19-12-2017 13:25:28,(AI) #AoVivo Presidente Michel Temer participa da Convenção Nacional do #PMDB. Assista: https://t.co/xalyxiP5fn https://t.co/B5HUnvOGcF,../data/bases-completas/MichelTemer.csv,MichelTemer,Michel Temer
942904713535787010,2017-12-18 23:49:36,18-12-2017 23:49:36,"(AI) Presidente Temer: a reforma da #Previdência é em benefício do País, especialmente dos mais carentes: https://t.co/im7cU29PeH https://t.co/0En68Wi99t",../data/bases-completas/MichelTemer.csv,MichelTemer,Michel Temer
942872736648650754,2017-12-18 21:42:32,18-12-2017 21:42:32,"São medidas que simplificam a vida das empresas, que retiram amarras do crescimento, que ajudam a criar empregos. O próximo passo é consertar a #Previdência. Contamos com o apoio dos prefeitos, deputados, senadores, que conhecem bem a importância dessa reforma. https://t.co/1pK63NcvZT",../data/bases-completas/MichelTemer.csv,MichelTemer,Michel Temer
942872734056493056,2017-12-18 21:42:32,18-12-2017 21:42:32,"Isso fortalece a Federação, permite que os benefícios da mineração cheguem aos brasileiros de forma mais equânime. A sanção de hoje é parte do que tenho chamado de agenda da produtividade. https://t.co/3Pb20Sx6lo",../data/bases-completas/MichelTemer.csv,MichelTemer,Michel Temer
942872731690954752,2017-12-18 21:42:31,18-12-2017 21:42:31,"É uma grata satisfação sancionar as novas regras sobre os royalties para o setor mineral. Agora, todos os municípios de algum modo envolvidos na atividade mineradora, e não apenas os municípios produtores, receberão royalties: https://t.co/rb4YKsxlKW https://t.co/TnGiAVa8yK",../data/bases-completas/MichelTemer.csv,MichelTemer,Michel Temer
942852830246981632,2017-12-18 20:23:26,18-12-2017 20:23:26,(AI) #AoVivo Presidente Michel Temer sanciona lei que altera a compensação financeira pela exploração de recursos minerais. Assista: https://t.co/FjB5pID4IG https://t.co/drhbuY2wNf,../data/bases-completas/MichelTemer.csv,MichelTemer,Michel Temer
942842297800159232,2017-12-18 19:41:35,18-12-2017 19:41:35,"Acabo de conversar ao telefone com o Presidente eleito do Chile, @sebastianpinera, para cumprimentá-lo pela vitória e desejar pleno êxito. O Brasil e o #Chile são países amigos, que têm excelentes relações. Trabalharemos juntos para fortalecê-las ainda mais.",../data/bases-completas/MichelTemer.csv,MichelTemer,Michel Temer
942827603425222656,2017-12-18 18:43:12,18-12-2017 18:43:12,"Nesse e em outros tantos temas, pudemos sempre contar com a valiosa contribuição da bancada feminina no Congresso Nacional. A igualdade entre homens e mulheres é uma causa de todos nós.",../data/bases-completas/MichelTemer.csv,MichelTemer,Michel Temer
942827601848135680,2017-12-18 18:43:11,18-12-2017 18:43:11,"Há duas semanas, nesta mesma sala, lançamos a Rede #BrasilMulher. Vamos unir o governo, as empresas e a sociedade em ações concretas de promoção da autonomia econômica da mulher e de sua plena participação na vida pública.",../data/bases-completas/MichelTemer.csv,MichelTemer,Michel Temer
942827598631112704,2017-12-18 18:43:11,18-12-2017 18:43:11,"A verdade é que a participação feminina na @marmilbr vem se consolidando cada vez mais nos últimos anos. Na semana passada, tive o prazer de me dirigir às doze Guardas-Marinha que concluíram a Escola Naval em minha mensagem aos que se formavam. https://t.co/NBYuYaF7si",../data/bases-completas/MichelTemer.csv,MichelTemer,Michel Temer
942827596244508672,2017-12-18 18:43:10,18-12-2017 18:43:10,"Estamos abrindo novos caminhos, ampliando as possibilidades de participação da mulher na @marmilbr. Estamos dando mais escolhas às mulheres que já dedicam suas vidas a servir à Pátria nos diferentes quadros da Marinha. https://t.co/A5MfneuiN7",../data/bases-completas/MichelTemer.csv,MichelTemer,Michel Temer
942818113892077568,2017-12-18 18:05:29,18-12-2017 18:05:29,"(AI) #AoVivo Presidente Michel Temer sanciona o PLC 147/2017, que reestrutura os quadros de Oficiais e de Praças da Marinha: https://t.co/EXWUSIswed",../data/bases-completas/MichelTemer.csv,MichelTemer,Michel Temer
942790704929099777,2017-12-18 16:16:34,18-12-2017 16:16:34,"Desejo a nossos militares, e a suas famílias, um feliz Natal, um feliz Ano Novo. Façamos de 2018 mais um ano decisivo para a construção do Brasil de prosperidade e justiça que todos queremos. #JuntosFazemos https://t.co/fJPo62Y4kj",../data/bases-completas/MichelTemer.csv,MichelTemer,Michel Temer
942790702903320576,2017-12-18 16:16:34,18-12-2017 16:16:34,"O lançamento de nosso primeiro satélite geoestacionário também é marco a ser celebrado. O satélite fortalece a segurança nacional, amplia o alcance de nossas telecomunicações e vai levar a banda larga para todos os rincões do País.",../data/bases-completas/MichelTemer.csv,MichelTemer,Michel Temer
942790701439488001,2017-12-18 16:16:34,18-12-2017 16:16:34,"Têm sido expressivos os resultados alcançados por nossos militares, no Programa de Proteção Integrada das Fronteiras. No Haiti, concluiu-se, depois de 13 anos, a MINUSTAH. O Brasil liderou a Missão de forma exemplar. Nossas tropas podem e devem orgulhar-se do dever cumprido.",../data/bases-completas/MichelTemer.csv,MichelTemer,Michel Temer
942790698469818368,2017-12-18 16:16:33,18-12-2017 16:16:33,"Este foi um ano de muito trabalho e muitas realizações. E não posso deixar de registrar algumas das realizações das Forças Armadas no decorrer de 2017, na defesa de nossa soberania territorial, na participação em missões de paz, no desenvolvimento de novas tecnologias. https://t.co/48JfNUqZjM",../data/bases-completas/MichelTemer.csv,MichelTemer,Michel Temer
942769457251921920,2017-12-18 14:52:09,18-12-2017 14:52:09,(AI) #AoVivo Presidente Michel Temer participa de cerimônia de apresentação dos Oficiais-Generais promovidos. Assista: https://t.co/DOv6ikWDcZ https://t.co/011sXdcY8o,../data/bases-completas/MichelTemer.csv,MichelTemer,Michel Temer
942759344541663233,2017-12-18 14:11:58,18-12-2017 14:11:58,Quem for candidato a Presidente da República e disser que terá também um governo de reformas estará gravando na sua campanha o programa Temer. Programa com o qual ousamos fazer uma revolução político-administrativo-econômica no nosso País. https://t.co/hHKwOMmMoX,../data/bases-completas/MichelTemer.csv,MichelTemer,Michel Temer
942759342050365443,2017-12-18 14:11:57,18-12-2017 14:11:57,"Estamos mudando o Brasil com a ousadia, a coragem e a inovação do #PMDB. Partido que se renova nas suas concepções. https://t.co/AXrRvkY9sC",../data/bases-completas/MichelTemer.csv,MichelTemer,Michel Temer
942759338241875969,2017-12-18 14:11:56,18-12-2017 14:11:56,"Quando assumimos o governo, levamos imediatamente adiante o programa Uma #PonteParaOFuturo, documento que traçou metas importantes para retomada do crescimento do País. https://t.co/mHcmiFNj3W",../data/bases-completas/MichelTemer.csv,MichelTemer,Michel Temer
942725736317833216,2017-12-18 11:58:25,18-12-2017 11:58:25,(AI) #AoVivo Presidente Michel Temer participa da abertura do encontro de comemoração aos 10 anos do Programa de Educação à Distância da @fugnacional. Assista: https://t.co/MpDHkJkmwc https://t.co/Jo4KX4MEe4,../data/bases-completas/MichelTemer.csv,MichelTemer,Michel Temer
941787297913167872,2017-12-15 21:49:24,15-12-2017 21:49:24,"(AI) Vamos aprovar a reforma da #Previdência no Congresso, diz presidente Michel Temer em posse de Marun: https://t.co/mdIasTkmgw https://t.co/VDGkl1oVy5",../data/bases-completas/MichelTemer.csv,MichelTemer,Michel Temer
941772334809182209,2017-12-15 20:49:56,15-12-2017 20:49:56,"Resultado dos leilões mostra confiança do investidor no modelo regulatório e no Brasil. Vão ser gerados mais de 17 mil empregos diretos. E os consumidores vão ser beneficiados com uma economia de bilhões de reais, ao longo dos 30 anos de validade da outorga.",../data/bases-completas/MichelTemer.csv,MichelTemer,Michel Temer
941772333043388416,2017-12-15 20:49:56,15-12-2017 20:49:56,"Leilão de linhas de transmissão vai garantir investimentos de quase R$ 9 bilhões. Foram arrematados 11 lotes em 10 estados - Bahia, Ceará, Minas Gerais, Pará, Paraíba, Pernambuco, Piauí, Rio Grande do Norte e Tocantins: https://t.co/k2xeExtmcJ",../data/bases-completas/MichelTemer.csv,MichelTemer,Michel Temer
941732274541907968,2017-12-15 18:10:45,15-12-2017 18:10:45,"Contando com o trabalho do ministro Marun, eu digo: nós vamos aprovar a reforma da #Previdência no Congresso. Está é uma questão de Estado, que conserta o País hoje para quem vai gerir o Brasil no futuro. Já há a compreensão de que se trata de uma questão de justiça. https://t.co/78eDnd48HR",../data/bases-completas/MichelTemer.csv,MichelTemer,Michel Temer
941732272180523009,2017-12-15 18:10:44,15-12-2017 18:10:44,"Como deputado, Carlos Marun já deu prova cabal de sua capacidade de construir pontes, de aproximar perspectivas. Na Secretaria de Governo, assegurará a continuidade da relação de respeito e harmonia entre o Executivo e o Legislativo. https://t.co/l6PCVGf7kd",../data/bases-completas/MichelTemer.csv,MichelTemer,Michel Temer
941732269437353985,2017-12-15 18:10:44,15-12-2017 18:10:44,"Foi um imenso privilégio contar com a habilidade, a serenidade, a eficácia do ministro @aimbassahy neste ano de 2017. Essas mesmas qualidades continuarão a serviço do Brasil, agora novamente no Congresso Nacional. https://t.co/6s7ovHGQTX",../data/bases-completas/MichelTemer.csv,MichelTemer,Michel Temer
941718895949504512,2017-12-15 17:17:35,15-12-2017 17:17:35,(AI) #AoVivo Presidente Michel Temer empossa o deputado Carlos Marun como ministro-chefe da Secretaria de Governo. Assista: https://t.co/w9dhD9bgza,../data/bases-completas/MichelTemer.csv,MichelTemer,Michel Temer
941677179653509125,2017-12-15 14:31:49,15-12-2017 14:31:49,"Já estou de volta ao trabalho, com toda disposição. Hoje, ás 15h, dou posse ao deputado Carlos Marun como ministro-chefe da Secretaria de Governo.",../data/bases-completas/MichelTemer.csv,MichelTemer,Michel Temer
941076521749483520,2017-12-13 22:45:01,13-12-2017 22:45:01,"(AI) Em evento com prefeitos, Temer reforça a necessidade de aprovação das novas regras de aposentadoria: https://t.co/JvPuDd1N6G https://t.co/f2ZTVZyfar",../data/bases-completas/MichelTemer.csv,MichelTemer,Michel Temer
941042530916986880,2017-12-13 20:29:57,13-12-2017 20:29:57,"(AI) Com reforma, Brasil vai evitar desastre similar à Grécia e Portugal, diz presidente Temer: https://t.co/4Bfs2y2Ah7 https://t.co/rrs3k1DnDG",../data/bases-completas/MichelTemer.csv,MichelTemer,Michel Temer
940943454896574466,2017-12-13 13:56:16,13-12-2017 13:56:16,"Estamos liberando R$ 2 bilhões para as prefeituras até o fim do mês. Se a economia continuar a crescer, nós repetiremos a dose para as prefeituras no ano que vem. Aprovando a reforma da #Previdência nós vamos continuar a ajudar os municípios. https://t.co/TMNSR2gmBT",../data/bases-completas/MichelTemer.csv,MichelTemer,Michel Temer
940943451834679296,2017-12-13 13:56:15,13-12-2017 13:56:15,Os prefeitos que estão aqui sabem melhor que ninguém que sem a reforma da #Previdência muitos benefícios serão prejudicados. A reforma é mais em benefício dos estados e municípios. Ela compõe o novo pacto federativo que fizemos quando assumi o governo. https://t.co/mLt2TloxRh,../data/bases-completas/MichelTemer.csv,MichelTemer,Michel Temer
940943449196548097,2017-12-13 13:56:14,13-12-2017 13:56:14,A economia cresceu pela ousadia do nosso governo. Nós fizemos com que as reformas saíssem do papel. Uma delas é a reforma da #Previdência. E ela é fundamental para o equilíbrio das contas dos municípios. https://t.co/h0qvUgBnTe,../data/bases-completas/MichelTemer.csv,MichelTemer,Michel Temer
940929199728201728,2017-12-13 12:59:37,13-12-2017 12:59:37,(AI) #AoVivo Presidente Michel Temer se reúne com a Confederação Nacional de Municípios. Assista: https://t.co/mACKThUQkN @portalcnm,../data/bases-completas/MichelTemer.csv,MichelTemer,Michel Temer
940753057654112257,2017-12-13 01:19:41,13-12-2017 01:19:41,"(AI) A empresários, Temer destaca movimento pela Previdência: ""A hora é agora"": https://t.co/1ttckuNOuj https://t.co/w3RLy7lNyq",../data/bases-completas/MichelTemer.csv,MichelTemer,Michel Temer
940726117643714565,2017-12-12 23:32:38,12-12-2017 23:32:38,"(AI) Agro Mais Integridade vai aumentar a eficiência do agronegócio brasileiro, diz presidente Temer: https://t.co/ugZJfH5IQI https://t.co/y0HUdgYbw5",../data/bases-completas/MichelTemer.csv,MichelTemer,Michel Temer
940715752679755778,2017-12-12 22:51:27,12-12-2017 22:51:27,(AI) Presidente Temer diz que voto contrário à reforma da #Previdência favorece privilegiados: https://t.co/kR4aIAcIgg https://t.co/WZ8RBRioMp,../data/bases-completas/MichelTemer.csv,MichelTemer,Michel Temer
940709215441694720,2017-12-12 22:25:29,12-12-2017 22:25:29,(AI) Michel Temer recebe o presidente da Macedônia e defende aumento do comércio bilateral: https://t.co/gJG8oDzuz5 https://t.co/xZjDASgIvb,../data/bases-completas/MichelTemer.csv,MichelTemer,Michel Temer
940699923842035712,2017-12-12 21:48:33,12-12-2017 21:48:33,"Não existe candidato ao Senado, candidato ao governo do seu estado, candidato a deputado federal, candidato à Presidência da República em 2018 que não será questionado sobre a reforma da #Previdência, se é a favor ou contra, se ela não for votada agora.",../data/bases-completas/MichelTemer.csv,MichelTemer,Michel Temer
940699870284910593,2017-12-12 21:48:21,12-12-2017 21:48:21,"Quem vota contra a reforma da #Previdência tem que assumir o seu motivo. Tem que justificar sua posição. E hoje depois de toda a discussão, quem é contra só pode ter uma explicação: é a favor da manutenção dos privilégios.",../data/bases-completas/MichelTemer.csv,MichelTemer,Michel Temer
940699836315205633,2017-12-12 21:48:12,12-12-2017 21:48:12,Reuni líderes empresariais de todo o País para pedir apoio de seus setores para a reforma da #Previdência. A economia começou a dar um salto extraordinário e os resultados vieram rapidamente. Nós precisamos fazer esta reforma já. https://t.co/pU68stii0v,../data/bases-completas/MichelTemer.csv,MichelTemer,Michel Temer
940673791545561088,2017-12-12 20:04:43,12-12-2017 20:04:43,(AI) #AoVivo Presidente Michel Temer se reúne com líderes empresariais para falar sobre reforma da #Previdência. Assista: https://t.co/CQVhsCSCes https://t.co/L3POCGGztQ,../data/bases-completas/MichelTemer.csv,MichelTemer,Michel Temer
940665773596528642,2017-12-12 19:32:51,12-12-2017 19:32:51,"(AI) Para Michel Temer, sucesso da agropecuária significa a prosperidade do Brasil: https://t.co/g7uilxyVDE https://t.co/x1VO8CRN8P",../data/bases-completas/MichelTemer.csv,MichelTemer,Michel Temer
940660537607839745,2017-12-12 19:12:03,12-12-2017 19:12:03,"@Min_Agricultura São muitas as nossas iniciativas para transformar o Estado brasileiro, para torná-lo mais moderno e mais justo. A verdade é que o Brasil não tolera mais um Estado que funcione a favor de uns poucos, em detrimento da maioria. É isso que nos anima a consertar a #Previdência. https://t.co/Lbki74sqyz",../data/bases-completas/MichelTemer.csv,MichelTemer,Michel Temer
940660449573564416,2017-12-12 19:11:42,12-12-2017 19:11:42,"Hoje damos mais um passo para aprimorar o ambiente institucional do agronegócio, para torná-lo ainda mais eficiente. O Agro Mais Integridade tem a adesão do setor privado. É uma aliança por transparência, e que aperfeiçoa mecanismos de controle do próprio @Min_Agricultura. https://t.co/TvvfyOZIu5",../data/bases-completas/MichelTemer.csv,MichelTemer,Michel Temer
940648768684396544,2017-12-12 18:25:17,12-12-2017 18:25:17,(AI) #AoVivo Presidente Michel Temer lança o Plano Agro Mais Integridade. Assista: https://t.co/CJtBGkhd0N https://t.co/6yyOelCe5q,../data/bases-completas/MichelTemer.csv,MichelTemer,Michel Temer
940595788610195457,2017-12-12 14:54:46,12-12-2017 14:54:46,"(AI) Em encontro bilateral, presidentes do Brasil 🇧🇷e da Macedônia🇲🇰 discutem o fortalecimento das relações diplomáticas: https://t.co/HYzgxLgjpi https://t.co/k6f26kMg5o",../data/bases-completas/MichelTemer.csv,MichelTemer,Michel Temer
940589726897238017,2017-12-12 14:30:40,12-12-2017 14:30:40,"(AI) #AoVivo Michel Temer recebe o presidente da Macedônia, Gjorge Ivanov. Em seguida, terão encontro bilateral. Assista: https://t.co/C72QsJ4com https://t.co/upVm9vdj1C",../data/bases-completas/MichelTemer.csv,MichelTemer,Michel Temer
940572796522061826,2017-12-12 13:23:24,12-12-2017 13:23:24,"@SistemaCNA A hora é de mobilização em torno de um objetivo que tem que ser de todos nós, governo e sociedade: garantir uma #Previdência mais justa, mais equilibrada e que não obrigue o pobre a pagar pela aposentadoria do rico.",../data/bases-completas/MichelTemer.csv,MichelTemer,Michel Temer
940572709850898432,2017-12-12 13:23:03,12-12-2017 13:23:03,"@SistemaCNA Não vamos descansar um só instante em nosso esforço de modernização do País. Agora, a próxima etapa é consertar a #Previdência. Com a reforma, teremos um novo Brasil, de mais crescimento, de mais emprego, de mais igualdade.",../data/bases-completas/MichelTemer.csv,MichelTemer,Michel Temer
940572669459730433,2017-12-12 13:22:54,12-12-2017 13:22:54,"@SistemaCNA Estamos fazendo o que o Brasil precisa e, para isso, é preciso passar pela agricultura e pela pecuária, que fortalecem a economia nacional.  Aproveito para dizer-lhes que nosso governo segue empenhadíssimo na agenda de reformas, sempre em diálogo com o Congresso Nacional.",../data/bases-completas/MichelTemer.csv,MichelTemer,Michel Temer
940565217066602496,2017-12-12 12:53:17,12-12-2017 12:53:17,(AI) #AoVivo Presidente Michel Temer participa da cerimônia de posse da nova Diretoria do @SistemaCNA. Assista: https://t.co/nxTf2L9wUJ https://t.co/DuMaJmghek,../data/bases-completas/MichelTemer.csv,MichelTemer,Michel Temer
939993467513688064,2017-12-10 23:01:21,10-12-2017 23:01:21,(AI) Michel Temer defende multilateralismo no comércio mundial e o papel da OMC como mediadora entre os países: https://t.co/QPEa3pst6l @wto https://t.co/mDGRuVbBjR,../data/bases-completas/MichelTemer.csv,MichelTemer,Michel Temer
939973678397362176,2017-12-10 21:42:43,10-12-2017 21:42:43,(AI) Presidente Temer assina declaração para fortalecer compromisso com o comércio multilateral. Confira a íntegra: https://t.co/8XE1blrwJ5 https://t.co/wHLu5ljvmJ,../data/bases-completas/MichelTemer.csv,MichelTemer,Michel Temer
939961772630474753,2017-12-10 20:55:24,10-12-2017 20:55:24,"É com grande satisfação que venho a Buenos Aires para esta sessão de abertura da Conferência Ministerial da OMC (@wto). Quero transmitir uma mensagem inequívoca de abertura, de diálogo e de fortalecimento do multilateralismo. https://t.co/DfEuOxz6mD",../data/bases-completas/MichelTemer.csv,MichelTemer,Michel Temer
939956605097070592,2017-12-10 20:34:52,10-12-2017 20:34:52,"(AI) #AoVivo Na Argentina, presidente Michel Temer participa da abertura da 11ª Conferência Ministerial da Organização Mundial do Comércio (OMC). Assista: https://t.co/g8QhcHFo69",../data/bases-completas/MichelTemer.csv,MichelTemer,Michel Temer
939955249787400192,2017-12-10 20:29:29,10-12-2017 20:29:29,(AI) Chefes de Estado e autoridades participam de reunião ministerial da Organização Mundial do Comércio. https://t.co/nWw6Sz2NCd,../data/bases-completas/MichelTemer.csv,MichelTemer,Michel Temer
939953287809429509,2017-12-10 20:21:41,10-12-2017 20:21:41,"(AI) Michel Temer cumprimenta o presidente argentino, @mauriciomacri, antes da reunião ministerial da Organização Mundial do Comércio, em Buenos Aires. https://t.co/yiR3FXT4u7",../data/bases-completas/MichelTemer.csv,MichelTemer,Michel Temer
939948153490563072,2017-12-10 20:01:17,10-12-2017 20:01:17,"Fui recepcionado pelo diretor-geral da @wto, Roberto Azevêdo, na chegada para a sessão de abertura da 11ª Conferência Ministerial da OMC. https://t.co/x3TYl3Spz9",../data/bases-completas/MichelTemer.csv,MichelTemer,Michel Temer
939948029599256588,2017-12-10 20:00:48,10-12-2017 20:00:48,Acabo de chegar à Argentina. Sigo para a sessão de abertura da 11ª Conferência Ministerial da OMC. https://t.co/YHWH4mwxTP,../data/bases-completas/MichelTemer.csv,MichelTemer,Michel Temer
939892540060438533,2017-12-10 16:20:18,10-12-2017 16:20:18,"Boa tarde! Embarcando para a Argentina. Mais tarde, participo da sessão de abertura da XI Conferência Ministerial da Organização Mundial do Comércio (OMC).",../data/bases-completas/MichelTemer.csv,MichelTemer,Michel Temer
939542488938893313,2017-12-09 17:09:19,09-12-2017 17:09:19,"Falei hoje com o João, filho do nosso servidor Anderson Ferreira de Aguiar e irmão do Rafael Macedo de Aguiar, barbaramente assassinados em Brasília. Transmiti à família minha solidariedade e a certeza de que a Justiça será feita. Anderson era um servidor exemplar.",../data/bases-completas/MichelTemer.csv,MichelTemer,Michel Temer
