id,datetime,created_at,text,file,twitter_handle,name
976655548350369792,2018-03-22 03:03:22,22-03-2018 03:03:22,"Foi uma reunião produtiva. Ouvi relatos de atividades sociais em curso, como os cerca de 13 mil atendimentos sociais que foram feitos na Vila Kennedy. E isto vai continuar durante a intervenção. Não basta combater a criminalidade, é preciso praticar gestos de natureza social. https://t.co/VkKD65v7Kv",../data/bases-completas/MichelTemer.csv,MichelTemer,Michel Temer
976655530008727552,2018-03-22 03:03:18,22-03-2018 03:03:18,"Me reuni, há pouco, com o interventor do Rio de Janeiro, general Braga Netto, o governador do estado, @LFPezao, e ministros do governo no Centro Integrado de Comando e Controle (CICC). https://t.co/ZE1D8PSWXz",../data/bases-completas/MichelTemer.csv,MichelTemer,Michel Temer
976568210106585093,2018-03-21 21:16:19,21-03-2018 21:16:19,"A minha política econômica está fazendo história. A taxa básica de juros, a Selic, é a menor já registrada, 6,5%, conforme decisão do Copom, hoje. E graças à inflação que continua baixando.  O resultado é mais investimentos das empresas, mais empregos e maior consumo das famílias https://t.co/AEsAuwnVvi",../data/bases-completas/MichelTemer.csv,MichelTemer,Michel Temer
976539604433154048,2018-03-21 19:22:39,21-03-2018 19:22:39,"A E-Digital foi desenvolvido por Grupo de Trabalho Interministerial, coordenado pelo Ministério da Ciência, Tecnologia, Inovações e Comunicações (@mctic), em parceria com o setor produtivo, comunidade científica e acadêmica e sociedade civil.",../data/bases-completas/MichelTemer.csv,MichelTemer,Michel Temer
976539602705141760,2018-03-21 19:22:39,21-03-2018 19:22:39,"Vamos aumentar a competitividade e a produtividade da economia brasileira com infraestrutura de redes e acesso à internet; pesquisa, desenvolvimento e inovação; confiança no ambiente digital; educação e capacitação profissional. #cdes #conselhão",../data/bases-completas/MichelTemer.csv,MichelTemer,Michel Temer
976539600255676416,2018-03-21 19:22:38,21-03-2018 19:22:38,"Assinei, agora, o decreto que institui a Estratégia Brasileira para a Transformação Digital (E-Digital). O objetivo é criar um ambiente para impactos transformadores em agricultura, comércio, educação, finanças, indústria e serviços. #cdes #conselhão https://t.co/XEbUZDB1tX",../data/bases-completas/MichelTemer.csv,MichelTemer,Michel Temer
976529736297050112,2018-03-21 18:43:26,21-03-2018 18:43:26,"No Conselhão surgiu parte de nossas agendas de reformas: modernização trabalhista, criação do Conselho Nacional p/ a desburocratização, Educação Conectada, a Política Nacional de Formação de Professores, o novo Código de Ciência e Tecnologia, que se tornaram políticas do governo. https://t.co/QD2X8J0qvv",../data/bases-completas/MichelTemer.csv,MichelTemer,Michel Temer
976529733713358849,2018-03-21 18:43:26,21-03-2018 18:43:26,"Hoje celebramos os 15 anos da criação do @cdes_brasil. Agradeço a todos, pois o #Conselhão representa o diálogo base do nosso governo. As recomendações do #CDES foram cumpridas e têm sido levadas adiante com resultados muito benéficos para o País. https://t.co/sd8CVZKYSf",../data/bases-completas/MichelTemer.csv,MichelTemer,Michel Temer
976529731880407041,2018-03-21 18:43:25,21-03-2018 18:43:25,(AI) #AoVivo Confira os anúncios da 47ª reunião plenária do Conselho de Desenvolvimento Econômico e Social (@cdes_brasil). Assista: https://t.co/ybxsy7u7Bq,../data/bases-completas/MichelTemer.csv,MichelTemer,Michel Temer
976529351649964033,2018-03-21 18:41:55,21-03-2018 18:41:55,"Queremos combater o crime em todos os estados. Como ex-secretário de segurança, sei que essas coisas não se resolvem de um dia para o outro. A presença do militar traz tranquilidade. Eu, como presidente da República, digo: não vamos medir esforços p/ estabelecer a tranquilidade.",../data/bases-completas/MichelTemer.csv,MichelTemer,Michel Temer
976529350064558081,2018-03-21 18:41:54,21-03-2018 18:41:54,"Era imperioso enfrentar a questão de segurança pública no Rio. Se não fizéssemos isso, o mesmo problema surgiria em outros estados. A intervenção federal no Rio é, desta forma, também exemplar.",../data/bases-completas/MichelTemer.csv,MichelTemer,Michel Temer
976529348185481221,2018-03-21 18:41:54,21-03-2018 18:41:54,"O meu governo não foge das grandes questões nacionais, como o desafio da  segurança pública, um dos mais sérios de nossos tempos. A intervenção  federal na segurança do Rio de Janeiro foi realizada de pleno acordo com  o governador @LFPezao.",../data/bases-completas/MichelTemer.csv,MichelTemer,Michel Temer
976527368608247810,2018-03-21 18:34:02,21-03-2018 18:34:02,"Eu vou ao Rio de Janeiro hoje anunciar recursos da ordem de R$ 1 bi para a intervenção. E aproveito para esclarecer que não há confusão de  números entre o que definimos e o que o interventor falou. Ele citou outras despesas que são da competência do estado, do governo do estado.",../data/bases-completas/MichelTemer.csv,MichelTemer,Michel Temer
976507884908482560,2018-03-21 17:16:37,21-03-2018 17:16:37,"Participo, agora, da 47ª reunião do @cdes_brasil - Conselho de Desenvolvimento Econômico e Social. Assista #aovivo: https://t.co/tw8LdZpJgW",../data/bases-completas/MichelTemer.csv,MichelTemer,Michel Temer
976173735999868931,2018-03-20 19:08:49,20-03-2018 19:08:49,"(AI) #AoVivo Presidente Michel Temer discursa na abertura da Conferência Internacional ""O Poder do Investimento na Primeira Infância para o Desenvolvimento com Equidade"" https://t.co/4c2ag3pCgN",../data/bases-completas/MichelTemer.csv,MichelTemer,Michel Temer
976163891548971013,2018-03-20 18:29:42,20-03-2018 18:29:42,"Também tratamos da situação dos venezuelanos. O que queremos é a pacificação política na Venezuela, a democracia plena nas eleições e a não agressão aos que se opõem ao regime.",../data/bases-completas/MichelTemer.csv,MichelTemer,Michel Temer
976163688871792640,2018-03-20 18:28:54,20-03-2018 18:28:54,"Na economia, verificamos com entusiasmo o aumento de 25% no comércio bilateral e identificamos que há potencial para fazer muito mais. O novo acordo comercial Mercosul/Colômbia ampliou o comércio e estamos tratando de novas oportunidades de negócios no setor privado. https://t.co/yDZTOjYUSn",../data/bases-completas/MichelTemer.csv,MichelTemer,Michel Temer
976163409401131011,2018-03-20 18:27:47,20-03-2018 18:27:47,"A visita de  @JuanManSantos realiza-se em um momento produtivo da relação #Brasil e #Colômbia. Os ministros se manifestaram sobre temas que dizem respeito aos dois países, como: segurança pública, comércio, investimentos, agricultura e questões fronteiriças. https://t.co/KhAM72qcFz",../data/bases-completas/MichelTemer.csv,MichelTemer,Michel Temer
976092578386010112,2018-03-20 13:46:20,20-03-2018 13:46:20,"(AI) Presidente Michel Temer recebe o presidente da Colômbia, @JuanManSantos. Acompanhe a cerimônia oficial de chegada #AoVivo https://t.co/VqyClHWwbu",../data/bases-completas/MichelTemer.csv,MichelTemer,Michel Temer
975865883770982400,2018-03-19 22:45:32,19-03-2018 22:45:32,O compromisso do Brasil com o desenvolvimento sustentável é histórico e está ligado ao fornecimento de água e saneamento básico à população: https://t.co/RGOACrMimc #CompartilhandoÁgua #WWF8 https://t.co/V3B9hsQraA,../data/bases-completas/MichelTemer.csv,MichelTemer,Michel Temer
975854950797529089,2018-03-19 22:02:05,19-03-2018 22:02:05,"Na reunião com o primeiro-ministro do Senegal, Mohammed Dionne, pedi para que seja retomada a negociação do Acordo de Cooperação e Facilitação de Investimentos, que está com o país africano desde 2015. O premier senegalês disse que vai consultar o andamento do estudo. https://t.co/2nb6JfgeWW",../data/bases-completas/MichelTemer.csv,MichelTemer,Michel Temer
975851844634374145,2018-03-19 21:49:44,19-03-2018 21:49:44,O entendimento entre o Meio Ambiente e a Defesa garantiu a proteção de 25% de nossas áreas marinha e costeira - meta muito além da exigida pela ONU. Nossos paraísos preservados. @SylviaEarle,../data/bases-completas/MichelTemer.csv,MichelTemer,Michel Temer
975851837386608640,2018-03-19 21:49:43,19-03-2018 21:49:43,"Compartilho com todos que assinei hoje, durante a abertura do Fórum Mundial da Água, a tão esperada criação de unidades de conservação marinha, nos arquipélagos de São Pedro e São Paulo (PE), e de Trindade e Martim Vaz (ES): https://t.co/c7ItqeA3WY https://t.co/iwBqdRY9pI",../data/bases-completas/MichelTemer.csv,MichelTemer,Michel Temer
975846349697699840,2018-03-19 21:27:54,19-03-2018 21:27:54,"Cooperação bilateral na agronomia foi o tema do meu encontro com o príncipe herdeiro do Japão, Naruhito. https://t.co/gxDKDb3pUU",../data/bases-completas/MichelTemer.csv,MichelTemer,Michel Temer
975839946153046016,2018-03-19 21:02:28,19-03-2018 21:02:28,"O presidente da Hungria falou ainda sobre ações para conservar e melhorar as águas. Um exemplo, é uma nova tecnologia que reutiliza água de esgoto com uso de algas nas estações de tratamento. https://t.co/zlK2rUsFnE",../data/bases-completas/MichelTemer.csv,MichelTemer,Michel Temer
975839927714934785,2018-03-19 21:02:23,19-03-2018 21:02:23,"Em reunião com presidente da Hungria, János Áder, agradeci o apoio dado ao acordo entre Mercosul-UE. Falei do interesse da indústria aeronáutica em atuar no mercado húngaro. https://t.co/K2SxytFCIq",../data/bases-completas/MichelTemer.csv,MichelTemer,Michel Temer
975830740154896384,2018-03-19 20:25:53,19-03-2018 20:25:53,"Estive com o premiê de Marrocos e ele demonstrou interesse em uma nova rota entre Fortaleza e Casablanca e tb na aquisição de aeronaves da @embraer por empresa aéreas marroquinas. Falamos, ainda, sobre cooperação agropecuária e apoio técnico da @embrapa. https://t.co/oNHTxKxJdw",../data/bases-completas/MichelTemer.csv,MichelTemer,Michel Temer
975827001624940544,2018-03-19 20:11:01,19-03-2018 20:11:01,"Em reunião bilateral, o presidente de Cabo Verde, Jorge Carlos de Almeida Fonseca, elogiou a recuperação econômica do Brasil e pediu, ainda, a ampliação do Programa Mais Alimentos que prevê assistência técnica e financiamento para bens de produção para agricultura familiar. https://t.co/I2pdlnrrgI",../data/bases-completas/MichelTemer.csv,MichelTemer,Michel Temer
975820860929052672,2018-03-19 19:46:37,19-03-2018 19:46:37,"Durante reunião com primeiro-ministro da Coréia, Nak-Yon Lee, falamos sobre o acordo Coréia do Sul-Mercosul. O presidente sul-coreano prometeu abrir, em breve, a negociação. Falei também sobre a inclusão do Brasil na OCDE e pedi apoio. https://t.co/lG9yMbj81y",../data/bases-completas/MichelTemer.csv,MichelTemer,Michel Temer
975802717074546691,2018-03-19 18:34:31,19-03-2018 18:34:31,"Pedi, ainda, ao @ItamaratyGovBr que organize uma missão empresarial ao país para cooperação nas áreas do turismo e da pesca. https://t.co/SqTjt20oXw",../data/bases-completas/MichelTemer.csv,MichelTemer,Michel Temer
975802701257768960,2018-03-19 18:34:28,19-03-2018 18:34:28,"Em reunião com o presidente de São Tomé e Príncipe, Evaristo do Espírito Santo Carvalho, conversamos sobre o interesse do país africano na cooperação brasileira na área da defesa. https://t.co/m7kl8e0cmf",../data/bases-completas/MichelTemer.csv,MichelTemer,Michel Temer
975758923683770368,2018-03-19 15:40:30,19-03-2018 15:40:30,(AI) #AoVivo Presidente Michel Temer discursa no almoço em homenagem aos chefes de delegação participantes do 8º Fórum Mundial da Água (@WaterForum8). Assista: https://t.co/Lr9wB2ImbL,../data/bases-completas/MichelTemer.csv,MichelTemer,Michel Temer
975739506694422528,2018-03-19 14:23:21,19-03-2018 14:23:21,Há comunidades que ainda sofrem com a seca. A integração do São Francisco vai beneficiar 12 milhões de nordestinos. Buscamos também universalizar o saneamento básico. Cabe-nos concentrar esforços para assegurar água e dignidade para todos. Esse é propósito que nos une. #WWF8 https://t.co/T6f2hA4s9E,../data/bases-completas/MichelTemer.csv,MichelTemer,Michel Temer
975739505264222209,2018-03-19 14:23:21,19-03-2018 14:23:21,Lançamos um processo de captação de recursos para a proteção de nascentes de bacias hidrográficas. Revertemos a curva de desmatamento na Amazônia e criamos duas áreas de conservação marinha. #WWF8,../data/bases-completas/MichelTemer.csv,MichelTemer,Michel Temer
975739501975953411,2018-03-19 14:23:20,19-03-2018 14:23:20,"Estamos fazendo nossa parte. Incluímos a segurança hídrica no cerne de nossas políticas públicas: implementamos o programa #PlantadoresDeRios, que usa ferramentas digitais para proteger as nascentes e rios. #WWF8 https://t.co/U4vVYDhUec",../data/bases-completas/MichelTemer.csv,MichelTemer,Michel Temer
975739500277260288,2018-03-19 14:23:19,19-03-2018 14:23:19,Sabemos que o desafio da sustentabilidade é complexo. Exige diagnóstico preciso e iniciativas consistentes e integradas entre os países. #WWF8,../data/bases-completas/MichelTemer.csv,MichelTemer,Michel Temer
975739497420910592,2018-03-19 14:23:19,19-03-2018 14:23:19,É uma honra para o Brasil sediar o #8ForumMundialDaAgua. Estamos engajados nessa causa urgente da segurança hídrica. Não temos tempo a perder. É nossa missão preservar os recursos hídricos e garantir que a água chegue a quem precisa. Assegurar água é assegurar dignidade. #WWF8 https://t.co/p06B00VGbZ,../data/bases-completas/MichelTemer.csv,MichelTemer,Michel Temer
975718935801757697,2018-03-19 13:01:36,19-03-2018 13:01:36,"Bom dia! Participo, agora, do 8º Fórum Mundial da Água. Aqui vamos ouvir e aprender com experiências e reflexões de todos os participantes. Sejam bem-vindos. Assista #aovivo https://t.co/zfDul71QAs",../data/bases-completas/MichelTemer.csv,MichelTemer,Michel Temer
975715398359412737,2018-03-19 12:47:33,19-03-2018 12:47:33,"(AI) #AoVivo No Palácio do #Itamaraty, presidente Michel Temer recebe chefes de delegações participantes do 8º Fórum Mundial da Água (@WaterForum8). Acompanhe: https://t.co/nxTf2L9wUJ  #CompartilhandoÁgua #WWF8 https://t.co/bcaZR9rugQ",../data/bases-completas/MichelTemer.csv,MichelTemer,Michel Temer
974807239432294400,2018-03-17 00:38:51,17-03-2018 00:38:51,Milhares de brasileiros estão recebendo títulos de regularização dos seus imóveis. Moradores da cidade e do campo que passam a ser os legítimos proprietários do lugar que vivem. Documentos foram entregues hoje: https://t.co/kGD7K2M3Bv https://t.co/bUIemvW718,../data/bases-completas/MichelTemer.csv,MichelTemer,Michel Temer
974742450471428097,2018-03-16 20:21:24,16-03-2018 20:21:24,"Agora, damos passo adicional, com mais 90 mil famílias que começaram a receber a titulação definitiva de sua terra, de seu lote, no campo e na cidade. https://t.co/3GD9BBrlkF",../data/bases-completas/MichelTemer.csv,MichelTemer,Michel Temer
974742447350837248,2018-03-16 20:21:23,16-03-2018 20:21:23,"É com esse espírito que damos continuidade ao mais abrangente programa de regularização de moradias que o Brasil tem visto em muitos anos. Apenas em 2017, meu governo emitiu mais títulos definitivos do que governos anteriores nos últimos 10 anos somados. https://t.co/3kNHNGCKEc",../data/bases-completas/MichelTemer.csv,MichelTemer,Michel Temer
974742444796448768,2018-03-16 20:21:23,16-03-2018 20:21:23,"Estamos prestigiando este que é valor fundamental de nossa Constituição: a promoção da dignidade humana. Porque a dignidade humana exige um lar para a família, uma habitação decente, um espaço para o trabalho honesto. https://t.co/ByP2RCoVFe",../data/bases-completas/MichelTemer.csv,MichelTemer,Michel Temer
974742441826967553,2018-03-16 20:21:22,16-03-2018 20:21:22,"Esta cerimônia simboliza mais do que a simples entrega de um documento oficial. Mais uma vez, são milhares de brasileiros que poderão, finalmente, regularizar a situação do imóvel ou da pequena propriedade rural que já ocupam e de que passam a ser os legítimos proprietários. https://t.co/jpfaZHGAyd",../data/bases-completas/MichelTemer.csv,MichelTemer,Michel Temer
974724889402920961,2018-03-16 19:11:37,16-03-2018 19:11:37,Estou em Caraguatatuba (SP) para entregar escrituras a proprietários de áreas urbanas e rurais. Acompanhe #aovivo: https://t.co/8ng9a7QPTJ,../data/bases-completas/MichelTemer.csv,MichelTemer,Michel Temer
974676672434749441,2018-03-16 16:00:01,16-03-2018 16:00:01,"Hoje, estamos entregando, em vários estados, cerca de 90 mil títulos de propriedade p/ assentados da reforma agrária e para moradores de áreas ainda não regularizadas nas cidades. Às 15h, participarei em Caraguatatuba/SP da entrega de alguns desses títulos https://t.co/v1eBTNa9Wy https://t.co/Aen3imSh7G",../data/bases-completas/MichelTemer.csv,MichelTemer,Michel Temer
974418914330456065,2018-03-15 22:55:47,15-03-2018 22:55:47,Os jovens de norte a sul do País contam a partir de agora com uma política efetiva para garantir um futuro melhor e com mais oportunidades: https://t.co/EX6iLybqM5 @SNJuventude https://t.co/CcMbCsqPRV,../data/bases-completas/MichelTemer.csv,MichelTemer,Michel Temer
974375747249848320,2018-03-15 20:04:15,15-03-2018 20:04:15,"Há que proteger, há que estimular, há que valorizar os mais de 50 milhões de jovens em nosso País. O que lançamos hoje é a pedra fundamental de uma política duradoura. #BrasilMaisJovem2018 https://t.co/fCjvnCtLCN",../data/bases-completas/MichelTemer.csv,MichelTemer,Michel Temer
974375731844263937,2018-03-15 20:04:12,15-03-2018 20:04:12,"O futuro do Brasil depende do investimento que fazemos em nossa juventude. Por isso, é com muito entusiasmo que participo desta cerimônia de lançamento do #BrasilMaisJovem2018. https://t.co/kWd0m69bWv",../data/bases-completas/MichelTemer.csv,MichelTemer,Michel Temer
974352104109289473,2018-03-15 18:30:18,15-03-2018 18:30:18,(AI) #AoVivo Presidente Michel Temer participa do lançamento do #BrasilMaisJovem2018. Assista: https://t.co/3oYlCnSjNC @SNJuventude,../data/bases-completas/MichelTemer.csv,MichelTemer,Michel Temer
974311414860042240,2018-03-15 15:48:37,15-03-2018 15:48:37,"Nesses 22 meses de governo, resolvemos enfrentar os grandes desafios do Brasil. Fizemos reformas há muito tempo necessárias e levamos adiante projetos abandonados. Vamos continuar trabalhando para uma vida melhor em nossas cidades, em nosso País. https://t.co/0XeWr2aSIh",../data/bases-completas/MichelTemer.csv,MichelTemer,Michel Temer
974310180648357888,2018-03-15 15:43:43,15-03-2018 15:43:43,"A retomada das obras do BRT de Goiânia que anunciamos hoje é o tipo de investimento que tem impacto direto na qualidade de vida das pessoas. Ela estava paralisada e, quando entregue, vai melhorar o transporte público e diminuir o tempo de deslocamento da população. https://t.co/XCzQhKvrdq",../data/bases-completas/MichelTemer.csv,MichelTemer,Michel Temer
974290730360492032,2018-03-15 14:26:26,15-03-2018 14:26:26,(AI) #AoVivo Presidente Michel Temer participa da cerimônia de anúncio de retomada das obras do BRT de Goiânia (GO). Assista: https://t.co/ysaQoUqRIy,../data/bases-completas/MichelTemer.csv,MichelTemer,Michel Temer
974288435702849537,2018-03-15 14:17:19,15-03-2018 14:17:19,O ministro @Raul_Jungmann estará no Rio de Janeiro para acompanhar as investigações sobre a morte da vereadora Marielle Franco e o motorista Anderson. Trata-se de um atentado ao estado de direito e à democracia. https://t.co/X6WwXVRjrX,../data/bases-completas/MichelTemer.csv,MichelTemer,Michel Temer
974249438620381184,2018-03-15 11:42:21,15-03-2018 11:42:21,"Pedi ao ministro @Raul_Jungmann para colocar a @policiafederal à disposição para auxiliar o interventor do estado do Rio de Janeiro, general Walter Braga Neto, na investigação. Esse crime não ficará impune.",../data/bases-completas/MichelTemer.csv,MichelTemer,Michel Temer
974249436032520192,2018-03-15 11:42:20,15-03-2018 11:42:20,"Lamento esse ato de extrema covardia contra a vereadora Marielle Franco. Solidarizo-me com familiares e amigos, e acompanho a apuração dos fatos para a punição dos autores desse crime.",../data/bases-completas/MichelTemer.csv,MichelTemer,Michel Temer
974094476393230336,2018-03-15 01:26:35,15-03-2018 01:26:35,Assinei hoje decreto que regulamenta a Política Nacional de Biocombustíveis. Lei prevê a expansão do uso de etanol e biodiesel na matriz energética do País. Nosso governo sabe que cuidar do meio ambiente é garantir o futuro: https://t.co/Zh0Qg3rM7n https://t.co/o3lcOsAS6C,../data/bases-completas/MichelTemer.csv,MichelTemer,Michel Temer
974056383355211776,2018-03-14 22:55:13,14-03-2018 22:55:13,"Com o #RenovaBio, damos previsibilidade a plantadores, fornecedores, usineiros, distribuidores – a todos os envolvidos no processo produtivo. É mais segurança para quem investe, para quem gera riqueza e empregos em nosso campo. https://t.co/eAHkY7iWAO",../data/bases-completas/MichelTemer.csv,MichelTemer,Michel Temer
974056380800950277,2018-03-14 22:55:12,14-03-2018 22:55:12,"Disso trata a Política Nacional de Biocombustíveis, o #RenovaBio. Plano que promove a segurança energética e protege o meio ambiente. Se o Brasil é, hoje, referência internacional no combate à mudança do clima, muito se deve a nossa indústria de biocombustíveis. https://t.co/OPGM42lDAx",../data/bases-completas/MichelTemer.csv,MichelTemer,Michel Temer
974056377286057984,2018-03-14 22:55:12,14-03-2018 22:55:12,"Sempre digo que a agropecuária é motivo de orgulho. O setor cresceu 13% em 2017, contribuição decisiva para a retomada do crescimento, o que se traduz em tecnologia, em emprego e em desenvolvimento. Por isso, não podemos descansar: é preciso fazer sempre mais e melhor. https://t.co/G0nVZczrYx",../data/bases-completas/MichelTemer.csv,MichelTemer,Michel Temer
974056374509428736,2018-03-14 22:55:11,14-03-2018 22:55:11,"Este evento é uma injeção de otimismo, é prova cabal de que estamos na vanguarda da agroindústria e dos biocombustíveis. É a união de esforços entre todos aqueles que fazem do setor sucroalcooleiro um dos mais modernos de nossa agricultura, de nossa economia. https://t.co/S0sV98FLDN",../data/bases-completas/MichelTemer.csv,MichelTemer,Michel Temer
974039626422935554,2018-03-14 21:48:38,14-03-2018 21:48:38,"Já estou em Ribeirão Preto (SP) para participar da Conferência “Abertura da Safra de Cana, Açúcar e Etanol 2018/19”. Assista #aovivo: https://t.co/QX3SslhgyL #aberturadesafracana",../data/bases-completas/MichelTemer.csv,MichelTemer,Michel Temer
974029010421284864,2018-03-14 21:06:27,14-03-2018 21:06:27,"Nestes 22 meses de governo, tiramos o País da recessão e trouxemos mais otimismo para todos. Eu afirmo: O Brasil voltou e está crescendo. Não há como recuar: https://t.co/bfJatociTZ https://t.co/NcJCQD1ny5",../data/bases-completas/MichelTemer.csv,MichelTemer,Michel Temer
974002177092894720,2018-03-14 19:19:49,14-03-2018 19:19:49,"@DefesaGovBr @MEC_Comunicacao @mctic @governodobrasil Que contribuição imensa o programa dará para o País! É a modernização aliada a diversos setores importantes para a sociedade. Hoje, nós podemos comemorar algo que diz respeito aos países mais avançados do mundo e oferecer. #InternetParaTodos.",../data/bases-completas/MichelTemer.csv,MichelTemer,Michel Temer
973944356322324481,2018-03-14 15:30:04,14-03-2018 15:30:04,"O povo sabe que é a responsabilidade que traz equilíbrio às contas, traz crescimento e empregos. Sabe que é a responsabilidade que viabiliza políticas sociais. Afirmo sem meias-palavras: não há margem para retrocessos. https://t.co/bH6ZiB1Plb",../data/bases-completas/MichelTemer.csv,MichelTemer,Michel Temer
973944353252151297,2018-03-14 15:30:03,14-03-2018 15:30:03,"Tudo o que fizemos só foi possível porque, desde o princípio, fizemos do diálogo a matéria-prima de nosso governo. Está mais do que provado, no Brasil, que é a responsabilidade que dá resultado. Por isso, reitero o convite: invistam no Brasil. https://t.co/bCw771pAOC",../data/bases-completas/MichelTemer.csv,MichelTemer,Michel Temer
973944350186057730,2018-03-14 15:30:02,14-03-2018 15:30:02,"Adotamos modelo de parcerias que assegura marco regulatório estável e previsível. Até o final do governo, terão sido 145 projetos licitados à iniciativa privada. São oportunidades para as quais convido cada um dos aqui presentes. Invistam no Brasil. Investir no Brasil é ganhar. https://t.co/4YRX9ibDZs",../data/bases-completas/MichelTemer.csv,MichelTemer,Michel Temer
973944347518558209,2018-03-14 15:30:02,14-03-2018 15:30:02,"Levamos adiante ampla agenda de desburocratização. Eliminamos procedimentos, simplificamos processos, automatizamos registros. Tudo para que fique mais fácil abrir ou fechar uma empresa, importar ou exportar um produto. https://t.co/b4FEtscfPY",../data/bases-completas/MichelTemer.csv,MichelTemer,Michel Temer
973944344410509312,2018-03-14 15:30:01,14-03-2018 15:30:01,"Este Fórum se realiza em um momento de grandes transformações no Brasil. Tudo isso, graças a uma agenda de reformas que é das mais amplas e necessárias, mas que até hoje não tinha sido implementada. https://t.co/98y3MEIIRN",../data/bases-completas/MichelTemer.csv,MichelTemer,Michel Temer
973929678716194816,2018-03-14 14:31:44,14-03-2018 14:31:44,"Participo, agora, da abertura oficial do Fórum Econômico Mundial @wef. Assista #aovivo: https://t.co/JU9KUSSXT6 https://t.co/ff4NskksUC",../data/bases-completas/MichelTemer.csv,MichelTemer,Michel Temer
973875235022884864,2018-03-14 10:55:24,14-03-2018 10:55:24,"Acabo de ler nos jornais que morreu hoje o físico britânico Stephen Hawking, um dos cientistas mais brilhantes de sua geração, cujo o trabalho e legado viverão por muito tempo. A ciência e o mundo perdem um grande aliado.",../data/bases-completas/MichelTemer.csv,MichelTemer,Michel Temer
